title,link,summary,published
PennAero and Tinicum Announce Acquisition of TriMas Aerospace,https://www.citybiz.co/article/768065/pennaero-and-tinicum-announce-acquisition-of-trimas-aerospace/,"...components for mission-critical applications across the global commercial aerospace and defense industries. Backed by a portfolio of trusted brands, including Monogram Aerospace Fasteners , Allfast Fastening Systems , Mac Fasteners , TFI...","Wed, 05 Nov 2025 00:42:27 GMT"
...Flawed System of US Citizenship Acquisition and...,https://realfreenews.blogspot.com/2025/11/undermining-american-sovereignty-flawed.html,...disqualifies applicants.Joining a foreign military engaged in conflict with the United States leads to loss if intent is... Investigate and prosecute individuals for participation in foreign military actions or support for designated terrorist...,"Tue, 04 Nov 2025 17:49:00 GMT"
"Skyworks Solutions Soars Past Q4 Estimates, Forges New Horizon with Qorvo Merger",https://kbjr.marketminute.com/article/tokenring-2025-11-4-skyworks-solutions-soars-past-q4-estimates-forges-new-horizon-with-qorvo-merger,"...to capitalize on high-growth segments such as AI data centers, 5G infrastructure, defense, automotive, and edge IoT, fundamentally reshaping the competitive dynamics of the RF and analog semiconductor sector.Financial Strength and a Strategic...","Tue, 04 Nov 2025 23:09:54 GMT"
Kratos Adding To Satellite Communications Suite With Acquisition Of Orbit Technologies,https://www.defensedaily.com/kratos-adding-to-satellite-communications-suite-with-acquisition-of-orbit-technologies/business-financial/,"Kratos Defense & Security Solutions [KTOS] on Tuesday said it has agreed to acquire ... forces, prime contractors and emerging defense and space companies in Israel, the U.S., Europe...","Tue, 04 Nov 2025 21:39:41 GMT"
"Diaz-Balart, Gimenez, and Mills Urge U.S. Army to Keep Florida as Home of Army Acquisition HQ",https://mariodiazbalart.house.gov/media-center/press-releases/diaz-balart-gimenez-and-mills-urge-us-army-keep-florida-home-army,"We must harness that advantage to ensure our servicemembers and defense industry partners have unmatched access to the ... strengthen Americas readiness, deepen our defense partnerships, and support thousands of high-skilled jobs that power both...","Tue, 04 Nov 2025 21:36:10 GMT"
Canopy Aerospace & Defense Expanding Global Reach With Acquisition Of Tods Technology,https://pulse2.com/canopy-aerospace-defense-expanding-global-reach-with-acquisition-of-tods-technology/,"Canopy Aerospace & Defense (Canopy A&D), a portfolio company of Trive Capital, announced its acquisition ... and acoustic materials for the maritime defense industry. The acquisition marks a significant expansion of Canopy A&Ds...","Tue, 04 Nov 2025 21:12:12 GMT"
