title,link,summary,published
Deportivo Cali Sets Sights on Global Talent Acquisition,https://www.archyworldys.com/diy-pallet-projects-easy-affordable-ideas-481/,"...for Deportivo Cali is reinforcing its defense. The team, currently positioned 13th in the Colombian Primera Division with a...","Sat, 22 Nov 2025 03:11:44 GMT"
"Cubs non-tender a once-promising trade acquisition, freeing up another bullpen spot",https://cubbiescrib.com/cubs-non-tender-a-once-promising-trade-acquisition-freeing-up-another-bullpen-spot,"With one of the league's best run prevention defenses, the Cubs could look to ride the tried and true recipe of pitching and defense back to a second playoff appearance in as many...","Fri, 21 Nov 2025 23:54:26 GMT"
"Senior Program Management and Acquisition Support (Top Secret) in Location Albuquerque, New Mexico",https://www.energyjobline.com/job/senior-program-management-and-acquisition-support-top-secret-27502075,"...significant impact in the field of space defense and working on projects that matter, we encourage you to apply and join our...","Fri, 21 Nov 2025 22:56:53 GMT"
Critical Metals Corp. (CRML) Stock: Drops Despite Strategic $20M Copper Powder Acquisition,https://parameter.io/critical-metals-corp-crml-stock-drops-despite-strategic-20m-copper-powder-acquisition/,"TLDR:CRMLs $20M copper acquisition aims to boost defense and tech supply chains. Despite acquisition, CRMLs stock... Strategic acquisition positions CRML for long-term growth in aerospace and defense. CRMLs copper acquisition could power...","Fri, 21 Nov 2025 22:53:09 GMT"
US Air Force names general to oversee major acquisition programs,https://www.defensenews.com/air/2025/11/21/us-air-force-names-general-to-oversee-major-acquisition-programs/,"...Deputy Defense Secretary Steve Feinberg to ensure centralized oversight and accelerated delivery of major defense ... warfighters, and are meant to support Defense Secretary Pete Hegseths department-wide acquisition reforms.It also...","Fri, 21 Nov 2025 22:03:51 GMT"
Client Alert: Department of War Announces Broad Acquisition Reform Initiatives,https://www.jdsupra.com/legalnews/client-alert-department-of-war-5235100/,"...strategy directing systemic reform across the defense acquisition landscape. The overarching theme of these reform ... transparency, and more efficiently deliver defense articles and services to US allies and partners. Some of these...","Fri, 21 Nov 2025 20:01:07 GMT"
...Armaments Consortium Names Defense Acquisition Leader Don Palathinkal Director of Customer...,https://lifestyle.porchandparish.com/story/108035/national-armaments-consortium-names-defense-acquisition-leader-don-palathinkal-director-of-customer-affairs/,"Don brings more than two decades of experience in defense acquisition, program management, and armaments technology ... AC), including within the Department of Defense Ordnance Technology Consortium (DOTC) office. During his tenure at DOTC, he...","Fri, 21 Nov 2025 18:49:39 GMT"
"...Ignites Growth with Crescent Mine Acquisition and Upsized Capital Raise, Targeting Silver and...",https://uniondemocrat.marketminute.com/article/marketminute-2025-11-21-americas-gold-and-silver-ignites-growth-with-crescent-mine-acquisition-and-upsized-capital-raise-targeting-silver-and-antimony-dominance,"Recognizing antimony as a critical mineral for U.S. national defense and economic security, the company is pursuing ... mineral and its importance for national defense and technology, increased domestic production could reduce reliance on...","Fri, 21 Nov 2025 18:40:53 GMT"
CRML Secures One of the Largest Strategic Stockpiles of Ultra-High-Purity Copper Powder in a US$20M All-Share Acquisition Issued at a 40% Premium to Market,https://www.globenewswire.com/news-release/2025/11/21/3192887/0/en/CRML-Secures-One-of-the-Largest-Strategic-Stockpiles-of-Ultra-High-Purity-Copper-Powder-in-a-US-20M-All-Share-Acquisition-Issued-at-a-40-Premium-to-Market.html,"This Strengthens Our Role in Defense, Aerospace & Advanced Technology Supply Chains This Strengthens Our Role in Defense, Aerospace & Advanced Technology Supply Chains","Fri, 21 Nov 2025 15:50 GMT"
