title,link,summary,published
TDI Strengthens Cybersecurity Leadership with Strategic Acquisition of Gray Tier Technologies,https://www.einpresswire.com/article/822822869/tdi-strengthens-cybersecurity-leadership-with-strategic-acquisition-of-gray-tier-technologies,"This acquisition significantly expands our customer footprint into key federal defense, civil, and intelligence agencies, positioning TDI for substantial growth and increased market impact. Gray Tiers singular commitment to cybersecurity and...","Tue, 17 Jun 2025 04:52:55 GMT"
US Green Lights Malaysia's Acquisition of Kuwaiti F/A-18 Hornet Fleet,https://www.aeronewsjournal.com/2025/06/us-green-lights-malaysias-acquisition.html,"arms transfer protocols, ensuring that sensitive military technology is managed responsibly. The deal involves ... modernize its aging fleet and enhance its air defense capabilities.Malaysias interest in Kuwaits F/A-18 Hornets dates...","Tue, 17 Jun 2025 02:10:00 GMT"
"An informed PS5 online game the brand new, 4 of a king casino pre-acquisition & then",https://www.nerverush.com/an-informed-ps5-online-game-the-brand-new-4-of-a-king-casino-pre-acquisition-then/,"...on-line casino one to aligns along with your defense standard. The new laws are quite not the same as a basic on-line ... inside for every class, such incentives, defense, otherwise repayments. If you would like discover easiest gambling...","Tue, 17 Jun 2025 00:53:09 GMT"
"...at the G7 reunion, about the acquisition of American weapons by...",https://knews.media/2025/06/17/zelenski-wants-to-talk-to-trump-at-the-g7-reunion-about-the-acquisition-of-american-weapons-by-ukraine/,"...Trump about the acquisition by Kiev of US military material, on the occasion of a meeting, still unconfirmed between the two ... President Trump during the meeting is the defense package that Ukraine is ready to buy,"" said Ukrainian president during the...","Mon, 16 Jun 2025 23:25:17 GMT"
$201M Green Energy Tech SPAC Blue Acquisition Completes Nasdaq IPO | BACCU Stock News,https://www.stocktitan.net/news/BACCU/blue-acquisition-corp-completes-201-250-000-initial-public-v0eglky1und8.html,...four-star General Wesley Clark among the board members. This blend of corporate and military leadership suggests connections across both private and public sectors that could benefit target identification and post-merger operations.BTIG served as...,"Mon, 16 Jun 2025 20:05:00 GMT"
"Promotions, acquisition awards highlighted in latest Team Hanscom Today episode",https://www.hanscom.af.mil/News/Article-Display/Article/4217988/promotions-acquisition-awards-highlighted-in-latest-team-hanscom-today-episode/,"The annual award honors Department of Defense acquisition programs that demonstrate innovation and excellence in delivering operational capabilities aligned with the National Defense Strategy.Additionally, the Cyber and Networks Directorates...","Mon, 16 Jun 2025 19:58:24 GMT"
Supernus Pharmaceuticals Announces Acquisition of Sage Therapeutics to Enhance CNS Portfolio and...,https://www.nasdaq.com/articles/supernus-pharmaceuticals-announces-acquisition-sage-therapeutics-enhance-cns-portfolio-and,"...litigation in connection with the proposed transaction may result in significant costs of defense, indemnification and liability; the failure of the closing conditions set forth in the acquisition agreement to be satisfied or waived; Supernus...","Mon, 16 Jun 2025 11:12:00 GMT"
"Davie Poised to Acquire Texas Shipyards, Accelerating U.S. Icebreaker Production The Globe",https://the-globe.info/2025/06/16/davie-poised-to-acquire-texas-shipyards-accelerating-u-s-icebreaker-production/,"...to transform the landscape of maritime defense and naval logistics, Davie Shipbuilding has announced its acquisition of ... essential for missions spanning exploration, defense, and scientific research.Key Advantages Driving Innovation and...","Mon, 16 Jun 2025 13:56:46 GMT"
"Supernus Pharmaceuticals to Acquire Sage Therapeutics, Strengthening its Neuropsychiatry Product...",https://www.biospace.com/press-releases/supernus-pharmaceuticals-to-acquire-sage-therapeutics-strengthening-its-neuropsychiatry-product-portfolio,"...litigation in connection with the proposed transaction may result in significant costs of defense, indemnification and liability; the failure of the closing conditions set forth in the acquisition agreement to be satisfied or waived; Supernus...","Mon, 16 Jun 2025 13:53:10 GMT"
Redwire completes Edge Autonomy acquisition,https://intelligencecommunitynews.com/redwire-completes-edge-autonomy-acquisition/,...space and defense tech company focused on the convergence of integrated autonomous operations for defense and national ... platformstwo of the fastest growing trends in defense technology.The companys technology portfolios bridge the gap...,"Mon, 16 Jun 2025 12:52:14 GMT"
PMGC Holdings Inc. Positioned for Growth with Strategic Acquisition,https://investorshangout.com/pmgc-holdings-inc-positioned-for-growth-with-strategic-acquisition-304500-/,"This company has been serving the aerospace, defense, and industrial markets for over 35 years, demonstrating both ... businesses engaging with major aerospace and defense contractors.Understanding the Customer BaseThis CNC machining...","Mon, 16 Jun 2025 12:07:03 GMT"
ScioTeq Acquisition: Tikehau Capital Buys Defense Display Leader From OpenGate | TDG Stock News,https://www.stocktitan.net/news/TDG/open-gate-capital-enters-into-binding-agreement-to-sell-scio-teq-to-i36oxq7djjaj.html,"...displays for the aviation and defense industries, to the aerospace and defense fund of global alternative asset manager ... computing solutions for the aviation, defense and air traffic control markets. With sales, engineering and manufacturing...","Mon, 16 Jun 2025 12:05:00 GMT"
"SUPN) Supernus Pharmaceuticals to Acquire Sage Therapeutics, Strengthening its Neuropsychiatry...",https://app.researchpool.com/company/supn-us8684591089-supernus-pharmaceuticals-lDiOnsuyYP/press/supn-supernus-pharmaceuticals-to-acquire-sage-therapeutics-strengthening-it-A2Dcnh9T1o,"...litigation in connection with the proposed transaction may result in significant costs of defense, indemnification and liability; the failure of the closing conditions set forth in the acquisition agreement to be satisfied or waived; Supernus...","Mon, 16 Jun 2025 11:22:01 GMT"
Eaton (ETN) to Acquire Ultra PCS Limited for $1.55 Billion | ETN Stock News,https://www.gurufocus.com/news/2928064/eaton-etn-to-acquire-ultra-pcs-limited-for-155-billion-etn-stock-news,"...Ultra Group. This strategic move aims to enhance Eaton's offerings in both the military and civilian aerospace markets. The acquisition is valued at $1.55 billion and is anticipated to be beneficial to Eatons high-margin businesses, reinforcing...","Mon, 16 Jun 2025 11:17:00 GMT"
