title,link,summary,published
Army pares back peer reviews as part of acquisition policy revamp,https://federalnewsnetwork.com/army/2025/08/army-pares-back-peer-reviews-as-part-of-acquisition-policy-revamp/,"He said the bigger challenge and the more time-consuming one is the way all the military services currently define their requirements.The way that technology is infusing our systems now, its no longer just a tank that shoots. Its almost a...","Mon, 25 Aug 2025 23:29:17 GMT"
The Art Of Acquisition,https://www.army.mil/article/287121/the_art_of_acquisition,"...which, according to Defense Acquisition University, means acquire and modernize military unique programs that provide ... Security +; she is currently working on her Defense Acquisition Workforce Improvement Act program management Practitioner...","Mon, 25 Aug 2025 21:08:04 GMT"
Understanding the OASIS+ Suite of Governmentwide Acquisition Contracts,https://www.same.org/event/understanding-the-oasis/,...OASIS+ is one contract vehicle that is gaining the attention of the Department of Defense and Civilian Agencies alike as an additional tool in their contracting toolbox. Interested in learning what OASIS+ is and how your firm can obtain a contract?...,"Mon, 25 Aug 2025 21:32:05 GMT"
...hinted to enhance military cooperation with Morocco and the acquisition of F-35 ghost...,https://www.elrisala.com/the-us-state-department-hinted-to-enhance-military-cooperation-with-morocco-and-the-acquisition-of-f-35-ghost-fighters/,"...g of military and economic cooperation, including negotiations for the acquisition of F-35 fighters. Arab Defense website ... enhance military cooperation with Morocco and the acquisition of F-35 ghost fighters first on the Arab defense site. For...","Mon, 25 Aug 2025 21:27:54 GMT"
Amphenol Secures $4 Billion for CommScope Acquisition,https://blog.tipranks.com/amphenol-secures-4-billion-for-commscope-acquisition/,"...commercial aerospace, industrial, information technology and data communications, military, mobile devices, and mobile...","Mon, 25 Aug 2025 21:05:36 GMT"
"Defense Acquisition Reform ... Caution With Pentagon-led Re-dos, Rely Much...",https://armedforces.press/defense-acquisition-reform-caution-with-pentagon-led-re-dos-rely-much-more-on-individual-service-authorities/,"However, the Defense Departments acquisition process is so overloaded with Office of the Secretary of Defense as well as... ...General Lohs full article can be read here. Defense AT & L Magazine critcized the top-down Pentagon hierarchical...","Mon, 25 Aug 2025 20:29:46 GMT"
Senior Acquisition Logistics Manager,https://www.virtualvocations.com/job/senior-acquisition-logistics-manager-2699936-i.html,...directly related experience At least 5 years of experience must be in the Department of Defense (DoD) Knowledge of lifecycle sustainment planning and logistics processes Experience in managing logistics projects and evaluating program...,"Mon, 25 Aug 2025 19:54:54 GMT"
Acquisition Transformation,https://www.sei.cmu.edu/acquisition-transformation/,...Defense acquisition is the set of processes the DoD uses to obtain the systems and services necessary to support defense ... foundational Defense Innovation Board study and work on the design and execution of the FY18 National Defense Authorization...,"Mon, 25 Aug 2025 16:38:22 GMT"
Enhancing Intelligence Gathering with Data Acquisition Systems and Video Enhancing Software,https://cashpvtr51628.pages10.com/enhancing-intelligence-gathering-with-data-acquisition-systems-and-video-enhancing-software-72309619,"...tracking.This integrated approach supports military operations, law enforcement, and private security agencies in ... While commonly used by law enforcement and military units, private investigators, security firms, and even insurance fraud...","Mon, 25 Aug 2025 15:19:21 GMT"
Lions Expected to Acquire Anfernee Jennings for Edge Defense Boost,https://bvmsports.com/2025/08/25/lions-expected-to-acquire-anfernee-jennings-for-edge-defense-boost/,"...to Acquire Anfernee Jennings for Edge Defense BoostAnfernee Jennings recorded nine quarterback knockdowns last season on ... trade for Jennings soon, bolstering their defense ahead of the season. This strategic acquisition may signal further roster...","Mon, 25 Aug 2025 14:43:01 GMT"
"Cemtrex Signs LOIs to Acquire Robotics, Aerospace Firms for $18M Revenue | CETX Stock News",https://www.stocktitan.net/news/CETX/cemtrex-signs-letters-of-intent-for-two-strategic-acquisitions-in-6k4ra4yjn63m.html,based companies in robotics integration and aerospace/defense systems engineering. The acquisitions are expected to ... l'ingenierie de systemes aerospatiaux et de defense. Les acquisitions devraient apporter 15-18 M$ de chiffre d'affaires...,"Mon, 25 Aug 2025 13:10:00 GMT"
Cemtrex's Strategic Acquisition Plans to Amplify Growth,https://investorshangout.com/cemtrexs-strategic-acquisition-plans-to-amplify-growth-371733-/,"...and productivity in these vital industries.Aerospace and Defense IntegrationThe second opportunity lies in the aerospace and defense sector, focusing on systems engineering. This business specializes in delivering high-reliability communications...","Mon, 25 Aug 2025 12:38:02 GMT"
Cemtrex Signs Letters of Intent for Two Strategic Acquisitions in Robotics and Aerospace,https://www.globenewswire.com/news-release/2025/08/25/3138535/0/en/Cemtrex-Signs-Letters-of-Intent-for-Two-Strategic-Acquisitions-in-Robotics-and-Aerospace.html,New Acquisitions Expected to Drive Total Annual Revenues to $100M and Expand Operating Profit New Acquisitions Expected to Drive Total Annual Revenues to $100M and Expand Operating Profit,"Mon, 25 Aug 2025 13:10 GMT"
