title,link,summary,published
Houston Texans Acquire Player From New England Patriots in Trade,https://www.newsdirectory3.com/houston-texans-acquire-player-from-new-england-patriots-in-trade/,"Impact on Team RostersFor the Houston Texans, the acquisition provides additional depth at the linebacker position for a defense that is regarded as one of the strongest in the league.For the New England Patriots, the trade creates an...","Wed, 08 Apr 2026 01:40:45 GMT"
Lundin Mining Completes Acquisition of Caserones and Los Helados Project Interests,https://www.world-today-news.com/lundin-mining-completes-acquisition-of-caserones-and-los-helados-project-interests/,...expectations.One sentence defines the current era of mining: scale is the only real defense against volatility.Operational Synergy and the Path to ProductionThe integration of these interests will likely trigger a review of current operational...,"Wed, 08 Apr 2026 01:35:37 GMT"
"Steyr Motors Completes BUKH Acquisition, Expands Marine and Defense Portfolio",https://www.citybuzz.co/2026/04/07/steyr-motors-completes-bukh-acquisition-expands-marine-and-defense-portfolio/,"...strategic expansion in mission-critical defense and marine applications. The initial consolidation of the BUKH Group will ... quantum leap for the companys marine and defense business, noting that portfolio expansion, access to new markets, and...","Tue, 07 Apr 2026 21:11:12 GMT"
Steyr Motors AG Completes the Acquisition of BUKH A/S Important Step Into New Markets With High...,https://www.newmediawire.com/news/steyr-motors-ag-completes-the-acquisition-of-bukh-a-s-important-step-into-new-markets-with-high-synergy-potential-7086250,"...density and durability. The Companys engines are primarily used for military special vehicles, boats (both military and civilian) and as auxiliary power units (APU) for main battle tanks and locomotives.For further information, please...","Tue, 07 Apr 2026 19:11:12 GMT"
"Steyr Motors AG Completes Acquisition of BUKH A/S, Expanding Marine and Defense Portfolio",https://www.newsworthy.ai/curated/steyr-motors-ag-completes-acquisition-of-bukh-a-s-expanding-mari/202630653,"...Acquisition of BUKH A/S, Expanding Marine and Defense PortfolioSteyr Motors AG has completed its acquisition of Danish ... strengthening its position in marine and defense markets through enhanced production capabilities and international market...","Tue, 07 Apr 2026 19:11:00 GMT"
"Acquisition Reform Is Materializing, but the Harder Test Still Lies Ahead",https://www.icitech.org/post/acquisition-reform-is-materializing-but-the-harder-test-still-lies-ahead,"...the United States pressing military industrial needs and the defense manufacturing sector it currently has.Broader ... budgets, and defense-industrial dynamics for the advisory and ICIT.He draws on experience with the Defense-Industrial...","Tue, 07 Apr 2026 16:38:41 GMT"
Global Merger Control Trends And Outlook 2025 2026 | White & Case LLP - JDSupra,https://www.jdsupra.com/legalnews/global-merger-control-trends-and-6322825/,"...all routes, with most relating to Defence, Critical Suppliers to Government and Military & Dual-Use, and UK investors accounting for the largest share of notifications and call-ins. Despite numerous unapproved notifiable transactions being...","Tue, 07 Apr 2026 19:03:35 GMT"
TransDigm completes $2.2B aerospace parts acquisition,https://au.investing.com/news/company-news/transdigm-completes-22b-aerospace-parts-acquisition-93CH-4350017,"TransDigm Group designs, produces and supplies aircraft components for commercial and military aircraft through its wholly-owned subsidiaries. The company maintains impressive gross profit margins of nearly 60% on revenue of $9.11 billion over the...","Tue, 07 Apr 2026 17:22:10 GMT"
TransDigm Completes Acquisition of Jet Parts Engineering and Victor Sierra Aviation Holdings,https://xpr.media/story/724971/transdigm-completes-acquisition-of-jet-parts-engineering-and-victor-sierra-aviation-holdings/,"...components for use on nearly all commercial and military aircraft in service today. Major product offerings, substantially ... customers; the United States (U.S.) defense budget and risks associated with being a government supplier including...","Tue, 07 Apr 2026 16:56:28 GMT"
...Expands Modular Platform With Acquisition Of B.i.g...,https://www.miningstockeducation.com/2026/04/heartwood-partners-portfolio-company-vitalspace-expands-modular-platform-with-acquisition-of-b-i-g-enterprises/,"Together, these four brands serve a broad set of end markets including data centers, government and defense, commercial security, healthcare, and public safety positioning VITALSpace as a diversified, multi-vertical modular platform with...","Tue, 07 Apr 2026 16:20:59 GMT"
...EXPANDS MODULAR PLATFORM WITH ACQUISITION OF B.I.G ENTERPRISES PR...,https://pr.southjordanjournal.com/article/HEARTWOOD-PARTNERS-PORTFOLIO-COMPANY-VITALSPACE-EXPANDS-MODULAR-PLATFORM-WITH-ACQUISITION-OF-BIG-ENTERPRISES?storyId=69d523d20f25261839c23d89,"Together, these four brands serve a broad set of end markets including data centers, government and defense, commercial security, healthcare, and public safety positioning VITALSpace as a diversified, multi-vertical modular platform with...","Tue, 07 Apr 2026 15:52:28 GMT"
LEGACY OF EXCELLENCE: ARMY RECOGNIZES 2025 ACQUISITION HALL OF FAME INDUCTEES,https://www.army.mil/article/291127/legacy_of_excellence_army_recognizes_2025_acquisition_hall_of_fame_inductees,"Thats the level of contribution represented by the five leaders we recognize today, said Ingraham.Ingraham and Lt. Gen. Robert M. Collins, principal military deputy to the ASA(ALT) and director, Army Acquisition Corps presented the awards to...","Tue, 07 Apr 2026 15:19:19 GMT"
Nvidia Completes SchedMD Acquisition Amid Industry Concerns Over Open-Source AI Neutrality,https://iverifyu.com/nvidia-completes-schedmd-acquisition-amid-industry-concerns-over-open-source-ai-neutrality/,...leaving users with no viable alternative to the Nvidia-maintained version.Nvidias Defense and Strategic RationaleNvidia has moved to address industry skepticism by stating that Slurm will remain both open-source and vendor-neutral. According to...,"Tue, 07 Apr 2026 14:35:25 GMT"
Reverse merger boosts shares of this micro cap as company expands beyond logistics,https://www.msn.com/en-ca/money/topstories/reverse-merger-boosts-shares-of-this-micro-cap-as-company-expands-beyond-logistics/ar-AA20m1ik,"This expansion is being fueled by heightened security concerns worldwide, increased government and defense spending, tighter construction safety standards, and mandates for ballistic-resistant materials in public and high-risk environments...","Tue, 07 Apr 2026 14:32:00 GMT"
RRE Ventures Acquisition Corp.,https://www.iposcoop.com/ipo/rre-venture-acquistion/,"We will search for a target company that complements our management teams and sponsors background in technology, defense and space, robotics, quantum computing, professional sports, AI, energy, power, and other transformative sectors.(Note: RRE...","Mon, 06 Apr 2026 20:05:29 GMT"
Booz Allen Completes Acquisition of Defy Security,https://www.01net.it/booz-allen-completes-acquisition-of-defy-security/,"About Booz Allen HamiltonBooz Allen is the advanced technology company delivering outcomes with speed for Americas most critical defense, civil, and national security priorities. We build technology solutions using AI, cyber, and cutting-edge...","Tue, 07 Apr 2026 15:00:00 GMT"
TransDigm Concludes Acquisition of Jet Parts Engineering and Victor Sierra Aviation...,https://third-news.com/article/7e452768-3291-11f1-989a-9ca3ba0a67df,...supplying critically engineered products used in nearly all active commercial and military aircraft. The company's extensive portfolio includes a wide range of products from mechanical actuators and specialized pumps to complex avionics systems...,"Tue, 07 Apr 2026 14:53:09 GMT"
...EXPANDS MODULAR PLATFORM WITH ACQUISITION OF B.I.G ENTERPRISES PR Newswire Today at 3:30pm...,https://smb.leaderpub.com/article/HEARTWOOD-PARTNERS-PORTFOLIO-COMPANY-VITALSPACE-EXPANDS-MODULAR-PLATFORM-WITH-ACQUISITION-OF-BIG-ENTERPRISES?storyId=69d523d20f25261839c23d89,"Together, these four brands serve a broad set of end markets including data centers, government and defense, commercial security, healthcare, and public safety positioning VITALSpace as a diversified, multi-vertical modular platform with...","Tue, 07 Apr 2026 14:51:46 GMT"
...Finalize Historic $40 Billion Merger,https://lodinews.marketminute.com/article/marketminute-2026-4-7-beauty-behemoth-este-lauder-and-puig-families-convene-in-new-york-to-finalize-historic-40-billion-merger,"Redefining the Luxury Landscape: Scale and StrategyThis merger fits into a broader industry trend where ""size is the only defense"" against shifting consumer habits and the rising cost of digital marketing. The prestige beauty market is no longer...","Tue, 07 Apr 2026 14:15:11 GMT"
"SPAC RRE Ventures Acquisition files for a $250 million IPO, targeting transformative sectors",https://www.renaissancecapital.com/IPO-Center/News/118113/SPAC-RRE-Ventures-Acquisition-files-for-a-$250-million-IPO-targeting-transf,"0 billion, that complement the management teams and sponsors background in technology, defense and space, robotics, quantum computing, professional sports, AI, energy, power, and other transformative sectors.The Boca Raton, FL-based company was...","Tue, 07 Apr 2026 13:47:20 GMT"
"Howmet Aerospace's $1.8 B CAM Acquisition, ESG Report & Virtual Shareholder Meeting Drive 2026...",https://aktiensensor.com/articles/howmet-aerospaces-1.8-b-cam-acquisition-esg-report--virtual-shareholder-meeting-drive-2026/,"...metrics.CrossSector InsightsWhile the transaction is rooted in the aerospace and defense sector, it illustrates broader economic trends:Capital Allocation Efficiency Companies across manufacturing sectors are increasingly pursuing...","Tue, 07 Apr 2026 13:37:39 GMT"
TransDigm Completes Acquisition of Jet Parts Engineering and Victor Sierra Aviation...,https://smb.leaderpub.com/article/TransDigm-Completes-Acquisition-of-Jet-Parts-Engineering-and-Victor-Sierra-Aviation-Holdings?storyId=69d5042e0f25261839c23c52,"...components for use on nearly all commercial and military aircraft in service today. Major product offerings, substantially ... customers; the United States (""U.S."") defense budget and risks associated with being a government supplier including...","Tue, 07 Apr 2026 13:23:57 GMT"
