title,link,summary,published
News Innovation secures EA&M Warfighting Acquisition Awards recognition,https://www.dvidshub.net/news/562082/innovation-secures-eam-warfighting-acquisition-awards-recognition,"FORT LEE, Va. The Defense Contract Management Agencys Enterprise Analytics and Modernization Directorate won the Workforce Development Innovation Award at the 2025 Warfighting...","Mon, 06 Apr 2026 22:32:12 GMT"
...for Anthropic's $400 Million Acquisition of Coefficient...,https://www.healthcare.digital/single-post/biological-intelligence-strategic-rationale-for-anthropic-s-400-million-acquisition-of-coefficient,"...after the company and the Department of Defense failed to reach an agreement on the agencys ""unfettered access"" to its...","Mon, 06 Apr 2026 21:23:04 GMT"
Why a Relatively Unknown Nvidia Acquisition Is Causing Some Experts to Worry,https://www.tipranks.com/news/why-a-relatively-unknown-nvidia-acquisition-is-causing-some-experts-to-worry,"...models. It is also used in government systems for things like weather forecasting and defense. Since Slurm powers about 60% of the worlds supercomputers, Nvidias control over it has some experts worried about how Nvidia might handle future...","Mon, 06 Apr 2026 20:35:15 GMT"
States Seek $10M in Legal Fees After Blocking $25B Kroger-Albertsons Merger,https://progressivegrocer.com/states-seek-10m-legal-fees-after-blocking-25b-kroger-albertsons-merger,"5 billion pursuing the mega-deal. An unknown portion of those costs went toward hiring more than 60 defense attorneys at eight law firms, including some lawyers who bill at more than $1,625 per hour, the states said. Reuters reported the group of...","Mon, 06 Apr 2026 18:20:20 GMT"
Inspira Technologies Announces Acquisition of the AME Platform from Nano Dimension,https://www.worldpostreporter.com/article/904100094-inspira-technologies-announces-acquisition-of-the-ame-platform-from-nano-dimension,"...Ltd. (Nasdaq: NNDM) delivers advanced Digital Manufacturing technologies to the defense, aerospace, automotive, electronics, and medical devices industries, enabling rapid deployment of high-mix, low-volume production with IP security and...","Mon, 06 Apr 2026 16:39:37 GMT"
Family-Owned HVAC Company Marks 20 Years by Rejecting Acquisition to Preserve Community Values,https://www.citybuzz.co/2026/04/06/family-owned-hvac-company-marks-20-years-by-rejecting-acquisition-to-preserve-community-values/,"...family-owned business.The company was built by Carl and Heidi on principles of military discipline and an honest, word-of-mouth reputation. In early days, Carl started with no customer base, personally handing out business cards at local...","Mon, 06 Apr 2026 16:10:02 GMT"
Senior Talent Acquisition Partner,https://jobs.sanofi.com/en/job/morristown/senior-talent-acquisition-partner/2649/36963087488,...expression; affectional or sexual orientation; disability; veteran or military status or liability for military status; domestic violence victim status; atypical cellular or blood trait; genetic information (including the refusal to submit to...,"Mon, 06 Apr 2026 15:28:42 GMT"
"...Appoints Decorated SOCOM Joint Acquisition Task Force Commander, Colonel (Ret.) Jarret Mathews as...",https://salestechstar.com/predictive-ai-artificial-intelligence/safe-pro-group-appoints-decorated-socom-joint-acquisition-task-force-commander-colonel-ret-jarret-mathews-as-chief-operating-officer/,"...of artificial intelligence (AI)-enabled defense, security, and situational awareness solutions, announced the appointment of... Colonel Mathews brings more than 25 years of operational leadership, defense acquisition expertise, and advanced...","Mon, 06 Apr 2026 14:53:17 GMT"
KNDS France closes acquisition of Texelis Defense,https://www.army-technology.com/news/knds-france-texelis-defense/,"...Texelis Defense, which will now operate as KNDS Mobility.The acquisition adds a specialist in land mobility for military... KNDS France CEO Nicolas Groult said: The acquisition of Texelis Defense is a pivotal step for the group. It consolidates...","Mon, 06 Apr 2026 12:50:26 GMT"
Aeromax Acquires The Ely Company,http://www.businesswire.com/news/home/20260406010568/en/Aeromax-Acquires-The-Ely-Company/?feedref=JjAwJuNHiystnCoBq_hl-Rc4vIAVcHHkbDcwJimU8QtrtlakeQ9hNboBqTAWIjTge3KWq9s9jif-UkBjBsFRyYAbRTSLTc1mgvhPlnaBA55M-oupQnbXnhKsYk8RmHF_kAy2gZikaX3QWV6xOvgFlA==,"FORT WORTH, Texas--(BUSINESS WIRE)--Aeromax Industries (Aeromax), a diversified commercial and military aerospace aftermarket support company, announced today that it has acquired The Ely Co., Inc. (Ely or the Company), a precision aerospace machining company. This is the first acquisition that Aeromax has completed since being acquired by Chimney Rock Equity Partners, LLC. Terms of the transaction were not disclosed. Headquartered in Torrance, California, Ely produces tight tolerance met","Mon, 6 Apr 2026 11:30:00 UT"
