title,link,summary,published
House panel advances DOD policy bill with sweeping acquisition reforms,https://www.defensenews.com/news/pentagon-congress/2025/07/16/house-panel-advances-dod-policy-bill-with-sweeping-acquisition-reforms/,"...the Defense Departments end strength by about 26,000 troops next year.It prohibits a reduction in U.S. military posture ... measure preventing the Defense Department from using any funds to revert the names of military bases back to titles related...","Wed, 16 Jul 2025 03:36:31 GMT"
HCM City strengthens capacity of health stations as population grows after merger,https://vietnamnews.vn/society/1721450/hcm-city-strengthens-capacity-of-health-stations-as-population-grows-after-merger.html,"In the near future, major hospitals in the city will speed up technology transfer and support human resources for lower levels, especially at the Con ao Military-Civilian Medical Centre and areas far from the city centre.Another key task of the...","Wed, 16 Jul 2025 03:24:00 GMT"
"Maxlinear, Silicon Motion Beat Suit Over Failed $3.8b Merger",https://www.law360.com/california/articles/2365245,...email:Select more newsletters to receive for free Access to JusticeAerospace & DefenseAppellateAsset ManagementBankingBenefitsCaliforni aCannabisClass ActionColoradoCommercial...,"Wed, 16 Jul 2025 03:09:19 GMT"
"Steelers A to Z: Ex-All Pro Darius Slay added, but whats his role after Ramsey acquisition?",https://www.centredaily.com/sports/article310743715.html,"...while playing in two Super Bowls. He won a championship ring as part of an Eagles defense that shut down the Patrick Mahomes-led Kansas City Chiefs at Super Bowl LIX in February. But, armed with a stable of high-level young cornerbacks and surely...","Wed, 16 Jul 2025 00:08:27 GMT"
...Which three methods does the Defense Acquisition System (DAS) use for materiel development based on...,https://www.coursehero.com/tutors-problems/Management/70276563-Which-three-methods-does-the-Defense-Acquisition-System-DAS-use/,"ia pulvinar tortor nec facilisis. Pellentesque dapibus efficitur laoreet. Nam risus ante, dapibus a molestie consequat,ultrices ac magna. Fusce dui lectus, congue vel laoreet ac, dictum vitae odio. Donec aliquet. Lorem ipsum dolor sit amet...","Tue, 15 Jul 2025 23:41:32 GMT"
Katharine Beene Doctoral Defense Womens Acquisition and Transmission of Knowledge in Early Modern...,https://events.uconn.edu/history-department/event/1150943-katharine-beene-doctoral-defense-womens,No Text,"Tue, 15 Jul 2025 22:13:10 GMT"
IonQ Completes Acquisition of Capella Space,https://www.gulfoilandgas.com/webpro1/main/mainnews.asp?id=1070705,"...IonQs quantum technologies is expected to bolster commercial applications, global defense, and intelligence missions.Capella has been a long-time pioneer in space technology and we can now take actionable steps to push the boundaries further...","Tue, 15 Jul 2025 21:59:03 GMT"
Windsurf Acquisition Is The Latest Salvo In The Battle For AI Talent,https://bitcoinethereumnews.com/finance/windsurf-acquisition-is-the-latest-salvo-in-the-battle-for-ai-talent/,"The startup seems to be shaking off Groks hate speech episode: Musk said that xAI has secured a $200 million contract with the Department of Defense, that it will soon be coming to Tesla cars, and has also released its own AI companions.TALENT...","Tue, 15 Jul 2025 21:39:39 GMT"
Devin McCourty Calls DK Metcalf The Big Acquisition Of The Offseason For Pittsburgh,https://bvmsports.com/2025/07/15/devin-mccourty-calls-dk-metcalf-the-big-acquisition-of-the-offseason-for-pittsburgh/,"...previously struggled despite a strong defense. The Steelers aim to shake off their late-season slump from 2024, where they ... competitive balance between its offense and defense.","Tue, 15 Jul 2025 21:28:40 GMT"
"IonQ Completes Capella Space Acquisition, With Plans to Build Space-Based QKD Network",https://www.satellitetoday.com/finance/2025/07/15/ionq-completes-capella-space-acquisition-with-plans-to-build-space-based-qkd-network/,"...IonQs quantum technologies is expected to bolster commercial applications, global defense, and intelligence missions, CEO Niccolo de Masi said in a release.Capella customers and partners will not experience any disruption to their current work...","Tue, 15 Jul 2025 20:16:31 GMT"
Powell Industries Enhances Automation Solutions with Acquisition,https://investorshangout.com/powell-industries-enhances-automation-solutions-with-acquisition-328480-/,"Their innovative approaches have positioned them as a trusted partner across various industries, including utilities and military sectors.What is the purpose of Powell's acquisition of Remsdaq?The acquisition aims to enhance Powell's automation...","Tue, 15 Jul 2025 19:45:51 GMT"
Precision Aviation Group Expands into the EMEA Region with Acquisition of Turner Aviation,https://justhelicopters.com/Articles-and-News/Industry-Wide-News/Article/182057/Precision-Aviation-Group-Expands-into-the-EMEA-Region-with-Acquisition-of-Turne,"...solutions to the global aerospace and defense industries, today announced its expansion into the EMEA (Europe, Middle East ... supply chain services to the aerospace and defense industries. With 25 FAA-approved repair stations, 27 locations worldwide...","Tue, 15 Jul 2025 19:00:15 GMT"
"IonQ Completes Acquisition of Capella Space, Advancing Vision for Space-Based Quantum Communications",https://www.biospace.com/press-releases/ionq-completes-acquisition-of-capella-space-advancing-vision-for-space-based-quantum-communications,"...bolster commercial applications, global defense, and intelligence missions.Capella has been a long-time pioneer in space ... modeling, logistics, cybersecurity and defense. IonQs advancements in quantum networking also positions the company as a...","Tue, 15 Jul 2025 18:16:40 GMT"
Annual acquisition writing competition drives the dialogue on the important role of acquisition in...,https://www.army.mil/article/287066/annual_acquisition_writing_competition_drives_the_dialogue_on_the_important_role_of_acquisition_in_delivering_capabilities_to_warfighters,"...Lt. Gen. Robert M. Collins, principal military deputy to the Assistant Secretary of the Army for Acquisition, Logistics and ... acquisition, especially members of the defense acquisition workforce. In doing so, we honor Maj. Gen. Greene, who was...","Tue, 15 Jul 2025 14:29:40 GMT"
"Mahamas ban on state lands lawful, aimed at sanitizing acquisition process Haruna Iddrisu",https://www.modernghana.com/news/1417088/mahamas-ban-on-state-lands-lawful-aimed-at-sanit.html,"So he has accordingly directed that no minister under his watch, should be associated with the acquisition of any public lands, the minister said.His defense comes after the Minority caucus in Parliament raised concerns that the directive could...","Tue, 15 Jul 2025 18:31:43 GMT"
AI and EU Merger Control | WilmerHale - JDSupra,https://www.jdsupra.com/legalnews/ai-and-eu-merger-control-4460665/,"...product developed by the target falls under the categories of critical technologies, military or dual-use items. AI-related deals may also be caught by other, wider Member State FDI laws. Outbound Investment Screening. The EC has suggested...","Tue, 15 Jul 2025 18:29:34 GMT"
Leonardo Enhances Cybersecurity Offerings With Axiomatics Acquisition,https://pulse2.com/leonardo-enhances-cybersecurity-offerings-with-axiomatics-acquisition/,"...crucial for mission-critical entities like defense, government agencies, and infrastructure. Integrating Axiomatics into ... foreign investment (FDI) regulations for defense companies, and other typical investment conditions. PwC assisted Leonardo...","Tue, 15 Jul 2025 17:30:01 GMT"
Duo Acquisition of Clase & Kwan Could Push Philly Over the Edge,https://www.sportscasting.com/news/phillies-trade-rumors-duo-acquisition-of-emmanuel-clase-steven-kwan-could-push-philly-over-the-edge/,"At 27, hes arbitration-controlled through 2027 and adds contact, OBP, and defense to the Phillies lineup.Good luck to... Steven Kwan (OF, Guardians) .285/.357/.396 hitter, elite contact and defense; arbitration control through 2027.Trade...","Tue, 15 Jul 2025 16:51:54 GMT"
...Global Footprint with Strategic Acquisition of Turner...,https://wvva.marketminute.com/article/bizwire-2025-7-15-gennx360-capital-partners-portfolio-company-precision-aviation-group-expands-global-footprint-with-strategic-acquisition-of-turner-aviation,"...Aviation has been serving the aerospace and defense industries since 1954 and is a UK Civil Aviation Authority (CAA) and ... supply chain services to the aerospace and defense industries. With 25 FAA-approved repair stations, 27 locations worldwide...","Tue, 15 Jul 2025 13:56:00 GMT"
"...Trump Force Unwinding of 2020 Acquisition of Jupiter Systems, LLC | Bass, Berry & Sims PLC...",https://www.jdsupra.com/legalnews/cfius-and-president-trump-force-1796764/,"The administration cited national security concerns due to the potential compromise of Jupiters products used in military and critical infrastructure environments.Details of the matter are still becoming clear, but it appears that the...","Tue, 15 Jul 2025 14:43:53 GMT"
