title,link,summary,published
Vanguard Group Inc's Strategic Acquisition of MKS Inc Shares,https://www.gurufocus.com/news/3193950/vanguard-group-incs-strategic-acquisition-of-mks-inc-shares,"The company is a key player in industrial technologies, semiconductors, life and health sciences, and research and defense markets.Financial Metrics and Valuation of MKS IncPerformance and Growth IndicatorsVanguard's Position and ImpactThe...","Fri, 07 Nov 2025 01:29:42 GMT"
Vanguard Group Inc's Strategic Acquisition of nLight Inc Shares,https://www.gurufocus.com/news/3193942/vanguard-group-incs-strategic-acquisition-of-nlight-inc-shares,"based company, specializes in power semiconductor and fiber lasers for various applications, including aerospace and defense. The company operates primarily in the Laser Products segment, with a market capitalization of $1.49 billion. nLight...","Fri, 07 Nov 2025 01:12:15 GMT"
Intuitive Machines Expands Horizons with Lanteris Space Systems Acquisition,https://tbgmagazine.com/2025/11/07/intuitive-machines-expands-horizons-with-lanteris-space-systems-acquisition/,"...manufacturing market, particularly in the defense sector.Intuitive Machines, recognized primarily for its lunar ... industry that is increasingly influenced by military and national security considerations.Historically, Intuitive Machines...","Fri, 07 Nov 2025 00:59:28 GMT"
"The Pentagon must activate this powerful, underused approach to acquisition",https://www.defenseone.com/ideas/2025/11/pentagon-must-activate-powerful-underused-approach-acquisition/409386/,"...helped spawn today's wave of venture-backed defense startups. These companies offer real promisebut if they also build... Perhaps most critically, open architectures strengthen the defense industrial base itself. Closed systems concentrate...","Thu, 06 Nov 2025 19:02:16 GMT"
...GlobeNewswire | Crane Harbor Acquisition Corp. Today at 10:45pm...,https://smb.ourdavie.com/article/Xanadu-Advances-to-Stage-B-of-DARPAs-Quantum-Benchmarking-Initiative-Securing-up-to-dollar15-Million-in-Funding?storyId=690d25c52f2f73e24ce42d69,"...value across industries, including drug discovery, advanced chemistry, aerospace, defense and AI. Organizations that successfully complete Stage B will advance to Stage C, where their quantum computer concept will be verified and validated to ensure...","Thu, 06 Nov 2025 23:28:53 GMT"
"Allison Transmission prices $500M notes, $1.2B loan for Dana acquisition","https://www.streetinsider.com/Corporate+News/Allison+Transmission+prices+$500M+notes,+$1.2B+loan+for+Dana+acquisition/25572827.html","Allison Transmission, founded in 1915 and headquartered in Indianapolis, designs and manufactures propulsion solutions for commercial and defense vehicles. The company operates in more than 150 countries with manufacturing facilities in the United...","Thu, 06 Nov 2025 22:21:19 GMT"
Hegseth to Discuss Proposed DOD Acquisition Reforms,https://www.executivegov.com/articles/hegseth-dod-acquisition-industry-speech,"drawing representatives from across the defense and technology industries, Defense One reported Wednesday.The attendee ... established defense contractors and innovative tech firms looking to shape the future of military procurement.Which...","Thu, 06 Nov 2025 21:53:12 GMT"
Federal Acquisition Rules Get Measured Makeover,https://www.law360.co.uk/environmental/articles/2407030/federal-acquisition-rules-get-measured-makeover,...7-day trial.Executive OrderAerospace & Defense Compliance Construction Corporate Environmental Government Contracts...,"Thu, 06 Nov 2025 21:08:54 GMT"
Amphenol Corporation Closes Trexon Acquisition,https://www.marketnewsdesk.com/index.php/amphenol-corporation-closes-trexon-acquisition/,...United States North AmericaINDUSTRY KEYWORDS: Mobile/Wireless Networks Other Defense Technology Defense Semiconductor Health Technology Audio/Video Automotive Manufacturing Aerospace Manufacturing...,"Thu, 06 Nov 2025 20:35:35 GMT"
"Smith signals movement on defense bill, highlights focus on acquisition reform",https://insidedefense.com/daily-news/smith-signals-movement-defense-bill-highlights-focus-acquisition-reform,No Text,"Thu, 06 Nov 2025 19:42:48 GMT"
"The D Brief: Acquisition reforms, debated; Boat-strike briefing; US troops to...",https://www.newslocker.com/en-us/profession/defense/the-d-brief-acquisition-reforms-debated-boat-strike-briefing-us-troops-to-damascus-chinas-mini-drone-carrier-and-a-bit-more/view/,"Defense news The D Brief: Acquisition reforms, debated; Boat-strike briefing; US troops to Damascus; Chinas mini drone carrier; And a bit more.","Thu, 06 Nov 2025 19:03:55 GMT"
"Kratos Q3 Earnings Beat, Orbit Acquisition Sparks 14% Stock Drop Despite Growth",https://sentiment-trading.com/articles/kratos-q3-earnings-beat-orbit-acquisition-sparks-14-stock-drop-despite-growth/,"...s defense contracts. Citizens reiterated a Market Outperform rating, highlighting Kratos resilience in the defense ... solid labormarket data. Nevertheless, defense and security shares exhibited a more muted recovery following the market...","Thu, 06 Nov 2025 18:58:47 GMT"
The Pentagons vital acquisition reforms,https://dailytruthreport.com/the-pentagons-vital-acquisition-reforms/,"...inadequacies remained to be corrected, as defense analysts Edward Luttwak and Eitan Shamir noted.RESTORING AMERICA: THE ... China, a country with vast economic and military...","Thu, 06 Nov 2025 18:51:34 GMT"
"...Balance Sheet, Advances Defense-Tech Acquisition Program and Revamps Blue-Laser...",https://www.marketnewsdesk.com/index.php/nuburu-strengthens-balance-sheet-advances-defense-tech-acquisition-program-and-revamps-blue-laser-business/,"...s Defense-Tech Acquisition Program and Revamps Blue-Laser BusinessExecuting Transformation Plan spanning Maddox Defense ... x Defense, and Orbit each contribute unique and highly strategic capabilities which, when integrated under Nuburu Defense...","Thu, 06 Nov 2025 18:50:03 GMT"
Rajasthan education minister announces merger of 312 schools,https://education.economictimes.indiatimes.com/news/government-policies/rajasthan-education-minister-announces-merger-of-312-schools/125139448,"""Admission for girls in these schools will soon commence, starting from the next academic year. The principals of these schools will be retired military officers,"" he said. He said there are plans to open such schools in Kota, Ajmer, and Bharatpur...","Thu, 06 Nov 2025 17:57:32 GMT"
Kratos (KTOS) Nosedives 14% After Acquisition Announcement,https://news.investingchannel.com/article/703058/kratos-ktos-nosedives-14-after-acquisition-announcement,"...aerial, seaborne, undersea, and land systems, military vehicles, and other systems that services to major air forces, traditional prime contractors, and emerging new defense and space companies.Orbit checks every box in a Kratos acquisition...","Thu, 06 Nov 2025 17:30:55 GMT"
"...Strategy, New Management and First Acquisition in Critical Minerals...",https://www.theconsumernewsnetwork.com/article/864912160-skyline-announces-change-in-strategy-new-management-and-first-acquisition-in-critical-minerals-space,"Potential supply disruptions could pose potentially significant risks to national security and economic stability, as many of these minerals are crucial for defense and clean energy technologies. The reliance on foreign owned entities for critical...","Thu, 06 Nov 2025 16:31:07 GMT"
PennAero et Tinicum annoncent l&apos;acquisition de TriMas Aerospace,http://www.businesswire.com/news/home/20251104212060/fr/?feedref=JjAwJuNHiystnCoBq_hl-Rc4vIAVcHHkbDcwJimU8QtrtlakeQ9hNboBqTAWIjTge3KWq9s9jif-UkBjBsFRyYAbRTSLTc1mgvhPlnaBA55M-oupQnbXnhKsYk8RmHF_kAy2gZikaX3QWV6xOvgFlA==,"NEW YORK--(BUSINESS WIRE)--Tinicum, L.P. ( Tinicum ) annonce aujourdhui quune de ses filiales a signe un accord visant a acquerir les actifs aerospatiaux de TriMas Corporation ( TriMas Aerospace ), par lintermediaire duquel TriMas Aerospace fusionnera avec PennAero, une societe du portefeuille de Tinicum (l operation ). Des fonds geres par Blackstone seront un investisseur minoritaire dans la operation. Cet investissement renforce la strategie de PennAero consistant a etablir des part","Thu, 6 Nov 2025 17:18:00 UT"
