title,link,summary,published
"...major deal with Italy, set to acquire deadly fighter jets; not Pakistan, Turkey, it is...",https://www.magzter.com/tr/stories/dhnews/India+English/After+Chinese+J10+jets+this+Muslim+country+strikes+major+deal+with+Italy+set+to+acquire+deadly+fighter+jets+not+Pakistan+Turkey+it+is-newsid-n692447736,"|December 10, 2025In an ongoing effort to modernize its military and improve the capability of its armed forces ... Intent(LOI) with Leonardo, an Italian defense organization pertaining to the acquisition of Eurofighter Typhoons. In...","Wed, 10 Dec 2025 01:59:37 GMT"
"...Market Closing Drone-as-a-Service Acquisition of Casado Design Ltd., Expanding to the Growing...",https://www.ukheraldtribune.com/article/874000714-zenatech-enters-uk-market-closing-drone-as-a-service-acquisition-of-casado-design-ltd-expanding-to-the-growing-telecom-tower-design-and,"...these plus land surveying, agriculture, defense, and logistics sectors, ZenaTechs portfolio of solutions helps drive ... inspection, tracking, process automation, and defense applications. Currently, the ZenaDrone 1000 drone is used for crop...","Wed, 10 Dec 2025 01:44:42 GMT"
keyword acquisition That is proper suits your circumstances the new best or...,https://www.tutores.escasto.ipn.mx/blog/2025/12/09/keyword-acquisition-that-is-proper-suits-your-circumstances-the-new-best-or-best-serves-your-own-needs-english-language-learners-pile-replace/,...VarietyThe convenience useful and you may defense offered by elizabeth-purses cause them to a favorite option for of ... establishment Ontario Canada so that participants defense each of their requires. Players from Ontario online casinos can...,"Wed, 10 Dec 2025 01:23:17 GMT"
California American Water Completes Acquisition of Yerba Buena Water Company,https://www.marketnewsdesk.com/index.php/california-american-water-completes-acquisition-of-yerba-buena-water-company/,"...to more than 14 million people with regulated operations in 14 states and on 18 military installations. American Waters 6,700 talented professionals leverage their significant expertise and the companys national size and scale to achieve...","Wed, 10 Dec 2025 00:28:53 GMT"
California American Water Completes Acquisition of Yerba Buena Water Company PR Newswire Today at...,https://smb.brewtonstandard.com/article/California-American-Water-Completes-Acquisition-of-Yerba-Buena-Water-Company?storyId=6938a99d476361ebf71e67dd,"...to more than 14 million people with regulated operations in 14 states and on 18 military installations. American Water's 6,700 talented professionals leverage their significant expertise and the company's national size and scale to achieve...","Tue, 09 Dec 2025 23:33:01 GMT"
Weinberg Capital Group Announces Acquisition of Pinson Valley Heat Treating,https://lifestyle.newarklifemagazine.com/story/153140/weinberg-capital-group-announces-acquisition-of-pinson-valley-heat-treating/,"PVHT or the Company), a five-decade-plus-old specialty heat-treating company that serves the aerospace and defense, industrial, and automotive end markets.We are excited to partner with Don Hendry, Benny Grissom, and their talented team,...","Tue, 09 Dec 2025 23:01:13 GMT"
California American Water Completes Acquisition of Yerba Buena Water...,https://themalaysianreserve.com/2025/12/10/california-american-water-completes-acquisition-of-yerba-buena-water-company/,"...to more than 14 million people with regulated operations in 14 states and on 18 military installations. American Waters 6,700 talented professionals leverage their significant expertise and the companys national size and scale to achieve...","Tue, 09 Dec 2025 22:56:00 GMT"
Archer completes first phase of Hawthorne Airport acquisition,https://ng.investing.com/news/company-news/archer-completes-first-phase-of-hawthorne-airport-acquisition-93CH-2246770,...with Karem Aircraft to integrate advanced military-grade rotor and tiltrotor technologies into its next-generation aircraft ... efforts to innovate in both commercial and military aviation sectors.This article was generated with the support of AI and...,"Tue, 09 Dec 2025 21:38:13 GMT"
"...with Peru on K2 Tank Acquisition... Largest-Ever Defense Export to Central and South America""...",http://www.asiae.co.kr/en/article/bluehouse/2025120923424974959,"...opportunity to dramatically elevate defense and defense industry cooperation between the two countries."" He also emphasized, ""Since Peru has chosen K-Defense to strengthen its military capabilities and promote its own industrial development, the two...","Tue, 09 Dec 2025 20:00:00 GMT"
"Boeing returns to Kansas, finalizing $4.7 billion acquisition of Spirit AeroSystems",https://www.hastingstribune.com/news/state/kansas/boeing-returns-to-kansas-finalizing-4-7-billion-acquisition-of-spirit-aerosystems/article_65a2d89d-c80e-5d99-babb-11da3f2b4ecc.html,"...787 Dreamliner, the news release said.Spirit Defense will continue as an independent supplier to the defense industry and will align to Boeing Defense, Space & Security for financial reporting and select enterprise functional and site support...","Tue, 09 Dec 2025 19:44:55 GMT"
PHOTRON LIMITED annonce l&apos;acquisition d&apos;AOS Technologies AG,http://www.businesswire.com/news/home/20251203667120/fr/?feedref=JjAwJuNHiystnCoBq_hl-Rc4vIAVcHHkbDcwJimU8QtrtlakeQ9hNboBqTAWIjTge3KWq9s9jif-UkBjBsFRyYAbRTSLTc1mgvhPlnaBA55M-oupQnbXnhKsYk8RmHF_kAy2gZikaX3QWV6xOvgFlA==,"TOKYO--(BUSINESS WIRE)--PHOTRON LIMITED, un leader mondial des solutions d'imagerie a haute vitesse et scientifique, annonce aujourd'hui l'acquisition d'AOS Technologies AG, un concepteur et fabricant suisse de systemes d'imagerie a haute vitesse avances destines aux marches de l'automobile, de l'aerospatiale, de l'industrie et de la defense. Cree en 2002, AOS Technologies a acquis une reconnaissance mondiale pour son innovation en ingenierie, ses plates-formes d'imagerie robustes et son expert","Tue, 9 Dec 2025 10:11:00 UT"
