title,link,summary,published
...people can settle down after land acquisition,https://news.laodong.vn/bat-dong-san/de-xuat-tinh-gia-dat-tai-dinh-cu-bang-20-de-nguoi-dan-co-the-an-cu-sau-thu-hoi-dat-1599907.ldo,"...people can pay, ""reasonably for people whose land is recovered to serve national defense and security purposes; socio-economic development for national and public interests"".HoREA affirmed that this proposal is not wrong, but ""fully grasped the...","Wed, 29 Oct 2025 02:22:32 GMT"
sustainable customer acquisition apply advanced modeling to look mining?,https://wqai.blog2learn.com/85705128/sustainable-customer-acquisition-apply-advanced-modeling-to-look-mining,"...relationships. This powerful instrument has a wide range of deployments in fields such as defense, health services, and inspection. LookMiner's ability to reliably extract valuable knowledge from visual data makes it a breakthrough technology with...","Tue, 28 Oct 2025 22:40:29 GMT"
Eagles pulled off another draft steal with their biggest offseason acquisition,https://www.yardbarker.com/nfl/articles/eagles_pulled_off_another_draft_steal_with_their_biggest_offseason_acquisition/s1_17424_42977499,"As a rookie, he has been able to help out the defense however Philly needs.The first-round pick out of Alabama has been a contributor in Vic Fangio's defense from the jump. Campbell has played 87% of the snaps with 45 tackles, eight QB pressures...","Tue, 28 Oct 2025 21:12:56 GMT"
US Army Taps AI to Streamline Acquisition Requirements,https://www.executivegov.com/articles/ai-role-army-procurement-process,"...and other procurement areas, Breaking Defense reported Friday.Joe Welch, executive deputy to the commanding general of... AI is now an integral part of how the U.S. military and the federal government are processing information and complex...","Tue, 28 Oct 2025 20:27:06 GMT"
"...and Qorvo Announce $22 Billion Merger, Reshaping RF...",https://markets.financialcontent.com/stocks/article/tokenring-2025-10-28-semiconductor-titans-unite-skyworks-solutions-and-qorvo-announce-22-billion-merger-reshaping-rf-landscape,"...crucial for a wide array of applications from 5G infrastructure and mobile devices to defense, aerospace, edge IoT, AI data centers, and automotive systems.Technically, the merger promises to unlock substantial synergies by integrating Skyworks'...","Tue, 28 Oct 2025 19:22:09 GMT"
"Skyworks Solutions and Qorvo Announce $22 Billion Merger, Reshaping the RF Chip Landscape",https://wrex.marketminute.com/article/tokenring-2025-10-28-skyworks-solutions-and-qorvo-announce-22-billion-merger-reshaping-the-rf-chip-landscape,"...position in high-growth areas like 5G infrastructure, automotive, industrial IoT, and defense. The expanded product portfolio and R&D capabilities will enable the company to offer more comprehensive, integrated solutions, potentially reducing design...","Tue, 28 Oct 2025 19:02:06 GMT"
A new framework aims to build a bridge across the defense acquisition valley of death,https://2ninews.blogspot.com/2025/10/a-new-framework-aims-to-build-bridge.html,"...across the defense acquisition valley of death A new framework aims to build a bridge across the defense acquisition valley ... solution providers with the new defense tech entrants, with our defense industrial base were able to bring together both...","Tue, 28 Oct 2025 18:39:22 GMT"
"...Completes Acquisition of Indarg Engineering, Inc. Expanding Aerospace and Defense Manufacturing...",https://reprototype.com/pmgc-holdings-inc-s-subsidiary-aga-precision-systems-llc-completes-acquisition-of-indarg-engineering-inc-expanding-aerospace-and-defense-manufacturing-platform/,Source: GlobeNewswire,"Tue, 28 Oct 2025 12:00:00 GMT"
Analysts Size Up Europes Bold Move With Airbus/Thales/Leonardo Merger,https://www.satellitetoday.com/finance/2025/10/28/analysts-size-up-europes-bold-move-with-airbus-thales-leonardo-merger/,"...focusing on defense spending, do you see that as a major catalyst for this deal?Boggett: Defense spending is certainly a ... ecosystem.Filotico: Defense is clearly a driving force. Space has become a critical defense and security domain, and...","Tue, 28 Oct 2025 19:40:37 GMT"
"...improved services such made-to-acquisition breakfast, later consider-out/very early take a look...",https://czego-szukasz.pl/ogloszenia/applause-resort-by-clique-will-bring-improved-services-such-made-to-acquisition-breakfast-later-consider-out-very-early-take-a-look-at-in-the-solutions-and-you-can-animals-amicable-bedroom/adamzajac,"...Adept Casino Airport adheres to rigid defense conditions mandated for everyone registered gambling organizations about ... surveillance options, using their elite defense personnel, and sticking with regulatory criteria, Ace Casino Airport shows...","Tue, 28 Oct 2025 19:31:16 GMT"
Powerful Turkish acquisition by Britain/New geopolitical alliance between London and Ankara,https://www.voxnews.al/english/kosovabota/blerja-e-fuqishme-turke-nga-britania-aleance-e-re-gjeopolitike-mes-lo-i102967,"...Monday, marking a new milestone in bilateral defense relations.President Erdogan described the agreement as ""a new sign of ... saying it would pave the way for joint defense projects.Speaking at a joint press conference, Starmer said: This will...","Tue, 28 Oct 2025 18:24:51 GMT"
Skyworks and Qorvo Announce $22 Billion Merger to Boost RF and S,https://www.gurufocus.com/news/3165250/skyworks-and-qorvo-announce-22-billion-merger-to-boost-rf-and-semiconductor-market,"...and defense. The newly formed company will focus on high-growth sectors such as AI data centers, 5G infrastructure, defense ... and expand into high-growth areas like defense, automotive, and industrial IoT. The new entity is poised to become a more...","Tue, 28 Oct 2025 17:45:33 GMT"
CFRA upgrades Skyworks Solutions stock to Hold on Qorvo acquisition,https://www.investing.com/news/analyst-ratings/cfra-upgrades-skyworks-solutions-stock-to-hold-on-qorvo-acquisition-93CH-4314381,"Meanwhile, Qorvo reported its first-quarter fiscal year 2026 earnings, showing strong demand in the defense and aerospace sectors, with revenue reaching $819 million and non-GAAP diluted earnings of $0.92 per share. Despite these earnings, Mizuho...","Tue, 28 Oct 2025 16:55:49 GMT"
Massive Merger: Qorvo and Skyworks Unite for Future Innovations,https://investorshangout.com/massive-merger-qorvo-and-skyworks-unite-for-future-innovations-437158-/,"6 billion portfolio is being designed to diversify across critical sectors such as defense, aerospace, Internet of Things (IoT), artificial intelligence data centers, and automotive applications.Planned Synergies and Cost EfficienciesThe merger...","Tue, 28 Oct 2025 16:29:21 GMT"
Circus strengthens global IP leadership in AI robotics with acquisition of 30 international patents,http://www.businesswire.com/news/home/20251028269665/en/Circus-strengthens-global-IP-leadership-in-AI-robotics-with-acquisition-of-30-international-patents/?feedref=JjAwJuNHiystnCoBq_hl-Rc4vIAVcHHkbDcwJimU8QtrtlakeQ9hNboBqTAWIjTge3KWq9s9jif-UkBjBsFRyYAbRTSLTc1mgvhPlnaBA55M-oupQnbXnhKsYk8RmHF_kAy2gZikaX3QWV6xOvgFlA==,"MUNICH--(BUSINESS WIRE)--Circus SE (ISIN: DE000A2YN355 / Symbol: CA1), a global technology leader in AI robotics for autonomous nutrition systems and defense supply, announced the acquisition of one of the leading global patent portfolios in autonomous supply systems from a US-based AI robotics company. The portfolio comprises 30 international patents, registered in the United States and Europe, covering key technologies in AI-based control and optimization algorithms (Nutrition Profiling), a","Tue, 28 Oct 2025 07:30:00 UT"
"PMGC Holdings Inc.s Subsidiary, AGA Precision Systems LLC, Completes Acquisition of Indarg Engineering, Inc. Expanding Aerospace and Defense Manufacturing Platform",https://www.globenewswire.com/news-release/2025/10/28/3175351/0/en/PMGC-Holdings-Inc-s-Subsidiary-AGA-Precision-Systems-LLC-Completes-Acquisition-of-Indarg-Engineering-Inc-Expanding-Aerospace-and-Defense-Manufacturing-Platform.html,"PMGC Holdings Inc.s Subsidiary, AGA Precision Systems LLC, Completes Acquisition of Indarg Engineering, Inc. Expanding Aerospace and Defense Manufacturin","Tue, 28 Oct 2025 12:00 GMT"
