title,link,summary,published
B&K Precision Launches DAS1800-R Rackmount Data Acquisition System Temcom,https://www.temcom.com/bk-precision-launches-das1800-r-rackmount-data-acquisition-system/,"This allows for easy removal of sensitive data, meeting the data sanitization protocols required in the aerospace and defense industries.Measurement and Sampling CapabilitiesThe acquisition system can measure voltages, currents, resistances...","Mon, 18 May 2026 07:50:51 GMT"
Does Innovative Aerosystems' (ISSC) Acquisition Push Reveal a New Phase in Its Avionics Strategy?,https://simplywall.st/stocks/us/capital-goods/nasdaq-issc/innovative-aerosystems/news/does-innovative-aerosystems-issc-acquisition-push-reveal-a-n,"...exposure and diversify away from lumpier military revenues, while at the same time magnifying integration and balance sheet... However, investors should also be aware that concentration risk in core military programs could still become a headwind if...","Sun, 17 May 2026 20:28:37 GMT"
Cuba's Right to Self-Defense: Fernandez de Cossio Evades Denying Military Drone Acquisition,https://www.cubaheadlines.com/articles/329532,"...acquiring military drones?Cuba cites the principle of self-defense as the main justification for acquiring military ... to have supplied military drones to Cuba?According to reports, Cuba has acquired military drones from Russia and...","Sun, 17 May 2026 18:20:32 GMT"
"Cabinet Approves Merger of Civil Consumer Corporation, Military Consumer Establishment",https://petra.gov.jo/en/news/cabinet-approves-merger-of-civil-consumer-corporation%C2%A0military%C2%A0consumer-establishment,...Service Consumer Corporation with the Military Consumer Establishment.At a session chaired by Prime Minister Jaafar... Employees will be transferred to the civilian employment system of the Military Consumer Establishment under legal and...,"Sun, 17 May 2026 18:19:11 GMT"
"Cabinet Approves Merger Of Civil, Military Consumer Corporations",https://menafn.com/1111128516/Cabinet-Approves-Merger-Of-Civil-Military-Consumer-Corporations,"...the Civil Consumer Corporation with the Military Consumer Corporation to improve service efficiency, enhance... Employees will be transferred to the Military Consumer Corporation's personnel system under legal and regulatory...","Sun, 17 May 2026 01:02:29 GMT"
Is a SpaceX-Tesla Merger Elon Musk's Endgame? Here Are 4 Factors Investors Need to Consider.,https://www.nasdaq.com/articles/spacex-tesla-merger-elon-musks-endgame-here-are-4-factors-investors-need-consider,"...contact with the federal government: SpaceX has major contracts with the Department of Defense and NASA, while Tesla's self-driving technology is under heavy scrutiny from safety regulators, to name a few.Dealing with the ""alphabet soup"" of the...","Sun, 17 May 2026 14:39:44 GMT"
Is a SpaceX-Tesla Merger Elon Musk's Endgame? Here Are 4 Factors Investors Need to...,https://www.europesays.com/people/74728/,"...contact with the federal government: SpaceX has major contracts with the Department of Defense and NASA, while Teslas self-driving technology is under heavy scrutiny from safety regulators, to name a few.Dealing with the alphabet soup of the...","Sun, 17 May 2026 12:16:11 GMT"
...Rising Costs in F-35 Stealth Jet Acquisition as Budget Overruns Threaten Fleet Size Aviation...,https://aviationnews.eu/news/2026/05/switzerland-faces-rising-costs-in-f-35-stealth-jet-acquisition-as-budget-overruns-threaten-fleet-size/,...defense strategies.The additional credit is necessary to ensure that the transition to the next generation of air defense ... for the next four decades. Citizens and defense analysts alike are watching closely to see if the government can stabilize...,"Sun, 17 May 2026 11:33:09 GMT"
The Cac Crisis: Why Customer Acquisition Keeps Getting More Expensive,https://everything-pr.com/the-cac-crisis-why-customer-acquisition-keeps-getting-more-expensive,"Email and SMS lists carry no auction cost and convert repeat buyers at a fraction of acquisition cost. Retention is the most reliable defense against acquisition inflation.Fourth, the right governing metric. Not cost per click. Not even cost per...","Sun, 17 May 2026 11:20:42 GMT"
...Extension: Capitals' Trade Deadline Acquisition to Stay in Washington?...,https://akceptor.org/article/timothy-liljegren-contract-extension-capitals-trade-deadline-acquisition-to-stay-in-washington,"They recognize the importance of a player's comfort and past success, especially when it comes to building a solid defense.Financial ConsiderationsFrom a financial standpoint, the expected cost of a Liljegren extension is around $3.3 million...","Sun, 17 May 2026 10:02:24 GMT"
