title,link,summary,published
Chord Energy Announces Strategic Acquisition of Williston Basin Assets,https://energynow.com/2025/09/chord-energy-announces-strategic-acquisition-of-williston-basin-assets/,"...impact of retaliatory tariffs and other actions, war between Russia and Ukraine, military conflicts in the Red Sea Region and war between Israel and Hamas and conflict between Iran and Israel, with potential for escalation of hostilities across the...","Mon, 15 Sep 2025 22:59:46 GMT"
...right field and dynamic trade acquisition at...,https://empiresportsmedia.com/new-york-yankees/yankees-announce-mondays-lineup-with-captain-back-in-right-field-and-dynamic-trade-acquisition-at-shortstop/,"...shoulder issue. Caballeros weekend showed just how disruptive he can be, using his defense and legs to tilt close games.Austin Wells rounds out the order behind the plate, with lefty Carlos Rodon taking the mound to open the series.The Yankees...","Mon, 15 Sep 2025 22:11:28 GMT"
American Exceptionalism Acquisition Corp. A S1/A IPO registration (amended) | AEXA 15 Sep 25,https://capedge.com/filing/2079173/0001193125-25-203772/S-1A,"...cryptocurrency, it must also continue to project military supremacy both domestically and abroad. There are many companies that are working to rebuild U.S. military supremacy and its warfighting capabilities through the lens of twenty-first century...","Mon, 15 Sep 2025 21:33:37 GMT"
Chord Energy Announces Strategic Acquisition of Williston Basin Assets PR Newswire Today at 9:00pm...,https://smb.leaderpub.com/article/Chord-Energy-Announces-Strategic-Acquisition-of-Williston-Basin-Assets?storyId=68c87f2ab83f4e9fe2c525b7,"...potential impact of retaliatory tariffs and other actions, war between RussiaUkraine, military conflicts in the Red Sea Region and war between Israel and Hamas and conflict between IranIsrael, with potential for escalation of hostilities across the...","Mon, 15 Sep 2025 21:29:48 GMT"
...Empire with $35 Billion Ansys Acquisition Amidst AI and Geopolitical...,https://wgem.marketminute.com/article/marketminute-2025-9-15-synopsys-forges-silicon-to-systems-empire-with-35-billion-ansys-acquisition-amidst-ai-and-geopolitical-crosscurrents,"Potential strategic pivots may include a deeper focus on industry-specific solutions, such as highly specialized tools for aerospace and defense, medical devices, or industrial IoT, where complex multiphysics interactions are paramount. The...","Mon, 15 Sep 2025 15:37:41 GMT"
"...agreement with Lurssen Group on acquisition of NVL (Naval Vessels Lurssen), becoming a naval...",https://www.epicos.com/article/972379/rheinmetall-reaches-agreement-lurssen-group-acquisition-nvl-naval-vessels-lurssen,"...NVL B.V. & Co. KG, Bremen-Vegesack), the military division of the long-established Bremen shipyard, and all its... The current conflict situation reveals that military enforcement capabilities are also becoming increasingly important in...","Mon, 15 Sep 2025 15:34:24 GMT"
Piper Sandler Completes Acquisition of G Squared Capital Partners,https://www.pressreleasepoint.com/piper-sandler-completes-acquisition-g-squared-capital-partners,"...specializing in government services and defense technology based in the Washington, D.C. area. MINNEAPOLIS --Sep. 15 ... specializing in government services and defense technology based in the Washington, D.C. area.The firms founders Greg...","Mon, 15 Sep 2025 14:24:00 GMT"
MITRE on Increased Warfighter Involvement in Acquisition,https://www.executivegov.com/articles/mitre-defense-acquisition-system-warfighter-involvement,"MITRE has released a report highlighting the need for the defense acquisition system, or DAS, to be more warfighter-centric to facilitate the delivery of capabilities that keep pace with the rapidly evolving battlefield...","Mon, 15 Sep 2025 20:46:24 GMT"
Rheinmetall announces acquisition of Lurssens naval defense division and vows to create German...,https://www.msn.com/en-nz/news/other/rheinmetall-announces-acquisition-of-l%C3%BCrssen-s-naval-defense-division-and-vows-to-create-german-naval-power/ar-AA1MBqVC,"...demand for naval defense capabilities is rising due to increasing global conflicts and expanding defense budgets.According ... missile defense, sensors, and combat management systems. This consolidation strengthens Germanys and NATO allies defense...","Mon, 15 Sep 2025 20:38:42 GMT"
"Volato Groups Proposed Acquisition Under Definitive Agreement, M2i Global to Participate at...",https://nevadabusinessherald.com/article/849218284-volato-group-s-proposed-acquisition-under-definitive-agreement-m2i-global-to-participate-at-nevada-strategic-growth-initiative-s-lithium-strategic,...available to both private industry and the defense industrial base Focused effort on enabling the return of midstream ... critical minerals and metals for national defense and economic security. M2i Global aims to establish a Strategic Mineral...,"Mon, 15 Sep 2025 15:21:27 GMT"
When a rail merger meets Memphis,https://www.politico.com/newsletters/weekly-transportation/2025/09/15/when-a-rail-merger-meets-memphis-00563441,...official air taxi provider of the 2028 Olympics in May).IT CONTINUES: Boeing defense workers in the St. Louis area will continue their strike (now more than a month in) after voting against the plane-makers latest contract offer on Friday. Dan...,"Mon, 15 Sep 2025 08:00:00 GMT"
