title,link,summary,published
Gundagai Resistance Army Claims Victory After 9-Year War Against Cootamundra Council Merger,https://www.betootaadvocate.com/headlines/gundagai-resistance-army-claims-victory-after-9-year-war-against-cootamundra-council-merger/,"...international fundraising drives, the GRA has proven that there is no government or military in the world that is strong enough to silence the will of the people, as the NSW Leader of the House, Minister Ron Hoenig confirmed the de-merger yesterday...","Fri, 18 Jul 2025 02:37:43 GMT"
Canadiens add offensive punch to defense with Dobson acquisition,https://www.nhl.com/news/topic/team-resets/montreal-canadiens-roster-changes-for-2025-26-season,"...least 60 assists in a season. A right-handed shot, he will play in the top four on defense and add more punch and options to the power-play. ... **Zack Bolduc, F:** The 22-year-old was acquired in a trade with the St. Louis Blues for defenseman Logan...","Fri, 18 Jul 2025 02:36:14 GMT"
"...Media Online: SES Completes Acquisition of Intelsat, Creating Global Multi-Orbit Connectivity...",http://africamediaonline.blogspot.com/2025/07/ses-completes-acquisition-of-intelsat.html,"...connectivity solutions utilising complementary spectrum bands including C-, Ku-, Ka-, Military Ka-, X-band, and Ultra High Frequency. The expanded capabilities of the combined company will enable it to deliver premium-quality services and tailored...","Fri, 18 Jul 2025 02:30:00 GMT"
"Africa Articles: SES Completes Acquisition of Intelsat, Creating Global Multi-Orbit Connectivity...",http://africarticles.blogspot.com/2025/07/ses-completes-acquisition-of-intelsat.html,"...connectivity solutions utilising complementary spectrum bands including C-, Ku-, Ka-, Military Ka-, X-band, and Ultra High Frequency. The expanded capabilities of the combined company will enable it to deliver premium-quality services and tailored...","Fri, 18 Jul 2025 02:30:00 GMT"
"Media Africa 247: SES Completes Acquisition of Intelsat, Creating Global Multi-Orbit Connectivity...",http://mediaafrica247.blogspot.com/2025/07/ses-completes-acquisition-of-intelsat.html,"...connectivity solutions utilising complementary spectrum bands including C-, Ku-, Ka-, Military Ka-, X-band, and Ultra High Frequency. The expanded capabilities of the combined company will enable it to deliver premium-quality services and tailored...","Fri, 18 Jul 2025 02:30:00 GMT"
"African Analyst: SES Completes Acquisition of Intelsat, Creating Global Multi-Orbit Connectivity...",http://africananalyst.blogspot.com/2025/07/ses-completes-acquisition-of-intelsat.html,"...connectivity solutions utilising complementary spectrum bands including C-, Ku-, Ka-, Military Ka-, X-band, and Ultra High Frequency. The expanded capabilities of the combined company will enable it to deliver premium-quality services and tailored...","Fri, 18 Jul 2025 02:30:00 GMT"
"Dubai News Today: SES Completes Acquisition of Intelsat, Creating Global Multi-Orbit Connectivity...",http://dubainewstoday.blogspot.com/2025/07/ses-completes-acquisition-of-intelsat.html,"...connectivity solutions utilising complementary spectrum bands including C-, Ku-, Ka-, Military Ka-, X-band, and Ultra High Frequency. The expanded capabilities of the combined company will enable it to deliver premium-quality services and tailored...","Fri, 18 Jul 2025 02:25:00 GMT"
"Teledyne Lidar Enables 3D Data Acquisition, Visual Effects for HBOs Game of Thrones",https://digitalmedianet.com/teledyne-lidar-enables-3d-data-acquisition-visual-effects-for-hbos-game-of-thrones/,"...sophisticated instrumentation, digital imaging products and software, aerospace and defense electronics, and engineered systems. Teledynes operations are primarily located in the United States, the United Kingdom, Canada, and Western and...","Fri, 18 Jul 2025 02:04:46 GMT"
"Across Africa News: SES Completes Acquisition of Intelsat, Creating Global Multi-Orbit Connectivity...",http://acrossafricanews.blogspot.com/2025/07/ses-completes-acquisition-of-intelsat.html,"...connectivity solutions utilising complementary spectrum bands including C-, Ku-, Ka-, Military Ka-, X-band, and Ultra High Frequency. The expanded capabilities of the combined company will enable it to deliver premium-quality services and tailored...","Thu, 17 Jul 2025 23:45:08 GMT"
Brightli & Centerstone Plan Merger To Form $1.1 Billion Behavioral Health Powerhouse Across Nine...,https://openminds.com/market-intelligence/news/brightli-centerstone-plan-merger-to-form-1-1-billion-behavioral-health-powerhouse-across-nine-states/,"...services for people with intellectual/developmental disabilities, and services for military service . . .Not a paid member? Don't miss out! Sign up today and receive unlimited organizational access to...","Thu, 17 Jul 2025 22:26:41 GMT"
Kuwait DM: Bayraktar TB2's Acquisition Reflects Policy Of Developing Defenses,https://menafn.com/1109815634/Kuwait-DM-Bayraktar-TB2s-Acquisition-Reflects-Policy-Of-Developing-Defenses,"...Minister of Defense Sheikh Abdullah Ali Abdullah Al-Sabah on Thursday. In a statement by the Defense Ministry during a ... vehicle, would enhance the country's air defense and develop the capabilities of the army. He expressed keenness on...","Thu, 17 Jul 2025 15:05:32 GMT"
...Major Capability Acquisition program that contains at least one joint military capability...,https://www.coursehero.com/tutors-problems/Management/74540566-which-event-for-a-Major-Capability-Acquisition-program-that/,"ng elit. Nam lacinia pulvinar tortor nec facilisis. Pellentesque dapibus efficitur laoreet. Nam risus ante, dapibus a molestie consequat, ultrices ac magna. Fusce dui lectus, congue vel laoreet ac, dictum vitae odio. Donec aliquet. Lorem ipsum...","Fri, 18 Jul 2025 00:05:05 GMT"
US consortium eyes Congo copper firm acquisition,https://skillings.net/us-consortium-eyes-congo-copper-firm-acquisition/,"A US investment group featuring ex-military personnel is working to buy Chemaf Resources, a mining firm in the Democratic Republic of Congo that has emerged as a key battleground in US-China rivalry over...","Thu, 17 Jul 2025 23:47:33 GMT"
"Ses Finalizes Intelsat Acquisition, Creating Multi-orbit Satellite Powerhouse",https://convergedigest.com/ses-finalizes-intelsat-acquisition-creating-multi-orbit-satellite-powerhouse/,"...leverage its expanded ground infrastructure and spectrum holdings across C-, Ku-, Ka-, military Ka-, X-, and UHF bands to deliver end-to-end services to enterprise and government markets.The transaction boosts SESs projected annual revenue to...","Thu, 17 Jul 2025 22:00:25 GMT"
Burrell's parent company merger will make it largest US nonprofit mental health provider,https://eu.news-leader.com/story/news/local/ozarks/2025/07/17/missouri-tennessee-mental-health-providers-announce-merger/85261124007/,...clients globally. The nonprofit also provides nationwide services to veterans and military families.What is currently the largest nonprofit provider of behavioral health in the nation?The current largest nonprofit provider of mental health is...,"Thu, 17 Jul 2025 20:32:33 GMT"
"Senate authorizers call for organizational changes in DOD policy, acquisition offices",https://insidedefense.com/insider/senate-authorizers-call-organizational-changes-dod-policy-acquisition-offices,"...legislative text directs the Defense Department to establish an assistant secretary of defense for international armaments ... secretary of defense for strategies, plans and capabilities -- who reports to the under secretary of defense for policy...","Thu, 17 Jul 2025 14:27:00 GMT"
[Form 3] Kochav Defense Acquisition Corp. Units Initial Statement of Beneficial Ownership,https://www.stocktitan.net/sec-filings/KCHVU/form-3-kochav-defense-acquisition-corp-units-initial-statement-of-ben-3c889586b62d.html,KCHVU Stock DataBlank ChecksNEW YORK,"Thu, 17 Jul 2025 18:43:22 GMT"
"Talent Acquisition Coordinator, Business - monday.com",https://www.builtinnyc.com/job/talent-acquisition-coordinator-business/6662544,"We hire talented individuals, regardless of gender, race, ethnicity, ancestry, age, disability, sexual orientation, gender identity or expression, military or veteran status, cultural background, religious beliefs, or any other characteristic...","Thu, 17 Jul 2025 18:22:49 GMT"
...Committee Hearing: Reforming Defense Acquisition to Deliver Capability at the Speed of...,https://armedservices.house.gov/calendar/eventsingle.aspx?EventID=6302,"Stream Here:The Honorable Michael P. DuffeyUnder Secretary of Defense for Acquisition and SustainmentAccompanied By:Mr. William D. BaileyPerforming the Duties of Assistant Secretary of the Air Force (Acquisition, Technology &...","Thu, 17 Jul 2025 17:46:54 GMT"
"...Manufacturing Market Share, Growth, Size, Merger, Demand, Sales, Trends, Competitive Landscape And...",http://prsync.com/market-research-community/asia-pacific-aerospace-parts-manufacturing-market-share-growth-size-merger-demand-sales-trends-competitive-landscape-and-regiona-4812449/,"...Equipment, System, and Support By End-UseBusiness Aircraft Commercial Aircraft Military Aircraft Get Discount on Asia-Pacific Aerospace Parts Manufacturing Market Research Report @Regional Analysis For Asia-Pacific Aerospace Parts...","Thu, 17 Jul 2025 17:39:09 GMT"
"Springfields Brightli, Centerstone plan merger to create nations largest nonprofit provider of...",https://www.ky3.com/2025/07/17/springfields-brightli-centerstone-plan-merger-create-nations-largest-nonprofit-provider-behavioral-health-services/,"Centerstone also provides nationwide services to veterans and military families and operates its own Institute for Clinical... Centerstone also offers specialized programs available nationwide for the military community, as well as services for...","Thu, 17 Jul 2025 17:29:52 GMT"
SES closes $3B acquisition of Intelsat,https://www.fierce-network.com/wireless/ses-closes-3b-acquisition-intelsat,"...satellites through partnerships. Complementary spectrum bands include C-, Ku-, Ka-, military Ka-, X-band and Ultra High Frequency.Once fully integrated, SES will be in a stronger position to serve customers in government, aviation, maritime and...","Thu, 17 Jul 2025 16:55:50 GMT"
"...Microspheres Market Share, Growth, Size, Merger, Demand, Sales, Trends, Competitive Landscape And...",http://prsync.com/market-research-community/asia-pacific-metallic-microspheres-market-share-growth-size-merger-demand-sales-trends-competitive-landscape-and-regional-outloo-4812384/,BUY NOW Asia-Pacific Metallic Microspheres Market Report @By TypeHollow Microsphere Solid Microsphere Automotive Materials Aerospace and Defense Materials Biotechnology Construction Coating Additives Cosmetics Oil and Gas Consumables Other...,"Thu, 17 Jul 2025 16:51:09 GMT"
...Promote AI and Learn about Federal Acquisition Workforce during Eight-Week Internship at PEO...,https://www.dvidshub.net/news/543074/dctc-scholars-help-promote-ai-and-learn-about-federal-acquisition-workforce-during-eight-week-internship-peo-stri,"...employment opportunities as part of the Defense Civilian Training Corps (DCTC) internship program.Luke Luciano, a senior ... experience about how the U.S. Department of Defense (DoD) and Army acquisition workforce operate during their eight-week...","Thu, 17 Jul 2025 16:37:15 GMT"
Merger of Henson Group and myCloudDoor to form ALIANDO - Maxthon,https://blog.maxthon.com/2025/07/17/merger-of-henson-group-and-myclouddoor-to-form-aliando/,...IMPACT ANALYSIS: DEFENSE SECTORCurrent Defense Digital Transformation LandscapeSingapores defense sector is undergoing ... Azure.ALIANDOs Defense Sector Applications:1. Cybersecurity and Defense SystemsCurrent Defense Cyber Capabilities...,"Thu, 17 Jul 2025 16:26:02 GMT"
Satellite companies SES and Intelsat complete their merger,https://behindtheblack.com/behind-the-black/points-of-information/satellite-companies-ses-and-intelsat-complete-their-merger/,"...connectivity solutions utilising complementary spectrum bands including C-, Ku-, Ka-, Military Ka-, X-band, and Ultra High Frequency. The expanded capabilities of the combined company will enable it to deliver premium-quality services and tailored...","Thu, 17 Jul 2025 16:07:59 GMT"
SES Completes Acquisition of Intelsat,https://www.exterrajsc.com/p/ses-completes-acquisition-of-intelsat,"...connectivity solutions utilizing complementary spectrum bands including C-, Ku-, Ka-, Military Ka-, X-band, and Ultra High Frequency. The expanded capabilities of the combined company will enable it to deliver premium-quality services and tailored...","Thu, 17 Jul 2025 15:18:37 GMT"
Archer Aviation's CEO updates on recent acquisition,https://seekingalpha.com/news/4468465-archer-aviations-ceo-updates-on-recent-acquisition,"It was disclosed in May that Archer Aviation ( ACHR) acquired a specialized high-performance composite manufacturing facility tailored for defense applications, which...","Thu, 17 Jul 2025 14:56:41 GMT"
