title,link,summary,published
Three Opposition Parties in Japan Move Toward Possible Merger,https://www.europesays.com/japan/44109/,"...2026, abolition of provisional gasoline and diesel tax rates, and withdrawal of defense-related tax increases.The critique is that the CDP often faces a tension between principled opposition and governing credibility. Its policies are strong on...","Sat, 20 Jun 2026 04:03:17 GMT"
...Committee referred the Housing Acquisition (Amendment) Law to the General Assembly with some draft...,https://turkishnewsworld.com/based-on-this-information-write-a-new-short-title-in-english-the-legal-committee-referred-the-housing-acquisition-amendment-law-to-the-general-assembly-with-some-draft-resolutions-brtk/,"...Political Affairs, Foreign Relations and Defense Committee of the Republic Assembly, which convened under the chairmanship ... Political Affairs, Foreign Relations and Defense Committee, which met today, unanimously accepted the ""Draft Decision...","Sat, 20 Jun 2026 02:08:09 GMT"
Ondas to Acquire Cyberhawk in $125 Million Critical Infrastructure Push,https://insideunmannedsystems.com/ondas-to-acquire-cyberhawk-in-125-million-critical-infrastructure-push/,"For Ondas, the acquisition extends a dual-use strategy that has so far centered on defense and security autonomy American Robotics, Airobotics, Iron Drone, Sentrycs into commercial critical-infrastructure markets. Eric Brock, Ondas chairman...","Fri, 19 Jun 2026 18:34:31 GMT"
Fresh Air: An inside look at President Trump's campaign to acquire Greenland,https://democraticunderground.com/11745570,"...purchase, threat, negotiation or even military action is one of the stranger episodes of his presidency. And while Trump ... Trump himself mentioned the prospect of a military takeover. But the people who - at the time didn't know that this was...","Fri, 19 Jun 2026 18:52:25 GMT"
MDA Space (MDA) Stock Secures $620M Acquisition of Blue Canyon Technologies from RTX,https://worldnl.com/mda-space-mda-stock-secures-620m-acquisition-of-blue-canyon-technologies-from-rtx-411284.html,...its position within U.S. government and defense space sectors.Financial Impact and ProfitabilityMDA projects the ... generation.Strategic Expansion in U.S. Defense SectorMDA has been transparent about its objectives to penetrate deeper...,"Fri, 19 Jun 2026 14:06:32 GMT"
MDA's Ambitious Acquisition of Blue Canyon: A Game-Changer?,https://investorshangout.com/mdas-ambitious-acquisition-of-blue-canyon-a-game-changer-525159-/,"TSX:MDA) just inked a deal to swallow up Blue Canyon Technologies, a move that's putting them squarely in the US defense market's crosshairs. The ink's barely dry on this US$620 million (about C$874 million) cash transaction, not peanuts by any...","Fri, 19 Jun 2026 11:00:15 GMT"
"...Chayka on the Darren Raddysh acquisition by the Maple Leafs: ""He is the type of defenseman we...",https://mapleleafshotstove.com/2026/06/19/john-chayka-on-the-darren-raddysh-acquisition/,"It will be a process with him. We have a lot of great options now on the right side of our defense. We will bring him up the right way. At the right time, when afforded the opportunity, he certainly projects to be an impact player at the NHL level...","Fri, 19 Jun 2026 17:33:28 GMT"
Senate lawmakers bring back acquisition reforms dropped from final 2026 NDAA,https://2ninews.blogspot.com/2026/06/senate-lawmakers-bring-back-acquisition.html,...negotiations last year are resurfacing in the Senate's version of the fiscal 2027 defense policy...,"Fri, 19 Jun 2026 16:42:40 GMT"
Are the Braves Questioning Catcher Defense with Joey Bart's Acquisition?,https://bvmsports.com/2026/06/19/are-the-braves-questioning-catcher-defense-with-joey-barts-acquisition/,"Are the Braves Questioning Catcher Defense with Joey Barts Acquisition?Atlanta Braves acquired catcher Joey Bart, a... The move contrasts with their use of previous backup catchers known for defense rather than hitting.Joey Bart has a...","Fri, 19 Jun 2026 13:31:35 GMT"
Maple Leafs Acquire Darren Raddysh in Eight-Year Sign-and-Trade Deal,https://www.archysport.com/2026/06/maple-leafs-acquire-darren-raddysh-in-eight-year-sign-and-trade-deal/,"Such a move would be a major pivot for the franchise, as Rielly has served as the anchor of the Toronto defense for over a decade. This acquisition follows another recent defensive shuffle by Chayka, which saw goaltender Joseph Woll traded to the...","Fri, 19 Jun 2026 13:11:24 GMT"
MDA Space Agrees to Acquire Blue Canyon Technologies for $620 Million,https://www.citybiz.co/article/863064/mda-space-agrees-to-acquire-blue-canyon-technologies-for-620-million/,...companys presence in the U.S. space and defense market.The acquisition is expected to strengthen MDA Spaces position in ... largest and fastest-growing government and defense space sectors while adding advanced spacecraft manufacturing capabilities...,"Fri, 19 Jun 2026 12:57:58 GMT"
"AI Agent Driven Sensing, Data Acquisition, and Signal Processing Methods in Autonomous Driving",https://www.mdpi.com/journal/sensors/special_issues/H0U4OC96L3,"Xiaohui LiCollege of Intelligence Science and Technology, National University of Defense Technology, Changsha 410073, China advanced driver assistance systems; human-vehicle interaction; human-in-the-loop; driving envelope; collision avoidance;...","Fri, 19 Jun 2026 12:22:17 GMT"
Charting a New Road: What the NATO Acquisition of the GlobalEye Means for Canada NAOC,https://www.europesays.com/nato/2818/,"...surveillance fleet by 2035 to meet its high-level military requirements. In use since the mid-1980s, its current fleet of 14 ... to be offset by comparatively diffuse military and economic benefits. However, the growing public support for defence...","Fri, 19 Jun 2026 12:13:11 GMT"
"...president exits months after KDP acquisition, Liberia to revive...",https://perfectdailygrind.com/2026/06/coffee-news-recap-19-june-2026/,"The Chicago-based soluble coffee startup uses liquid-nitrogen flashfreezing for singleserve pods. Funds will add SKUs and expand into military retail via AAFES. (Chicago, Illinois, US) Sign up to our weekly coffee news recap to get a summary of...","Fri, 19 Jun 2026 12:12:42 GMT"
Charting a New Road: What the NATO Acquisition of the GlobalEye Means for Canada,https://natoassociation.ca/charting-a-new-road-what-the-nato-acquisition-of-the-globaleye-means-for-canada/,"...surveillance fleet by 2035 to meet its high-level military requirements. In use since the mid-1980s, its current fleet of 14 ... to be offset by comparatively diffuse military and economic benefits. However, the growing public support for defence...","Fri, 19 Jun 2026 12:00:00 GMT"
"Golden Dome Update: Congressional Scrutiny, Industry Opportunities & New Acquisition Approaches",https://www.govconwire.com/articles/golden-dome-june-2026-update-opportunities-govcon,"...came from the House Defense Appropriations Subcommittees fiscal year 2027 defense spending bill, which includes $397.9 ... development of military technology.For GovCon executives evaluating future opportunities in homeland missile defense...","Fri, 19 Jun 2026 10:08:19 GMT"
Rumble completes the acquisition of Northern Data for $1.68bn.,https://news.mergerlinks.com/daily-review/rumble-completes-the-acquisition-of-northern-data-for-$-1-68bn,"...of mission critical identification and marking solutions across the aerospace & defense and labeling & packaging industries, for $272m, according to press releases.AstroNova is advised by Rockefeller Capital Management, Foley Hoag and Alliance...","Fri, 19 Jun 2026 06:17:28 GMT"
