title,link,summary,published
"DHQ Trains Veterans in Skills Acquisition to Boost Self-Reliance, Economic Empowerment",https://sahelreportersnews.blogspot.com/2026/07/dhq-trains-veterans-in-skills.html,"The Skill Acquisition Training for Veterans is part of the Defence Headquarters' broader efforts to support the post-service welfare of retired military personnel by promoting economic resilience, entrepreneurship and financial...","Sat, 18 Jul 2026 08:37:00 GMT"
What $8 billion Iridium Acquisition Means For Rocket Lab,https://www.lorenzo2cents.com/p/rklb-irdm,"...weather or hostile interferencein war and defense missions, for instance. In those cases, having a more reliable, although ... discovered that even drones currently used in defense are not generally equipped with Iridium PNT or any equivalent service...","Sat, 18 Jul 2026 09:22:47 GMT"
Speaker Recognizes Shiv Sena Shinde Merger And TMC Rebels In Lok Sabha,https://www.zoomnews.in/en/news-detail/speaker-recognizes-shiv-sena-shinde-merger-and-tmc-rebels-in-lok-sabha.html,"...paper leak, while Also, comments made by Defense Minister Rajnath Singh regarding casualties during Operation Sindoor have ... notice of breach of privilege against the Defense Minister concerning these remarks, while meanwhile, the government remains...","Sat, 18 Jul 2026 18:22:00 GMT"
Trump Administration Promises Overhaul of Defense Acquisition for Startups,https://www.theworldopinion.com/world/trump-administration-promises-overhaul-defense-acquisition-startups,"...innovators and defensetech startups. Speaking at the Pennsylvania Defense & Innovation Summit, Defense Secretary Pete ... favored established defense contractors and made it difficult for emerging firms to secure military contracts. Hegseth...","Thu, 16 Jul 2026 08:21:38 GMT"
"Aura Finalizes Qoria Acquisition, Launches ASX Trading as a Global Online Safety Powerhouse",https://kalkinemedia.com/au/news/announcements/aura-finalizes-qoria-acquisition-launches-asx-trading-as-a-global-online-safety-powerhouse,"The platform provides extensive protection for individuals, families, and enterprises, covering proactive defense against identity theft and financial fraud, as well as tools that assist schools and parents in shielding children from cyberbullying...","Fri, 17 Jul 2026 03:19:00 GMT"
Nightwings Chris Jones on Why Acquisition Makes or Breaks Tech Innovation,https://www.executivebiz.com/articles/military-acquisition-cyber-supply-chain-uxs-chris-jones-nightwing,"...scaling advanced military capabilities at operational speed and emerging technologies reshaping defense strategy and... supply chain is also vulnerable from a cyber perspective, he said, as the defense industrial base is dependent upon...","Fri, 17 Jul 2026 12:38:41 GMT"
Director of Paid Acquisition,https://remotejobs.org/remote-jobs/director-of-paid-acquisition-lakeshore-learning-materials-llc,"...orientation, gender or gender identity, marital status, domestic partnership status, military status, religion, age, national origin, ancestry, alienage, AIDS or AIDS-related complex status, genetic information, predisposition or carrier status...","Fri, 17 Jul 2026 06:27:01 GMT"
Quantum Cybers Facility Acquisition: A Leap into Autonomous Defense Manufacturing,https://asiaexcite.com/business/quantum-cybers-facility-acquisition-a-leap-into-autonomous-defense-manufacturing/,"...shift from tech licensing to autonomous defense manufacturing.However, the industry subtext reveals potential challenges ... production. But with the U.S. Department of Defenses $55 billion budget for drone and autonomous warfare programs in...","Thu, 16 Jul 2026 18:29:24 GMT"
