title,link,summary,published
Diplomatic-Economic Acquisition,https://joshwillger.blogspot.com/2025/09/proposal-for-diplomatic-economic.html,"...casualties by offering an alternative to military conflict. Instead of traditional warfare, this strategy proposes a ... economic dependency is created, making military conflict less appealing for both sides.IV. Revenue Generation: ""Taking...","Sun, 14 Sep 2025 03:14:00 GMT"
HOPE Therapeutics Expands in Florida With Acquisition of Dura Medical,https://www.mychesco.com/a/news/regional/hope-therapeutics-expands-in-florida-with-acquisition-of-dura-medical/,"...Traumatic Incident Reduction Therapy for military veterans. The need is urgentfederal data shows that an average of 22 ... HOPEs commitment to both civilian and military patients.With Dura now under its umbrella, HOPE Therapeutics is...","Sat, 13 Sep 2025 23:00:00 GMT"
CRFS becomes part of Motorola with Silvus acquisition,https://www.securityworldmarket.com/int/News/Business-News/crfs-becomes-part-of-motorola-with-silvus-acquisition1,"...build even more powerful solutions that can deliver actionable RF intelligence to military and national security customers worldwide.CRFS was founded to develop the best possible deployable systems for RF detection and geolocation, and we...","Sat, 13 Sep 2025 22:19:03 GMT"
UK Approves IonQ's Acquisition of Oxford Ionics with Key Safeguards (2025),https://ijustit.com/article/uk-approves-ionq-s-acquisition-of-oxford-ionics-with-key-safeguards,"...communications, advanced simulations and future defense applications, the UK government reviewed the deal for national ... years to intervene in semiconductors, defense suppliers, and telecoms. Quantum computing, long viewed as a frontier...","Sat, 13 Sep 2025 20:43:16 GMT"
"US Targets Chinese Firms Over SMIC Chip Acquisition, ETTelecom",https://telecom.economictimes.indiatimes.com/news/devices/us-targets-chinese-firms-over-smic-chip-acquisition/123864912,"...U.S.-origin items ""in support of China's military modernization, for participating in China's advanced computing and ... distribution sectors, and directly supplying the military, government, and security apparatus of China.""Shanghai Fudan...","Sat, 13 Sep 2025 06:37:33 GMT"
Bitcoin Miner Hut 8 Beats Some Merger Disclosure Suit Claims,https://www.law360.com/classaction/articles/2387589/bitcoin-miner-hut-8-beats-some-merger-disclosure-suit-claims,...email:Select more newsletters to receive for free Access to JusticeAerospace & DefenseAppellateAsset ManagementBankingBenefitsCannabis Capital MarketsColoradoCommercial ContractsConnecticutConstructionCo nsumer...,"Sat, 13 Sep 2025 05:23:50 GMT"
