title,link,summary,published
"...summit could help secure Turkey's acquisition of dozens of fighter jet engines, but won't resolve...",https://www.dubaitelegraph.ae/Economy/693992-turkey-eyes-f110-fighter-jet-engines-as-trump-comes-to-town.html,"...hosted by President Recep Tayyip Erdogan, will bring together leaders from the military alliance's 32 member states.Last month, Trump promised to make Erdogan ""very happy"" when asked about Turkey looking to secure F110 jet engines and being...","Sun, 05 Jul 2026 04:06:03 GMT"
Firefly Aerospace (FLY) Announces Strategic Acquisition of Space-ng,https://finance.yahoo.com/markets/stocks/articles/firefly-aerospace-fly-announces-strategic-022417106.html,"...national security initiatives.Firefly Aerospace Inc. (NASDAQ:FLY) is a space and defense technology company serving government, national security, and commercial customers. The company offers integrated launch and space services technology. It...","Sun, 05 Jul 2026 02:24:17 GMT"
Australia Launches Ambitious New Defense Industry Strategy and Acquisition Overhaul The Globe,https://the-globe.info/2026/07/05/australia-launches-ambitious-new-defense-industry-strategy-and-acquisition-overhaul/,"...implications for Australias defense posture.Australia Unveils Comprehensive Defense Industry Policy to Boost Domestic ... nations defense landscape, Australia has introduced a sweeping strategy aimed at enhancing its domestic defense industry...","Sun, 05 Jul 2026 02:06:31 GMT"
Canada Strengthens Arctic Defense With HIMARS Acquisition,https://www.archyde.com/canada-strengthens-arctic-defense-with-himars-acquisition/,"Canada Strengthens Arctic Defense With HIMARS AcquisitionJuly 5, 2026 Alexandra Hartman ... is the difference between a successful defense and a static target. The systems ability to fire Guided Multiple Launch...","Sun, 05 Jul 2026 01:41:23 GMT"
Talent Acquisition Partner (m/f/d) - Arianegroup,https://builtin.com/job/talent-acquisition-partner-m-f-d/9663262,"...ArianeGroup is a global industrial leader in civil and military space transportation, specializing in the design and production of space launchers and defense systems for European independence and...","Sun, 05 Jul 2026 00:15:50 GMT"
Acquisition Update: Critical Metals Corp Completes Preliminary European Lithium Review,https://www.blogarama.com/business-blogs/1437380-mining-news-review-magazine-blog/77806221-acquisition-update-critical-metals-corp-completes-preliminary-european-lithium,This strategic move mirrors broader trends in the industry where producers are seeking to insulate themselves from the antimony and defense-related supply squeezes and other geopolitical vulnerabilities.Wolfsberg Project: Regulatory Landscape and...,"Sat, 04 Jul 2026 00:32:30 GMT"
Australia Launches Ambitious New Defense Industry Strategy and Acquisition Overhaul,https://www.mondialnews.com/2026/07/05/australia-launches-ambitious-new-defense-industry-strategy-and-acquisition-overhaul/,"...implications for Australias defense posture.Australia Unveils Comprehensive Defense Industry Policy to Boost Domestic ... nations defense landscape, Australia has introduced a sweeping strategy aimed at enhancing its domestic defense industry...","Sun, 05 Jul 2026 00:08:32 GMT"
Morocco Strengthens Military Medical Capabilities with the Acquisition of Seven Rheinmetall Field...,https://en.mcg24.com/morocco-strengthens-military-medical-capabilities-with-the-acquisition-of-seven-rheinmetall-field-hospitals/,"...designated for the Ministry of National Defense, while the other six will be delivered to the Ministry of the Interior. A ... in isolated environments.Beyond their military application, these mobile structures can be mobilized to ensure continuity...","Sat, 04 Jul 2026 21:30:00 GMT"
Unconstitutional Military Merger Nobody in Congress Will Debate w/ Dennis Kucinich The Duran,https://thaiscandemo.blogspot.com/2026/07/unconstitutional-military-merger-nobody.html,Unconstitutional Military Merger Nobody in Congress Will Debate w/ Dennis Kucinich The Duran,"Sat, 04 Jul 2026 19:33:07 GMT"
Jared McCain report card: Thunder guard aces role after NBA trade deadline acquisition,https://eu.oklahoman.com/story/sports/nba/thunder/2026/07/04/jared-mccain-exceeded-expectations-in-okc-after-thunder-76ers-trade/90799741007/,"McCain got picked on defensively, but that was inevitable. Opponents have to target someone on the Thunder. McCain at least tries on defense.He barely had a positive assist (28) to turnover (26) ratio.He shot 28% from three in the Spurs...","Sat, 04 Jul 2026 11:02:09 GMT"
Rocket Lab Announces a Massive $8 Billion Satellite Acquisition. Now What?,https://www.europesays.com/ie/568763/,"In simplest terms, Iridium Communications makes and markets communications and geopositioning solutions for maritime vessels and aircraft, defense forces, and emergency personnel, and navigation assistance for personal and commercial purposes...","Sat, 04 Jul 2026 16:09:16 GMT"
"India approves Rs 52,000cr military acquisition package across Army, Navy",https://business-news-today.com/india-approves-rs-52000cr-military-acquisition-package-across-army-navy-and-air-force/,"...Council has granted in-principle approval to military acquisition proposals estimated at about 52,000 crore, covering... Most of the approvals address one of three military requirements: detecting and defeating unmanned threats, protecting...","Sat, 04 Jul 2026 15:55:11 GMT"
Jared McCain's Journey: From Trade Deadline Acquisition to Thunder's Unlikely Hero (2026),https://hungryphotographer.org/article/jared-mccain-s-journey-from-trade-deadline-acquisition-to-thunder-s-unlikely-hero,"More reps with the ball will help him grow as a playmaker, and he will need to focus on his defense and 3-point shooting.A TakeawayMcCain's journey from a seemingly overlooked acquisition to a playoff hero is a testament to the power of...","Sat, 04 Jul 2026 12:24:32 GMT"
Gunsan Shipyard Poised for Relaunch with LOI for Four Tankers as Acquisition Progresses,https://www.europesays.com/korea/74181/,"...Shipyard in the future. Given HJ Heavy Industries long-term goal of securing U.S. defense shipbuilding contracts, industry observers in South Korea anticipate that the Gunsan Shipyard will undertake a portion of such projects.Representatives from...","Sat, 04 Jul 2026 11:18:08 GMT"
Rocket Lab's $8 Billion Satellite Acquisition: A Game-Changer for Space Tech? (2026),https://grkontrol.org/article/rocket-lab-s-8-billion-satellite-acquisition-a-game-changer-for-space-tech,"Iridium brings to the table a suite of communication and positioning technologies, catering to diverse sectors like maritime, defense, and the burgeoning Internet of Things (IoT). This acquisition is not just about size; it's about synergy. Rocket...","Sat, 04 Jul 2026 11:10:45 GMT"
Unconstitutional Military Merger Nobody in Congress Will Debate w/ Dennis Kucinich,https://dprogram.wordpress.com/2026/07/04/unconstitutional-military-merger-nobody-in-congress-will-debate-w-dennis-kucinich/,Unconstitutional Military Merger Nobody in Congress Will Debate w/ Dennis Kucinich,"Sat, 04 Jul 2026 11:04:30 GMT"
Rocket Lab's $8 Billion Satellite Acquisition: A Game-Changer for Space Industry? (2026),https://telered21.com/article/rocket-lab-s-8-billion-satellite-acquisition-a-game-changer-for-space-industry,"...become a key player in the satellite market.Iridium's focus on maritime, aviation, defense, and IoT connectivity is crucial. With Rocket Lab's launch capabilities, they can now provide end-to-end solutions, ensuring seamless communication and...","Sat, 04 Jul 2026 10:43:23 GMT"
Rocket Lab's $8 Billion Acquisition: Revolutionizing the Space Industry (2026),https://jesuisbelleettestoi.com/article/rocket-lab-s-8-billion-acquisition-revolutionizing-the-space-industry,"...geopositioning solutions. Iridium's technology is crucial for maritime vessels, aircraft, defense forces, and emergency personnel, as well as for personal and commercial navigation. By combining forces, Rocket Lab can now offer a comprehensive...","Sat, 04 Jul 2026 10:38:44 GMT"
Rocket Lab's $8 Billion Iridium Acquisition: What It Means for the Space Industry (2026),https://homelesschild.org/article/rocket-lab-s-8-billion-iridium-acquisition-what-it-means-for-the-space-industry,"Iridium, on the other hand, is a major player in the satellite communications and geopositioning solutions market, with a focus on maritime vessels, aircraft, defense forces, and emergency personnel. By joining forces, Rocket Lab can now offer a...","Sat, 04 Jul 2026 10:25:55 GMT"
"...the event that complete, the acquisition do put Caesars huge footprint so you can Fertittas...",https://www.gadgetchespaccano.it/cool-gadget/in-the-event-that-complete-the-acquisition-do-put-caesars-huge-footprint-so-you-can-fertittas-recreation-and-you-may-hospitality-kingdom-possibly-drawing-regulating-analysis,"...you may the newest releases. They are consulted to own operators, lead to gaming defense efforts, but still plays continuously to stay evident. The greater long-name circumstances to own Caesars s the mix of brand name believe, reliable banking...","Sat, 04 Jul 2026 10:20:21 GMT"
"DAC clears 52,000 crore defence acquisition proposals to boost Military combat readiness",https://www.spsmai.com/features/?id=615&q=DAC-clears-Rs-52000-crore-defence-acquisition-proposals-to-boost-Military-combat-readiness,"In a major push to strengthen India's military preparedness and combat capability, the Defence Acquisition Council (DAC) ... persistent surveillance are becoming central to military operations.With rising regional security challenges and rapid...","Fri, 03 Jul 2026 21:02:10 GMT"
