title,link,summary,published
Kuva and Lisata Therapeutics Amend Merger Agreement,https://lifestyle.brightsfuture.com/story/689121/kuva-and-lisata-therapeutics-amend-merger-agreement/,"...in connection with the proposed transactions may result in significant costs of defense, indemnification and liability; Lisatas ability to successfully demonstrate the efficacy and safety of its product candidates, and the preclinical or clinical...","Fri, 29 May 2026 22:36:38 GMT"
A Pentagon Reveals New Unmanned Aircraft Acquisition Initiative,https://kaitlynhtpp753358.blog5.net/93727872/a-pentagon-reveals-new-unmanned-aircraft-acquisition-initiative,This Defense Department has revealed a new initiative to acquire a significant fleet of ... supplying critical support for future defense missions. Specifics about the contract price and chosen producer remain...,"Fri, 29 May 2026 20:22:40 GMT"
"...approved Arla Foods and DMKs merger, creating a massive dairy cooperative to secure food...",https://thegist.online/2026-05-29-the-eu-approved-arla-foods-and-dmks-merger-en/,"...BloombergOpinion | The Environmental Defense Fund Makes It Harder to Reduce Emissions Wall Street JournalAutodesk CEO ... borders, prioritizing long-term regional defense stability (Reuters).Catch the next Gist for the continents moving...","Fri, 29 May 2026 16:37:17 GMT"
What was the Dallas Cowboys best offseason acquisition? Cowboys news,https://eu.elpasotimes.com/story/sports/football/nfl/2026/05/29/which-offseason-db-pick-up-was-dallas-cowboys-best/90300431007/,...end of the defense that he thought was also quite good.Could there be another move on that defense to improve matters ... Steele Ajani Cornelius Marcellus Johnson DefensePosition Starter Backup Third-String NT Kenny Clark Jay Toia Kelvin...,"Fri, 29 May 2026 14:28:07 GMT"
Redwood AI Corp. Signs Letter of Intent to Acquire Quantum Cybersecurity Firm Quantum.IQ,https://www.citybuzz.co/2026/05/29/redwood-ai-corp-signs-letter-of-intent-to-acquire-quantum-cybersecurity-firm-quantum-iq/,"IQs post-quantum cryptography platform is designed to assist government, defense, financial services and critical... For Redwood AI, which uses AI to accelerate chemistry R&D and defense solutions, the acquisition would add a cybersecurity...","Fri, 29 May 2026 13:26:06 GMT"
China Blocks META Stocks $2 Billion Manus AI Acquisition,https://hcntimes.com/china-blocks-meta-stocks-2-billion-manus-ai-acquisition/,"This report shows seven space stocks you can buy today that may grow as rockets, satellites, defense, space internet, and new space technology become more important.Get This Free...","Fri, 29 May 2026 11:51:00 GMT"
...[2026-10732] | Defense Acquisition Regulations System | Department Of Defense,https://regulations.justia.com/regulations/fedreg/2026/05/29/2026-10732.html,"...DEPARTMENT OF DEFENSE Defense Acquisition Regulations System [Docket Number DARS-2026-0203; OMB ... Requirement; Defense Federal Acquisition Regulation Supplement (DFARS), Contract Financing AGENCY: Defense Acquisition...","Fri, 29 May 2026 11:37:19 GMT"
"...nt; Defense Federal Acquisition Regulation Supplement (DFARS) Part 225, Foreign Acquisition and...",https://regulations.justia.com/regulations/fedreg/2026/05/29/2026-10730.html,"...DEPARTMENT OF DEFENSE Defense Acquisition Regulations System [Docket Number DARS-2026-0201; OMB ... Defense Federal Acquisition Regulation Supplement (DFARS) Part 225, Foreign Acquisition and Related Clauses AGENCY: Defense...","Fri, 29 May 2026 11:35:32 GMT"
Salt Shaker Press: A Template for Challenging the Purpose of the Land Acquisition,https://saltshakerpress.blogspot.com/2026/05/a-template-for-challenging-purpose-of.html,"...bodies.1. Challenging the ""Public Use"" or ""Public Necessity""The most robust legal defense is arguing that the taking does not meet the legal threshold for ""public use"" or is not truly ""necessary.""Necessity Argument: Eminent domain is generally...","Fri, 29 May 2026 10:44:30 GMT"
"...Defense Federal Acquisition Regulation Supplement, Contract Pricing, 32017 [2026-10725] | Defense...",https://regulations.justia.com/regulations/fedreg/2026/05/29/2026-10725.html,"...DEPARTMENT OF DEFENSE Defense Acquisition Regulations System [Docket Number DARS-2026-0199; OMB ... Requirement; Defense Federal Acquisition Regulation Supplement, Contract Pricing AGENCY: Defense Acquisition Regulations...","Fri, 29 May 2026 00:57:23 GMT"
