title,link,summary,published
Patriots Report Roster Update on New Pass-Rusher Acquisition,https://news247planet.com/patriots-report-roster-update-on-new-pass-rusher-acquisition/,"Furthermore, if Judons recovery process drags on, the Patriots could face challenges in implementing their game plan effectively. The defenses ability to disrupt the opposing quarterbacks rhythm is paramount, and the absence of Judon could...","Sun, 01 Mar 2026 00:10:33 GMT"
"DEPOWA Skill Acquisition Centre Graduates 130 Trainees, CDS Reaffirms Support For Youth Empowerment",https://www.spyetv.com.ng/2026/02/depowa-skill-acquisition-centre.html,"The CDS, who was represented by the Chief of Defence Civil-Military Affairs, Rear Admiral Saburi Lawal, stated this at the ... important due to the impact of insurgency on military families, many of whom are widows, orphans, and vulnerable...","Sat, 28 Feb 2026 22:35:04 GMT"
"Manager, Talent Acquisition",https://my.jooble.org/jdp/-8071857494486028385,"Through our recognized customer-centric approach, we partner with leading companies in Aerospace and Defense, Communications, Enterprise, HealthTech, Industrial, Capital Equipment and Energy to deliver solutions for their most complex challenges...","Fri, 27 Feb 2026 20:49:10 GMT"
Nets trade acquisition turns heads against former team during debut,https://www.yardbarker.com/nba/articles/nets_trade_acquisition_turns_heads_against_former_team_during_debut/s1_17113_43531107,"The 6-foot-8 forward was comfortable creating off the dribble, breaking down Bostons defense on a pair of possessions leading to easy Brooklyn buckets. He also threw down a poster dunk over Celtics rookie Hugo Gonzalez in transition early in the...","Sat, 28 Feb 2026 19:00:00 GMT"
Wild Face Tough Decision on Top Center Acquisition Ahead of Deadline,https://news247planet.com/wild-face-tough-decision-on-top-center-acquisition-ahead-of-deadline/,"The Stars capitalized on a miscue by the Avalanche defense, Chris Kreider slipping through to net the equalizer. However ... his lines kept pressure on the Dallas defense, creating mismatches that his skill players exploited. The choice to give his...","Sat, 28 Feb 2026 18:50:46 GMT"
Netflix and Paramount Battle Over Warner: Inside the Hollywood Acquisition Shake-Up,https://dixiesunnews.com/articles/netflix-and-paramount-battle-over-warner-inside-the-hollywood-acquisition-shake-up/,"Senate in February 2026, Ted Sarandos hinted that the enriched catalog might justify future price adjustments.His defense strategy, seen as harsh by some observers, is based on the freedom to cancel: if subscribers feel the price is too high...","Sat, 28 Feb 2026 18:06:25 GMT"
Nets news: Brooklyn trade acquisition turns heads against former team during debut,https://clutchpoints.com/nba/brooklyn-nets/nets-news-brooklyn-trade-acquisition-turns-heads-during-debut,"The 6-foot-8 forward was comfortable creating off the dribble, breaking down Bostons defense on a pair of possessions leading to easy Brooklyn buckets. He also threw down a poster dunk over Celtics rookie Hugo Gonzalez in transition early in the...","Sat, 28 Feb 2026 17:51:48 GMT"
DEPOWA graduates 130 trainees from skills acquisition centre,https://nannews.ng/2026/02/28/depowa/,"Olufemi Oluyede, in his remarks said the occasion underscores the importance of civil-military collaboration in youth empowerment.Oluyede was represented by the Chief of Defence Civil-Military Relations, Rear Admiral Saburi Lawal, who said the...","Sat, 28 Feb 2026 14:20:05 GMT"
Abia Govt completes acquisition of Afro Beverages from AMCON,https://nairametrics.com/2026/02/28/abia-govt-completes-acquisition-of-afro-beverages-from-amcon/,"...boost manufacturing output and create jobs in the state.US, Israel launch joint military strikes on IranFebruary 28, 2026NGX Group Reports 15.6 Billion FY 2025 Profit, Declares 3.00 FY Dividend and 1-for-3 Bonus IssueFebruary 28...","Sat, 28 Feb 2026 10:19:55 GMT"
Lyten Powers Up Europe: Swedish Gigafactory Acquisition Transforms Green Energy Landscape,https://parsers.vc/news/260228-lyten-powers-up-europe--swedish-gigafactory/,"These batteries serve drone, autonomous system, and defense customers. It operates Europe's largest **BESS manufacturing... Applications include concrete, additive manufacturing, motorsports, and defense. Lyten's diverse applications highlight its...","Sat, 28 Feb 2026 08:33:00 GMT"
The Many Firsts In India's New Defence Acquisition Policy,https://www.orfonline.org/research/the-many-firsts-in-india-s-new-defence-acquisition-policy,...needs.Civil-Military Fusion for Streamlined ProductionDAP 2026's approach to civil-military fusion reflects one of its... It recognises that the traditional divide between civil and military specifications has narrowed and encourages procurement...,"Sat, 28 Feb 2026 07:03:20 GMT"
Singapore Bolsters Maritime Surveillance with Gulfstream G550 Aircraft Acquisition,https://sg.headtopics.com/news/singapore-bolsters-maritime-surveillance-with-gulfstream-80369558,"...to maintaining a strong and adaptable defense posture, ensuring its ability to respond effectively to evolving security ... marks a key step in bolstering its overall defense strategy. The G550-MSA, designed specifically for maritime surveillance...","Sat, 28 Feb 2026 06:58:00 GMT"
...Targeting Support System (MITSS) Acquisition Project of the Philippine Navy...,https://www.phdefresource.com/2026/02/marine-forces-imagery-and-targeting.html,"...aerial vehicles (UAVs) in military applications has opened the mindset of military leaders in the Philippines including... Since then, the MITSS have been operational and participated in several military training exercises including Exercise...","Sat, 28 Feb 2026 04:38:33 GMT"
Warner Bros./Paramount Merger (02/27),https://www.iheart.com/podcast/1119-the-john-kobylt-show-20635765/episode/warner-brosparamount-merger-0227-325118661/,"Again, the otherbreak story possibility of a military flex in Iran. We'rewatching that, and we are watching the very real... I mean, this is the largestconcentration of American military firepower since the early two thousands.So the crisis really...","Sat, 28 Feb 2026 02:07:28 GMT"
"Framework Contract For The Acquisition Of Medicines, Supplies And Medical, Surgical, Dental...",https://www.globaltenders.com/tender-detail/framework-contract-for-the-acquisition-of-me-RGLZc6gpLtAwxwo8,"...Corresponding To The Year 2026.Mar 14, 2026Repair and maintenance services of military aircrafts, missiles and spacecraftsnotice_title: Framework Contract For The Acquisition Of Medicines, Supplies And Medical, Surgical, Dental Equipment And...","Fri, 27 Feb 2026 20:20:33 GMT"
