title,link,summary,published
Unusual Machines Expands with Rotor Lab Acquisition and Capital Sales Agreement,https://finance.yahoo.com/news/unusual-machines-expands-rotor-lab-133819224.html,"The acquisition, valued at $7 million, is anticipated to optimize the companys product portfolio with high-performance motors for commercial and defense applications.The IPO for the company was on February 14, 2024, and it has experienced a...","Sat, 20 Sep 2025 13:38:19 GMT"
Intelsat: Luxembourgs SES becomes global satellite powerhouse after merger,https://today.rtl.lu/news/luxembourg/a/2338448.html,"...and resilient connectivity for governments, institutions such as the EU, and the defense sector.""We recently completed a critical five-to-six-month test aboard the aircraft carrier Charles de Gaulle, which sailed from the Mediterranean to the...","Sat, 20 Sep 2025 09:08:00 GMT"
Rheinmetall | Acquisition of German NVL Military Shipyards,https://defenceredefined.com.cy/rheinmetall-acquisition-of-german-nvl-military-shipyards/,"...acquire Naval Vessels Lurssen (NVL), the military division of the prominent German family-owned shipyard group Lurssen.The ... plant in Osnabruck for the production of military vehicles.Source...","Thu, 18 Sep 2025 14:00:35 GMT"
Railroad merger good for America and vets,https://www.tribtoday.com/opinion/letters-to-the-editor/2025/09/railroad-merger-good-for-america-and-vets/,"That commitment to veterans is nothing new: in 2015, nearly one in five freight railroad employees had served in the U.S. military, a testament to how the railroad industry values our nations veterans.Ive seen countless men and women struggle...","Sat, 20 Sep 2025 04:47:26 GMT"
American Acquisition and Territorial Growth (18211861),https://dolus2003.pointblog.net/american-acquisition-and-territorial-growth-1821-1861-84633214,"The port facilitated trade with the Gulf and Atlantic coasts, and the U.S. military expanded Fort Barrancas, reinforcing Pensacolas strategic importance. The city balanced commercial growth with military and naval interests, shaping its dual...","Sat, 20 Sep 2025 03:15:00 GMT"
"Favorite Eco-region, Best Tram Driver, Uni Merger Questions & More",https://www.collegetowns.org/p/favorite-eco-region-best-tram-driver,...objectionable speech is violence and you invite them to see their own aggression as self-defense. This is the bloody fallacy we just witnessed: Accept the premise that rhetoric is a physical attack and you hand extremists a moral permission slip to...,"Fri, 19 Sep 2025 12:05:35 GMT"
