title,link,summary,published
BBK Capital Partners Backs NEOTech Acquisition with Arkview Capital,https://businessnewsthisweek.com/business/bbk-capital-partners-backs-neotech-acquisition-with-arkview-capital/,"...high-reliability electronic manufacturing services to defense, aerospace, medical, industrial, and advanced technology ... execution across long-standing aerospace, defense, medical, and industrial programs.BBK Capital brought a thoughtful...","Sat, 03 Jan 2026 05:42:28 GMT"
...Blocks Chinese-Linked Firm's Acquisition Of American Semiconductor Assets Over Security...,https://www.freepressjournal.in/world/us-president-donald-trump-blocks-chinese-linked-firms-acquisition-of-american-semiconductor-assets-over-security-concerns,"Trump said existing legal authorities, outside Section 721 of the Defense Production Act of 1950, did not provide... Semiconductors are viewed as critical to both civilian and defense applications. US administrations have increasingly used...","Sat, 03 Jan 2026 04:02:01 GMT"
"Jefferies Backs Howmet (HWM) Acquisition, Sees EPS Lift into 2026",https://sg.finance.yahoo.com/news/jefferies-backs-howmet-hwm-acquisition-002337629.html,"Howmet Aerospace Inc. (NYSE:HWM) produces advanced, engineered components used across the aerospace, defense, and commercial transportation markets.While we acknowledge the potential of HWM as an investment, we believe certain AI stocks offer...","Sat, 03 Jan 2026 00:23:37 GMT"
Regarding the Acquisition of Certain Assets of Emcore Corporation by Hiefo...,https://www.memeorandum.com/260102/p71,"...Constitution and the laws of the United States of America, including section 721 of the Defense Production Act of 1950, as amended (section 721), 50 U.S.C. 4565, it is hereby...","Sat, 03 Jan 2026 02:25:00 GMT"
US Blocks Hiefo's Acquisition of Emcore Assets Over National Security Risks (2026),https://emulsionpublicidad.com/article/us-blocks-hiefo-s-acquisition-of-emcore-assets-over-national-security-risks,"But here's where it gets controversial: is this a prudent defense of national interests, or a heavy-handed intervention ... Constitution and key laws like Section 721 of the Defense Production Act of 1950 (commonly referred to as Section 721), this...","Sat, 03 Jan 2026 00:54:10 GMT"
US Government Prohibits HieFo Corporation's Acquisition of Emcore Corporation Assets (2026),https://ijustit.com/article/us-government-prohibits-hiefo-corporation-s-acquisition-of-emcore-corporation-assets,"...authority granted by the Constitution and the Defense Production Act of 1950 (specifically section 721), issued this order ... electronic device we use, from smartphones to military equipment. Control over their design and manufacturing can give a...","Sat, 03 Jan 2026 00:25:50 GMT"
Trump blocks Chinese-backed HieFo's acquisition of US chip assets,https://bitcoinethereumnews.com/finance/trump-blocks-chinese-backed-hiefos-acquisition-of-us-chip-assets/,"It was worth nearly $3 million.Semiconductor experts say Emcores technology has potential military uses. It could also improve AI computer systems, which worries the Trump administration. HieFo and Emcore havent commented on the...","Fri, 02 Jan 2026 23:39:12 GMT"
REGARDING THE ACQUISITION OF CERTAIN ASSETS OF EMCORE CORPORATION BY HIEFO CORPORATION,https://www.whitehouse.gov/presidential-actions/2026/01/regarding-the-acquisition-of-certain-assets-of-emcore-corporation-by-hiefo-corporation/,"...Constitution and the laws of the United States of America, including section 721 of the Defense Production Act of 1950, as amended (section 721), 50 U.S.C. 4565, it is hereby ordered:Section 1. Findings. (a) There is credible evidence that leads...","Fri, 02 Jan 2026 21:37:35 GMT"
"Hulu Guide 2026: Plans, Pricing, Disney+ Merger, And How To Sign Up",https://livenewschat.eu/hulu-live-stream-guide/,"Is There a Hulu Military Discount?Hulu does not currently offer a dedicated military discount. However, service members... The student discount is not available to non-students, including military personnel, unless they are enrolled in an...","Fri, 02 Jan 2026 20:58:54 GMT"
"NDAA scales back ambitious acquisition reforms, offers little on workforce",https://federalnewsnetwork.com/defense-main/2026/01/ndaa-scales-back-ambitious-acquisition-reforms-offers-little-on-workforce/,"...circulated prior to Defense Secretary Pete Hegseths speech to defense executives and senior military acquisition officials ... onal defense contractors, to compete for contracts with the Department of Defense.Small and medium-sized Defense...","Fri, 02 Jan 2026 20:35:42 GMT"
Allison Transmission Completes Acquisition of Dana Incorporated's Off-Highway Drive & Motion Systems...,https://www.allisontransmission.com/newsroom/article/2026/01/02/allison-transmission-completes-acquisition-of-dana-incorporated's-off-highway-drive---motion-systems-business--creating-a-premier--global-industrial-leader,"...research and development efforts, the outcome of which is uncertain; U.S. and foreign defense spending; risks associated with our international operations, including acts of war and increased trade protectionism and tariffs; the discovery of defects...","Fri, 02 Jan 2026 13:03:01 GMT"
BBK Capital Partners with Arkview Capital in Support of NEOTech Acquisition,https://www.01net.it/bbk-capital-partners-with-arkview-capital-in-support-of-neotech-acquisition/,"...high-reliability electronic manufacturing services to defense, aerospace, medical, industrial, and advanced technology ... execution across long-standing aerospace, defense, medical, and industrial programs.BBK Capital brought a thoughtful...","Fri, 02 Jan 2026 18:26:00 GMT"
BBAI - BigBear.ai Finalizes $250M Acquisition of Ask Sage...,https://marketwirenews.com/news-releases/bigbear-ai-finalizes-250m-acquisition-of-ask-sage-bo-6661364168782318.html,"...secure generative AI platform designed for defense, national security, and highly regulated enterprise environments. This ... accelerated demand from national security, defense, intelligence, and regulated commercial sectors .The combined...","Fri, 02 Jan 2026 18:00:34 GMT"
"BigBear.ai Finalizes $250M Acquisition of Ask Sage, Bolstering Secure AI Leadership PRISM MarketView",https://go.chinesewire.com/article/BigBearai-Finalizes-dollar250M-Acquisition-of-Ask-Sage-Bolstering-Secure-AI-Leadership?storyId=695805623488ae000233a282,"...secure generative AI platform designed for defense, national security, and highly regulated enterprise environments. This ... accelerated demand from national security, defense, intelligence, and regulated commercial sectors.The combined platform...","Fri, 02 Jan 2026 04:39:00 GMT"
"BigBear.ai Finalizes $250M Acquisition of Ask Sage, Bolstering Secure AI Leadership PRISM...",https://smb.atmoreadvance.com/article/BigBearai-Finalizes-dollar250M-Acquisition-of-Ask-Sage-Bolstering-Secure-AI-Leadership?storyId=695805623488ae000233a282,"...secure generative AI platform designed for defense, national security, and highly regulated enterprise environments. This ... accelerated demand from national security, defense, intelligence, and regulated commercial sectors.The combined platform...","Fri, 02 Jan 2026 04:39:00 GMT"
Danish Prime Minister Criticizes Ally Over Greenland Acquisition Talks Africa Newswire,https://africanewswire.za.com/danish-prime-minister-criticizes-ally-over-greenland-acquisition-talks/,"Since assuming office in January 2025, Trump has consistently shown interest in acquiring Greenland, stating he would not dismiss the possibility of using military or economic coercion to fulfill that...","Thu, 01 Jan 2026 19:38:04 GMT"
Arkview Capital Purchases Acquisition of NEOTech,https://www.themiddlemarket.com/latest-news/arkview-capital-purchases-acquisition-of-neotech,"based provider of complex electronic manufacturing, microelectronics, and engineering solutions for the defense, aerospace, medical, industrial, and advanced technology sectors.The deal was supported by BBK Capital, which provided capital to help...","Fri, 02 Jan 2026 15:44:16 GMT"
