title,link,summary,published
Pakistan moving forward with acquisition of Chinese AEW&C Aircraft: Report,https://pakistani-air.blogspot.com/2026/04/pakistan-moving-forward-with.html,"The KJ-500 is expected to be included in a broader Chinese defense package.The aircraft would enhance the Pakistan Air ... the J-35A fighter jet and the HQ-19 air defense system, the KJ-500 would serve as a central command platform, linking these...","Fri, 10 Apr 2026 10:00:00 GMT"
Bears GM Hopes for Shemar Turner Breakout; Packers Acquire Key Assets,https://bvmsports.com/2026/04/10/bears-gm-hopes-for-shemar-turner-breakout-packers-acquire-key-assets/,"The Bears will look to maximize Turner's development, while the Packers aim to integrate Hargrave and Franklin effectively into their defense.The emphasis on player development and strategic acquisitions highlights the evolving dynamics within...","Fri, 10 Apr 2026 21:45:20 GMT"
"Irenic Acquisition: IACQU IPO, SPAC - Blank check company formed by Irenic...",https://www.renaissancecapital.com/Profile/IACQU/Irenic-Acquisition/IPO,"Irenic Acquisition Filed Terms, Nasdaq: IACQUBlank check company formed by Irenic Capital Management targeting aerospace and defense.","Fri, 10 Apr 2026 20:42:08 GMT"
Aerospace and defense SPAC Irenic Acquisition files for a $220 million IPO,https://www.renaissancecapital.com/IPO-Center/News/118217/Aerospace-and-defense-SPAC-Irenic-Acquisition-files-for-a-$220-million-IPO,"...Capital Management targeting aerospace and defense, filed on Friday with the SEC to raise up to $220 million in an initial... The SPAC plans to target businesses in the aerospace, defense, and broader industrial sectors.IACQU. Jefferies is the...","Fri, 10 Apr 2026 20:11:17 GMT"
Critical Review: Intellicheck Mobilisa (nasdaq:idn) & Cf Acquisition Corp. Vi (otcmkts:cfviu),https://www.thestockobserver.com/2026/04/10/critical-review-intellicheck-mobilisa-nasdaqidn-cf-acquisition-corp-vi-otcmktscfviu.html,"...and instant credit application kiosk software applications. It serves government, military, and commercial markets. The company was formerly known as Intellicheck Mobilisa, Inc. and changed its name to Intellicheck, Inc. in May 2017. Intellicheck...","Fri, 10 Apr 2026 18:12:44 GMT"
Head to Head Contrast: CF Acquisition Corp. VI (OTCMKTS:CFVIU) vs. Intellicheck Mobilisa...,https://transcriptdaily.com/2026/04/10/head-to-head-contrast-cf-acquisition-corp-vi-otcmktscfviu-vs-intellicheck-mobilisa-nasdaqidn.html,"...and instant credit application kiosk software applications. It serves government, military, and commercial markets. The company was formerly known as Intellicheck Mobilisa, Inc. and changed its name to Intellicheck, Inc. in May 2017. Intellicheck...","Thu, 09 Apr 2026 22:12:43 GMT"
"AI Power Play: Cohere, Aleph Alpha In Advanced Merger Talks",https://www.benzinga.com/markets/private-markets/26/04/51763564/ai-power-play-cohere-aleph-alpha-in-advanced-merger-talks,"...mission-critical applications in regulated industries like public administration, defense, and manufacturing, its website states. Photo...","Fri, 10 Apr 2026 19:13:37 GMT"
Sean McVay Compares Trent McDuffie Acquisition To Jalen Ramsey,https://www.yardbarker.com/nfl/articles/sean_mcvay_compares_trent_mcduffie_acquisition_to_jalen_ramsey/s1_17078_43711820,"...that were similar to what made Jalen Ramsey such a special player for us when our defense was really operating at a high clip. He can play into the boundary, can play to the field, he can play in the slot, he can blitz. Hes rare, and then hes a...","Fri, 10 Apr 2026 18:57:17 GMT"
...Innovation with Liora Technologies Acquisition and Leadership...,https://www.investorwire.com/news-articles/lixte-biotechnology-holdings-inc-nasdaq-lixt-accelerates-cancer-care-innovation-with-liora-technologies-acquisition-and-leadership-expansion/,NASDAQ: RVSN) Positions AI-Powered Collision Avoidance Tech as Solution to Rail Safety MandatesSPARC AI Inc. (CSE: SPAI) (OTCQB: SPAIF) Advances Ukraine Defense Initiatives as Electronic Warfare Reshapes...,"Fri, 10 Apr 2026 17:49:47 GMT"
Strategic Mechanics of Malian Air Defense Acquisition The Yitian L Integration,https://patioorganico.mx/strategic-mechanics-malian-air-defense-acquisition-yitian-l-integration,...for point defense against sophisticated aerial incursions that traditional MANPADS (Man-Portable Air Defense Systems) cannot ... Hybrid Defense ModelThe most effective use of the Yitian-L in Mali will be its integration into a Heterogeneous Defense...,"Fri, 10 Apr 2026 16:59:26 GMT"
VITALSpace: Acquisition Of B.I.G. Enterprises Expands Modular Solutions Platform,https://pulse2.com/vitalspace-acquisition-of-b-i-g-enterprises-expands-modular-solutions-platform/,"Collectively, these businesses serve a wide range of sectors including data centers, government and defense, commercial security, healthcare, and public safety. With the addition of B.I.G. Enterprises, the platform now spans five key end markets...","Fri, 10 Apr 2026 16:21:16 GMT"
"PCSI Completes Acquisition of CareStarter and Feedback, Launching PCSIx Innovation Unit",https://www.01net.it/pcsi-completes-acquisition-of-carestarter-and-feedback-launching-pcsix-innovation-unit/,...community impact.The militarys existing program that provides support to military families who have children with... PCSI identified the programs potential to improve how military families access disability-related services as a key factor...,"Fri, 10 Apr 2026 14:50:00 GMT"
DAC Approves Rs 2.38 Lakh Crore Defense Acquisition Proposals,https://www.overtdefense.com/2026/04/10/dac-approves-rs-2-38-lakh-crore-defense-acquisition-proposals/,"...air-defense envelope, enhance mobility and sustainment and strengthen coastal security. The clear focus is on air defense ... Tunguska short-range air-defense system) to further strengthen Indias layered air-defense shield. Tunguska, which combines...","Fri, 10 Apr 2026 14:00:10 GMT"
BiomX Expands Into Defense With Zorronet Acquisition,https://www.rttnews.com/3638224/biomx-expands-into-defense-with-zorronet-acquisition.aspx,"...control platform designed for real-time defense and security applications.Zorronet's technology integrates video... The platform is already in use by the Israel Defense Forces, Israel Railways, and Tier-1 OEMs such as Elbit Systems, as...","Fri, 10 Apr 2026 13:45:09 GMT"
Why The Texas Longhorns' Biggest Acquisition This Offseason Was Not a Player,https://www.si.com/college/texas/football/texas-longhorns-land-massive-recruiting-prediction-for-elite-cb,9 100 meter in February of this year.That speed will allow him to play the wide side of the defense on an island and helps him track receivers across the field.He lacks on-ball production but that is largely a result of passers being afraid to...,"Fri, 10 Apr 2026 13:00:00 GMT"
BiomX completes acquisition of AI defense software firm Zorronet,https://ph.investing.com/news/company-news/biomx-completes-acquisition-of-ai-defense-software-firm-zorronet-93CH-2327251,"...contracts with the Israel Defense Forces and Israel Railways. Zorronet also serves government customers, Tier-1 OEMs including Elbit Systems, and international clients.The acquisition marks BiomXs entry into the defense, security and rescue...","Fri, 10 Apr 2026 12:38:11 GMT"
Fisk Alloy FSPone acquisition expands global conductor footprint,https://wirenet.org/industry-news/fisk-alloy-fspone-acquisition/,"...critical applications.FSPones specialty conductors serve sectors such as aerospace, defense, electronics and medical devices, where reliability and consistent performance are essential.Strategic move supports global OEM customersThe Fisk...","Fri, 10 Apr 2026 11:24:11 GMT"
Competition & FDI in 2026: UK-EU Reforms Reshaping Merger Approvals and Foreign Investment Screening,https://chushmulilo.blogspot.com/2026/04/competition-fdi-in-2026-uk-eu-reforms.html,"...3) quantum technologies; (4) biotechnology and gene editing; (5) aerospace and defense; (6) energy (including renewable and nuclear); (7) digital infrastructure (5G, cloud, subsea cables); (8) financial market infrastructures; (9) health security...","Fri, 10 Apr 2026 09:34:00 GMT"
Talent Acquisition Partner - Technology - Remote,https://www.theladders.com/job/talent-acquisition-partner-technology-remote-unitednaturalfoodsinc-virtual-travel_86439518,"...salaries, etc. Sources, contacts, qualifies and interviews students and transitioning military veterans. Attends recruiting events relevant to developing a talent pipeline. Follows UNFI recruiting processes and utilizes the applicant tracking system...","Fri, 10 Apr 2026 06:42:28 GMT"
...with Italy for SAMP/T air defense acquisition to accelerate Steel Dome...,https://global.tendernews.com/tender-news.aspx?s=8813&t=T%C3%BCrkiye-opens-talks-with-Italy-for-SAMP/T-air-defense-acquisition-to-accelerate-Steel-Dome-deployme,"...opens talks with Italy for SAMP/T air defense acquisition to accelerate Steel Dome deployment.[Dated: 10 Apr 2026 ... the SAMP/T long-range air and missile defense system, aiming to accelerate deployment of its national Steel Dome...","Fri, 10 Apr 2026 04:34:10 GMT"
"BiomX Acquires Zorronet, Autonomous AI Command-and-Control Platform for Real-Time Defense and Security Applications",https://www.globenewswire.com/news-release/2026/04/10/3271723/0/en/BiomX-Acquires-Zorronet-Autonomous-AI-Command-and-Control-Platform-for-Real-Time-Defense-and-Security-Applications.html,"Targets $81B command-and-control and video analytics markets by 2030, driven by real-time situational awareness in defense environments Targets $81B command-and-control and video analytics markets by 2030, driven by real-time situational awareness in defense environments","Fri, 10 Apr 2026 12:30 GMT"
