title,link,summary,published
"Agero Enters into Agreement to Acquire Urgently, for $5.50 in Cash Per Share, Expanding Tech-Driven...",https://www.pressreleasepoint.com/agero-enters-agreement-acquire-urgently-550-cash-share-expanding-tech-driven-roadside-assistance,"...transactions contemplated by the Merger Agreement may result in significant costs of defense, indemnification and liability; and (x) other factors as set forth from time to time in Urgentlys filings with the SEC, including its Form 10-K for the...","Sat, 14 Mar 2026 01:25:00 GMT"
DCS expands Beavercreek footprint with acquisition of ARCTOS near Wright-Patt,https://www.mahoningmatters.com/living/article315049885.html,"...An Alexandria, Va.-based defense company has acquired a Beavercreek defense firm.DCS Corp. has acquired ARCTOS, uniting ... security and advance critical aerospace and defense technologies.""ARCTOS and its business predecessors have a long...","Sat, 14 Mar 2026 01:03:44 GMT"
Seamless data acquisition and real-time spectrum analysis: Aaronia presents...,https://mundogeo.com/en/2026/03/13/seamless-data-acquisition-and-real-time-spectrum-analysis-aaronia-presents-high-end-solutions-at-satellite-in-washington/,"Complex signal location in the fieldThis year, Satellite is expanding its reach with the debut of GovMilSpace to meet the needs and priorities of the defense sector. With the SPECTRAN V6 Command Center, Aaronia AG is introducing what is...","Sat, 14 Mar 2026 00:19:00 GMT"
Top IT Talent Acquisition Secrets,https://trendwatchdaily83726.digiblogbox.com/64732310/top-it-talent-acquisition-secrets,"...your organization. These agencies work with superior discipline honed through military experience. By leveraging SDVOSB Certified Recruitment, employers verify they are collaborating with trusted experts. The mission is to bridge qualified...","Fri, 13 Mar 2026 23:23:32 GMT"
"Agero Enters into Agreement to Acquire Urgently, for $5.50 in Cas",https://natlawreview.com/press-releases/agero-enters-agreement-acquire-urgently-550-cash-share-expanding-tech-driven,"...transactions contemplated by the Merger Agreement may result in significant costs of defense, indemnification and liability; and (x) other factors as set forth from time to time in Urgentlys filings with the SEC, including its Form 10-K for the...","Fri, 13 Mar 2026 15:10:01 GMT"
"Senior Manager, Talent Acquisition",https://www.builtinseattle.com/job/senior-manager-talent-acquisition/8756362,"...Industries is a defense technology company with a mission to transform U.S. and allied military capabilities with advanced ... innovative companies to the defense industry, Anduril is changing how military systems are designed, built and sold...","Fri, 13 Mar 2026 00:00:32 GMT"
Volatus Aerospace Completes Acquisition of 100% Ownership of Synergy Aviation,https://www.globenewswire.com/news-release/2026/03/13/3255409/0/en/Volatus-Aerospace-Completes-Acquisition-of-100-Ownership-of-Synergy-Aviation.html,Volatus Aerospace Completes Acquisition of 100% Ownership of Synergy Aviation,"Fri, 13 Mar 2026 11:50 GMT"
Volatus Aerospace complete lacquisition dune participation de 100 % dans Synergy Aviation,https://www.globenewswire.com/news-release/2026/03/13/3255409/0/fr/Volatus-Aerospace-compl%C3%A8te-l-acquisition-d-une-participation-de-100-dans-Synergy-Aviation.html,"MONTREAL, 13 mars 2026 (GLOBE NEWSWIRE) -- Volatus Aerospace Inc. (TSXV : FLT | OTCQX : TAKOF | FSE : ABB.F) ( Volatus ou la Societe ), un chef de file canadien en solutions integrees d'aviation, de logistique sans equipage et de technologies de defense et d'aerospatiale a double usage, a annonce aujourd'hui avoir complete l'acquisition de la participation minoritaire residuelle de 41,53 % dans Synergy Aviation Ltd. ( Synergy ). Cette transaction permet a Volatus de detenir 100 % de Synergy, tel qu'annonce precedemment le 4 mars 2026. La pleine propriete simplifie egalement la coordination operationnelle entre les activites d'aviation, de formation, d'ingenierie et de fabrication de Volatus, alors que la Societe continue de renforcer ses capacites aerospatiales.","Fri, 13 Mar 2026 11:50 GMT"
