title,link,summary,published
"Lee Calls to Expedite AI, Drone Introduction, Acquisition of Nuclear-Powered Submarines",https://www.byteseu.com/2053269/,"...military and acquire nuclear-powered submarines under a transition to a strong, future-oriented, and cutting-edge military. ... strengthening and advancing the military would be to have the resolve for independent defense, and called to smoothly and...","Tue, 26 May 2026 02:14:11 GMT"
ZenaTech Targets Growth in New Sector with Acquisition of Geomatics Innovator,https://techcouver.com/2026/05/25/zenatech-growth-sector-with-acquisition-geomatics-innovator/,"Products from ZenaTech include the rugged ZenaDrone 1000, a military-grade drone tested by U.S. Air Force and Navy Reserve ... environments without GPS like warehouses or military facilities, targeting use cases such as inventory management and...","Mon, 25 May 2026 17:00:56 GMT"
Mach Industries Expands Capabilities with $50M Acquisition,https://www.ocbj.com/defense-2/mach-industries-expands-capabilities-with-50m-acquisition/,"Defense manufacturer Mach Industries says its $50 million purchase of rocket ... strengthens the American edge for the military.Chief Executive Ethan Thornton, now 22, started Mach Industries as a...","Mon, 25 May 2026 15:55:23 GMT"
General Oceans MRV Systems Acquisition: Robotics Boost,https://www.latimes.com/b2b/banking-finance/story/2026-05-25/general-oceans-mrv-systems-marine-robotics,"The company stated that this will allow it to deliver more comprehensive solutions to clients in sectors such as offshore energy, defense and ocean research. Founded in 2010 as a spin-off from the Scripps Institution of Oceanography, San...","Mon, 25 May 2026 15:00:00 GMT"
Mobix Labs to Acquire U.S. Rare Earth and Critical Minerals Company,https://themarketonline.ca/mobix-labs-rare-earths-critical-minerals-2026-05-25/,"...supply chains Defense and critical minerals strategy convergesWhat happens when a defense aerospace technology company ... around advanced connectivity, aerospace and defense technologies, and its planned acquisition of Special Project...","Mon, 25 May 2026 14:35:17 GMT"
Italy selects Airbus A330 MRTT tankers after scrapping KC-46 acquisition plan,https://www.europesays.com/netherlands/15972/,"...refueling operations.However, specialized defense media have noted discrepancies between the timeline disclosed in the EU... The tanker acquisition also forms part of a broader Italian military aviation modernization effort. In recent weeks, the...","Mon, 25 May 2026 14:09:13 GMT"
DTC: Adaptive Dynamics Acquisition To Enhance Mission-Critical Communications,https://pulse2.com/dtc-adaptive-dynamics-acquisition-to-enhance-mission-critical-communications/,"...and adaptive filtering techniques for defense and national security applications.DTC said the acquisition strengthens its ... assurance, and communications reliability for defense and security customers operating in increasingly complex operational...","Mon, 25 May 2026 12:39:11 GMT"
"Business News In Africa: MOBX to Acquire U.S. Defense Rare Earth, Critical Minerals Company",https://businessnewsinafrica.blogspot.com/2026/05/mobx-to-acquire-us-defense-rare-earth.html,"...industrial sectors. MOBX is moving directly into the supply chain powering modern defense, aerospace, and AI infrastructure.Forward-Looking StatementsThis press release contains forward-looking statements regarding the proposed acquisition of...","Mon, 25 May 2026 09:01:22 GMT"
"Media Africa 247: MOBX to Acquire U.S. Defense Rare Earth, Critical Minerals Company",http://mediaafrica247.blogspot.com/2026/05/mobx-to-acquire-us-defense-rare-earth.html,"...industrial sectors. MOBX is moving directly into the supply chain powering modern defense, aerospace, and AI infrastructure.Forward-Looking StatementsThis press release contains forward-looking statements regarding the proposed acquisition of...","Mon, 25 May 2026 09:01:00 GMT"
"Business Daily Africa: MOBX to Acquire U.S. Defense Rare Earth, Critical Minerals Company",http://business-daily-africa.blogspot.com/2026/05/mobx-to-acquire-us-defense-rare-earth.html,"...industrial sectors. MOBX is moving directly into the supply chain powering modern defense, aerospace, and AI infrastructure.Forward-Looking StatementsThis press release contains forward-looking statements regarding the proposed acquisition of...","Mon, 25 May 2026 09:00:55 GMT"
"Africa Articles: MOBX to Acquire U.S. Defense Rare Earth, Critical Minerals Company",http://africarticles.blogspot.com/2026/05/mobx-to-acquire-us-defense-rare-earth.html,"...industrial sectors. MOBX is moving directly into the supply chain powering modern defense, aerospace, and AI infrastructure.Forward-Looking StatementsThis press release contains forward-looking statements regarding the proposed acquisition of...","Mon, 25 May 2026 09:00:00 GMT"
"African Analyst: MOBX to Acquire U.S. Defense Rare Earth, Critical Minerals Company",http://africananalyst.blogspot.com/2026/05/mobx-to-acquire-us-defense-rare-earth.html,"...industrial sectors. MOBX is moving directly into the supply chain powering modern defense, aerospace, and AI infrastructure.Forward-Looking StatementsThis press release contains forward-looking statements regarding the proposed acquisition of...","Mon, 25 May 2026 09:00:00 GMT"
"Africa Media Online: MOBX to Acquire U.S. Defense Rare Earth, Critical Minerals Company",http://africamediaonline.blogspot.com/2026/05/mobx-to-acquire-us-defense-rare-earth.html,"...industrial sectors. MOBX is moving directly into the supply chain powering modern defense, aerospace, and AI infrastructure.Forward-Looking StatementsThis press release contains forward-looking statements regarding the proposed acquisition of...","Mon, 25 May 2026 09:00:00 GMT"
...Million Settlement in Microsoft Acquisition...,https://orissasambad.com/activision-blizzard-shareholders-secure-landmark-250-million-settlement-in-microsoft-acquisition-dispute/,"...lodged counterclaims against Sjunde suggests their initial stance was one of vigorous defense. They would have likely argued that the $95 per share offer represented a fair premium for Activision Blizzard at the time, especially considering the...","Mon, 25 May 2026 06:58:31 GMT"
"Across Africa News: MOBX to Acquire U.S. Defense Rare Earth, Critical Minerals Company",http://acrossafricanews.blogspot.com/2026/05/mobx-to-acquire-us-defense-rare-earth.html,"...industrial sectors. MOBX is moving directly into the supply chain powering modern defense, aerospace, and AI infrastructure.Forward-Looking StatementsThis press release contains forward-looking statements regarding the proposed acquisition of...","Mon, 25 May 2026 04:48:37 GMT"
