title,link,summary,published
Secretary Hegseth Got a Lot Right but had a Crucial Miss in His Call for Acquisition Reform,https://www.isstories.com/2025/11/12/secretary-hegseth-got-a-lot-right-but-had-a-crucial-miss-in-his-call-for-acquisition-reform/,...the Defense Security Cooperation Agency under the Undersecretary of Acquisition and Sustainment. Aligning Foreign Military ... systems to strengthen the U.S. and allied defense industrial...,"Wed, 12 Nov 2025 06:00:13 GMT"
Check Point Software Technologies completes acquisition of Lakera,https://www.crn.in/news/check-point-software-technologies-completes-acquisition-of-lakera/,"...Transformation Security, where prevention-first defense meets AI-native guardrails, red-teaming intelligence, and ... exposure.The integration of Check Points defense-grade prevention-first architecture with Lakeras AI-native detection...","Wed, 12 Nov 2025 05:52:27 GMT"
German Army plans to acquire camouflage blankets for tanks,https://carroemotos.com.br/german-army-plans-to-acquire-camouflage-blankets-for-tanks/,"...to perform effective reconnaissance of military equipment in the field.The acquisition of the blankets by the German Armed ... blankets reduce the optical signature of military equipment and can make visual recognition more difficult, they are not as...","Wed, 12 Nov 2025 02:04:39 GMT"
Air T Welcomes Creditor Support for Rex Acquisition,https://www.gurufocus.com/news/3202596/air-t-welcomes-creditor-support-for-rex-acquisition,...sold and/or services provided;Market acceptance of the Company's commercial and military equipment and services;Competition from other providers of similar equipment and services;Changes in government regulation and technology;Changes in the...,"Wed, 12 Nov 2025 01:00:04 GMT"
Eagles trade acquisition considering retirement before playing a single down,https://us.headtopics.com/news/eagles-trade-acquisition-considering-retirement-before-75694393,Here are winners and losers from the Week 10 closer.Newcomer Jaelan Phillips highlights stout Eagles defense in 10-7 win over PackersJaelan Phillips could sense the different mentality that a defending champion exudes as soon as the Philadelphia...,"Wed, 12 Nov 2025 00:32:00 GMT"
The IPO Buzz: Evolution Global Acquisition (EVOXU) Climbs After Upsized IPO,https://www.iposcoop.com/the-ipo-buzz-evolution-global-acquisition-evoxu-climbs-after-upsized-ipo/,"We expect to target companies involved in the exploration, processing, production, and domestic refining and recycling of minerals essential to national defense, clean energy independence, and technological leadership, preferably with enabling...","Wed, 12 Nov 2025 00:11:53 GMT"
Prime Minister: Prioritize surplus houses and land after merger for education and healthcare,https://www.vietnam.vn/en/thu-tuong-uu-tien-nha-dat-doi-du-sau-sap-nhap-cho-giao-duc-y-te,"The Prime Minister assigned the Ministry of National Defense and the Ministry of Public Security to review and adjust the planning of defense and security land after the conversion of functions, to suit the needs of work, medical facilities...","Tue, 11 Nov 2025 21:29:00 GMT"
