title,link,summary,published
"Rocket Lab Completes Mynaric Acquisition, Adding Laser Optical Co",https://natlawreview.com/press-releases/rocket-lab-completes-mynaric-acquisition-adding-laser-optical-communications,"...operators, satellite prime contractors, and defense and civil government agencies.+ About Rocket Lab About Rocket Lab ... than 1,700 missions spanning commercial, defense and national security missions including GPS, constellations, and...","Tue, 14 Apr 2026 23:45:42 GMT"
Ibas - Improved Bradley Acquisition Subsystem,https://www.acronymfinder.com/Improved-Bradley-Acquisition-Subsystem-(IBAS).html,"...life-cycle costs by leveraging commonality and promoting interoperability across military platforms, it uses the same SG FLIR found in the M1 Commander's Independent Viewer (CIV), the Bradley M2A3 Improved Bradley Acquisition Subsystem (IBAS), and...","Tue, 14 Apr 2026 21:41:54 GMT"
Acquisition Project Specialist NH-1101-03,https://www.edwards.af.mil/About/Jobs/Article/4459961/acquisition-project-specialist-nh-1101-03/,...capabilities. The Digital Integrated Air Defense System (DIADS) software model includes algorithms for threat radar ... to Temporary Duty Assignment (TDY) by military or commercial aircraft approximately 60 days per year.Installation wide...,"Tue, 14 Apr 2026 15:13:48 GMT"
"Rocket Lab Completes Mynaric Acquisition, Adding Laser Optical Communications To Growing Space...",https://www.mediaindustryobserver.com/article/905748715-rocket-lab-completes-mynaric-acquisition-adding-laser-optical-communications-to-growing-space-systems-portfolio,"...operators, satellite prime contractors, and defense and civil government agencies.+ About Rocket Lab About Rocket Lab ... than 1,700 missions spanning commercial, defense and national security missions including GPS, constellations, and...","Tue, 14 Apr 2026 21:22:47 GMT"
Rocket Lab Closes Mynaric Acquisition At Higher Price Than Originally Agreed,https://www.defensedaily.com/rocket-lab-closes-mynaric-acquisition-at-higher-price-than-originally-agreed/business-financial/,"3 million, $5.3 million more than the original deal terms announced in March 2025 (Defense Daily, March 12, 2025). The final transaction price included a nominal cash payment and nearly 2.3 million shares of Rocket Labs stock. Original terms...","Tue, 14 Apr 2026 21:13:52 GMT"
The Agent Is the Threat: Palo Alto Networks Closes Koi Acquisition and Names a New Security Category,https://www.shashi.co/2026/04/the-agent-is-threat-palo-alto-networks.html,"...Koi, an Israeli cybersecurity startup founded in 2024 by veterans of the Israel Defense Forces' Unit 8200 intelligence program. The acquisition closes a deal announced in February 2026, and with it Palo Alto Networks formally declares a new...","Tue, 14 Apr 2026 21:04:26 GMT"
"ZenaTech Completes Acquisition of NOW Solutions Inc., Expanding its Enterprise SaaS...",https://www.productinnovationtimes.com/article/905673764-zenatech-completes-acquisition-of-now-solutions-inc-expanding-its-enterprise-saas-division-with-government-and-public-sector-customers-and,"...applications for business, government and defense. Since 2017, the Company has leveraged its software development expertise ... implemented in these plus agriculture, defense, and logistics sectors, ZenaTechs portfolio of solutions helps drive speed...","Tue, 14 Apr 2026 21:03:38 GMT"
Amazon to Acquire Globalstar for $11 Billion to Rival Starlink,https://www.world-today-news.com/amazon-to-acquire-globalstar-for-11-billion-to-rival-starlink/,"...EffectThis move triggers a broader trend of consolidation in the aerospace and defense sectors. As the barrier to entry for LEO constellations rises, smaller satellite firms are finding themselves either as targets for acquisition or facing an...","Tue, 14 Apr 2026 20:45:42 GMT"
TJ Friedl's Struggles Open Door for Offseason Acquisition to Crack Reds Roster,https://www.si.com/mlb/reds/onsi/cincinnati-reds-analysis/what-to-expect-from-rece-hinds-after-his-promotion-to-reds-01kp6cjkwvm6,The non-negotiable thing that Hinds will bring to the Reds is speed and outfield defense. He's one of the fastest players in the entire Reds organization and has taken big strides as an outfield defender over the last two years.At the plate...,"Tue, 14 Apr 2026 20:32:15 GMT"
Rocket Lab completes $155.3M acquisition of Mynaric,https://uk.investing.com/news/company-news/rocket-lab-completes-1553m-acquisition-of-mynaric-93CH-4607853,"...operators, satellite contractors, and defense and civil government agencies across Europe, the United States, and other...","Tue, 14 Apr 2026 20:10:14 GMT"
Amazon's $11.57 Billion Move: Challenging Elon Musk's Starlink with Globalstar Acquisition (2026),https://koltushi.org/article/amazon-s-11-57-billion-move-challenging-elon-musk-s-starlink-with-globalstar-acquisition,"...at all? What if its the data those satellites collect? From weather patterns to military movements, the information gathered from low Earth orbit could be the most valuable commodity of all. In this game, Amazon isnt just playing to winits...","Tue, 14 Apr 2026 20:05:26 GMT"
"ZenaTech, Inc. Announces Acquisition of NOW Solutions Inc. to Enhance Enterprise SaaS Division",https://www.quiverquant.com/news/ZenaTech%2C+Inc.+Announces+Acquisition+of+NOW+Solutions+Inc.+to+Enhance+Enterprise+SaaS+Division,"...applications for business, government and defense. Since 2017, the Company has leveraged its software development expertise ... implemented in these plus agriculture, defense, and logistics sectors, ZenaTechs portfolio of solutions helps drive speed...","Tue, 14 Apr 2026 10:21:00 GMT"
GenNx360 Capital Partners Announces Horsburgh & Scotts Acquisition of Franklin Machine & Gear,https://www.businesswire.com/news/home/20260414846839/en/GenNx360-Capital-Partners-Announces-Horsburgh-Scotts-Acquisition-of-Franklin-Machine-Gear,"...including steel, mining, energy, marine, and defense, from its facilities in Ohio, Illinois, Louisiana, and ... cement, oil & gas, power generation, marine, defense, and other heavy industrial end markets from facilities in the U.S. and...","Tue, 14 Apr 2026 05:44:11 GMT"
One of the key military trophies of this war was Iran's acquisition of the American GBU-39 glide...,https://news-pravda.com/world/2026/04/14/2239827.html,One of the key military trophies of this war was Iran's acquisition of the American GBU-39 glide bomb.This technology is considered highly classified by the Pentagon due to its...,"Tue, 14 Apr 2026 18:01:21 GMT"
Bridge Defense Strengthens Intelligence with Syntelligent Acquisition for Enhanced Analytics,https://third-news.com/article/3b2f59d2-3825-11f1-b65b-9ca3ba0a67df,...Defense Expands Intelligence Capabilities Through Strategic Acquisition of Syntelligent Analytic SolutionsBridge Defense ... enhances Bridge Defense's existing strengths in software development and deployable systems.Bridge Defense officials...,"Tue, 14 Apr 2026 17:13:18 GMT"
NPS Acquisition Research Symposium and Innovation Summit 2026,https://sercuarc.org/event/nps-acquisition-research-symposium-and-innovation-summit-2026/,"...field of defense acquisition. The event brings together academic researchers, acquisition professionals, and defense service ... warfighting capabilities by reviving our defense industrial base, reforming our acquisition process, and rapidly fielding...","Tue, 14 Apr 2026 16:56:34 GMT"
...Engineering Excellence with Acquisition of BJN...,https://www.businesswire.com/news/home/20210121005144/en/Helios-Technologies-to-Open-the-Helios-Center-of-Engineering-Excellence-with-Acquisition-of-BJN-Technologies,"It provides customized turnkey solutions encompassing embedded software, wireless electronics and manufacturing in the defense, motion control and manufacturing industries, and has been an engineering service provider to Helios for several years...","Tue, 14 Apr 2026 16:42:28 GMT"
Aircraft Acquisition: A Practical Guide for First-Time Buyers,https://cascadebusnews.com/aircraft-acquisition-a-practical-guide-for-first-time-buyers/,"Consider the government as well because they serve as official transport, which is critical for defense use. They can be utilized by the military during rescue missions, and they can be reliable when it comes to transporting teams...","Tue, 14 Apr 2026 16:17:06 GMT"
Signia Aerospace Expands Aircraft Systems Capability with Aerox Acquisition,https://airlineindustrytoday.com/article/905695727-signia-aerospace-expands-aircraft-systems-capability-with-aerox-acquisition,"...aviation, business aviation, airline, military, and special mission applications.Aerox designs and manufactures portable ... mission-critical components for the aerospace and defense industries. Through a portfolio of market-leading, complementary...","Tue, 14 Apr 2026 16:10:42 GMT"
"Stephens Group Forms Aptus Aero, Appoints Dale Gabel as CEO, and Acquires Atlas Aerospace",http://www.businesswire.com/news/home/20260414157684/en/Stephens-Group-Forms-Aptus-Aero-Appoints-Dale-Gabel-as-CEO-and-Acquires-Atlas-Aerospace/?feedref=JjAwJuNHiystnCoBq_hl-Rc4vIAVcHHkbDcwJimU8QtrtlakeQ9hNboBqTAWIjTge3KWq9s9jif-UkBjBsFRyYAbRTSLTc1mgvhPlnaBA55M-oupQnbXnhKsYk8RmHF_kAy2gZikaX3QWV6xOvgFlA==,"LITTLE ROCK, Ark.--(BUSINESS WIRE)--The Stephens Group, LLC (Stephens Group) is pleased to announce the formation of Aptus Aero, LLC (Aptus Aero), a provider of maintenance, repair, and overhaul (MRO) services for the aviation industry. Aptus Aero will serve as a new platform for Stephens Group with a focus on acquiring and growing market leading component MRO businesses. Stephens Group is executing on its mission to build a world-class provider of highly engineered component repairs for","Tue, 14 Apr 2026 12:00:00 UT"
"BT Brands, Inc. Announces Its Merger Partner, Aero Velocity, Has Entered into Strategic Partnership with AC Future to Develop Advanced Mobile Drone Launch Technologies for the U.S. Military",http://www.businesswire.com/news/home/20260414876693/en/BT-Brands-Inc.-Announces-Its-Merger-Partner-Aero-Velocity-Has-Entered-into-Strategic-Partnership-with-AC-Future-to-Develop-Advanced-Mobile-Drone-Launch-Technologies-for-the-U.S.-Military/?feedref=JjAwJuNHiystnCoBq_hl-Rc4vIAVcHHkbDcwJimU8QtrtlakeQ9hNboBqTAWIjTge3KWq9s9jif-UkBjBsFRyYAbRTSLTc1mgvhPlnaBA55M-oupQnbXnhKsYk8RmHF_kAy2gZikaX3QWV6xOvgFlA==,"MINNETONKA, Minn.--(BUSINESS WIRE)--Aero Velocity and AC Future, Inc. Join Forces to Pursue Advanced Mobile Drone Launch Technologies for Military and Commercial Applications","Tue, 14 Apr 2026 11:00:00 UT"
