title,link,summary,published
Ecowaste Solutions Completes Gulf Coast Corridor with Adams Sanitation Acquisition,https://wasteadvantagemag.com/ecowaste-solutions-completes-gulf-coast-corridor-with-adams-sanitation-acquisition/,"Adams built its reputation one neighborhood at a time across Northwest Florida, from the river towns of Milton and Pace through the military communities surrounding Eglin Air Force Base and Hurlburt Field, out to the resort destinations along the...","Mon, 04 May 2026 04:08:06 GMT"
"Israel to acquire two squadrons of F-35, F-15IA aircraft; Netanyahu directs 350...",https://manufacturing.economictimes.indiatimes.com/news/aerospace-defence/israel-to-acquire-two-squadrons-of-f-35-f-15ia-aircraft-netanyahu-directs-350-billion-shekels-investment-in-defence-manufacturing-budget/130743565,"ANI Published On May 4, 2026 at 07:52 AM ISTIsrael F-35 acquisition, F-15IA aircraft, Benjamin Netanyahu defense announcement, air superiority Israel, Israeli defense budget...","Mon, 04 May 2026 02:34:30 GMT"
"ICYMI: Kentucky Regulators Approve American Water, Essential Utilities Merger",https://www.mychesco.com/a/news/regional/icymi-kentucky-regulators-approve-american-water-essential-utilities-merger/,"American Water is the largest regulated water and wastewater utility in the United States, serving approximately 14 million people across 14 states and 18 military installations.Essential Utilities provides water, wastewater, and natural gas...","Mon, 04 May 2026 02:00:00 GMT"
...Is The Science of Rapid Skill Acquisition: How Strategic Pressure Accelerates Learning A Better...,https://abettermandotblog.wordpress.com/2026/05/04/what-is-the-science-of-rapid-skill-acquisition-how-strategic-pressure-accelerates-learning/,The real-world stakes create unparalleled focus.Language AcquisitionDefense Department studies show immersion students...,"Mon, 04 May 2026 00:48:19 GMT"
"Tech Roundup: Ask.com Shutdown, Meta's Manus Acquisition Blocked & More",https://therarefied.blogspot.com/2026/05/tech-roundup-askcom-shutdown-metas.html,"...demanding that the U.S. Department of Defense be bared from using Google's AI for classified work; comes as the DoD strikes ... AI to use their AI tools on classified military networks ""for lawful operational use,"" joining OpenAI and xAI. (The...","Sun, 03 May 2026 12:42:00 GMT"
...the Under Secretary of War for Acquisition & Sustainment [Image 3 of...,https://www.dvidshub.net/image/9658649/naval-weapons-station-yorktown-hosts-under-secretary-war-acquisition-sustainment,"...Missile (TLAM) facility. His visit also included an industry roundtable with several defense companies in Williamsburg, Virginia. (U.S. Navy Photo by Culinary Specialist Second Class Maria Lorenzo/Released).05.01.2026 05.03.2026...","Fri, 01 May 2026 21:46:23 GMT"
The Navys New Acting Secretary Just Threw Out the Old Acquisition Playbook,https://www.19fortyfive.com/2026/05/the-navys-new-acting-secretary-just-threw-out-the-old-acquisition-playbook/,"...performance. I dont need cross-dressers in the military, Cao stated. I need alpha males and alpha females. The Acting ... is at the moment, particularly for air defense interceptors as well as Tomahawk cruise missile munitions.Though highly...","Sun, 03 May 2026 22:33:15 GMT"
