title,link,summary,published
Yankees' key trade acquisition quietly struggling worse than Anthony Volpe,https://www.yardbarker.com/mlb/articles/yankees_key_trade_acquisition_quietly_struggling_worse_than_anthony_volpe/s1_13132_42644439,"...surrounds the team thanks to his solid defense, posting two outs above average during his time in the Bronx. With the ... throughout the month of August. Although his defense sparkles, the Yankees desperately need him to bounce back at the plate...","Tue, 26 Aug 2025 23:43:14 GMT"
CBJ editorial: HNIs big acquisition and its gift,https://corridorbusiness.com/cbj-editorial-hnis-big-acquisition-and-its-gift/,"8, 2024.Boeing is the largest aerospace company in the world and one of the biggest defense contractors, with an estimated 170,000 employees.Mr. Ortberg walked into a very difficult situation and did what needed to be done quickly, said John...","Tue, 26 Aug 2025 21:39:06 GMT"
...Increase in Revenue for Q2 with Acquisition Plans Including UK Telecom 3D Design/Modeling Company...,https://www.financialcontent.com/article/prlog-2025-8-26-500-increase-in-revenue-for-q2-with-acquisition-plans-including-uk-telecom-3d-designmodeling-company-for-global-ai-drone-and-quantum-computing-leader,"...modern defense and autonomous drone systems that can utilize ZENA drone solutions.The US Department of Defense, along with ... Inspection, Surveillance and Reconnaissance) defense applications.The $ ZENA Quantum Computing Division will also further...","Tue, 26 Aug 2025 18:56:19 GMT"
Weil Advised Peak Rock in its Acquisition of Aegis Software,https://www.weil.com/articles/weil-advised-peak-rock-in-its-acquisition-of-aegis-software,"...software for electronic components and discrete manufacturing across the aerospace & defense, medical device, consumer electronics and diversified industrial...","Tue, 26 Aug 2025 20:21:23 GMT"
Okta Boosts PAM with Axiom Security Acquisition,https://www.channelfutures.com/mergers-acquisitions/okta-boosts-pam-axiom-security-acquisition,"...various resources on the platform. These identity security tools will act as a central defense for clients as they strive to mitigate AI-related risks.By acquiring Axiom Security, Okta is taking a significant step forward in delivering a...","Tue, 26 Aug 2025 19:27:03 GMT"
How AI can accelerate defense acquisition and help U.S. forces keep pace with technology,https://federalnewsnetwork.com/commentary/2025/08/how-ai-can-accelerate-defense-acquisition-and-help-u-s-forces-keep-pace-with-technology/,"...pressing challenges facing American defense today. With major Defense Department acquisitions taking an average of 11 years ... of innovation. Early pilots within the Defense Innovation Unit have already shown promise, with AI-assisted compliance...","Tue, 26 Aug 2025 19:19:23 GMT"
...Revenue for Q2 with Aggressive Acquisition Plans in Play Including UK Telecom 3D Design/Modeling...,https://news.financenewsworld.com/story/518719/500-increase-in-yearoveryear-revenue-for-q2-with-aggressive-acquisition-plans-in-play-including-uk-telecom-3d-designmodeling-company-for-global-ai-drone-quantum-computing-leader-zenatech-inc.html,"...modern defense and autonomous drone systems that can utilize ZENA drone solutions.The US Department of Defense, along with ... Inspection, Surveillance and Reconnaissance) defense applications.ZENA Quantum Computing Division will also further two...","Tue, 26 Aug 2025 18:11:18 GMT"
Okta Makes Ai Identity Play With Axiom Acquisition,https://cybernoz.com/okta-makes-ai-identity-play-with-axiom-acquisition/,"...Itay Mesika and Ilan Dardik, who, like many cyber entrepreneurs, met during their military service. The firm has attracted around $10m in funding in the past couple of years, including a $7m seed round in 2022.Still operating very much in its...","Tue, 26 Aug 2025 18:02:42 GMT"
