title,link,summary,published
...giant Orlen is considering the acquisition of a stake in Ukraine's largest oil-producing...,https://ubn.news/polish-energy-giant-orlen-is-considering-the-acquisition-of-a-stake-in-ukraines-largest-oil-producing-company/,...balance sheet. The companys shareholders are Naftogaz of Ukraine and the Ministry of Defense of Ukraine. Ukrnafta also operates the largest network of gas stations in Ukraine ...,"Mon, 01 Jun 2026 02:14:26 GMT"
US Bets on Greenland Acquisition,https://www.europesays.com/3030780/,"...status.Will the US start the process of building a nuclear-powered data center on a military base before 2030? 2026 StartupHub.ai. All rights reserved. Do not enter, scrape, copy, reproduce, or republish this article in whole or in part. Use...","Mon, 01 Jun 2026 00:30:09 GMT"
Out of Time: Why Acquisition Speed Is the Navys Most Urgent Problem,https://www.usni.org/magazines/proceedings/2026/june/out-time-why-acquisition-speed-navys-most-urgent-problem,"...vast network of shipyards dedicated to military productioncranes swing steel while welders labor under floodlights. By... Chinas one-party communist system fuses civil and military priorities, allowing leaders to redirect commercial...","Mon, 01 Jun 2026 00:01:12 GMT"
Sopra Steria: Proposed Acquisition Of Digital Product Simulation To Expand PLM And Digital...,https://pulse2.com/sopra-steria-proposed-acquisition-of-digital-product-simulation-to-expand-plm-and-digital-engineering-capabilities/,"The company provides consulting, methodology development, training, and support services to major clients across the aeronautics, defense, and nuclear industries. The firm employs more than 115 engineers and reported IFRS revenue of approximately...","Sun, 31 May 2026 23:11:25 GMT"
"Us Military Israel Merger, Trump Interview Fail,",https://www.onenewspage.com/video/20260531/17773429/US-MILITARY-ISRAEL-MERGER-TRUMP-INTERVIEW-FAIL-SPENCER.htm,"US MILITARY ISRAEL MERGER, TRUMP INTERVIEW FAIL, SPENCER PRATT SURGE, MUSICIANS BAIL ON TRUMP","Sun, 31 May 2026 22:17:28 GMT"
Arclin Completes Acquisition Of The DuPontTM Aramids Business,https://www.textileworld.com/textile-world/textile-news/2026/05/arclin-completes-acquisition-of-the-dupont-aramids-business/,"The combined portfolio now spans aerospace, electrical infrastructure, electric vehicles, personal protection and defense, strengthening Arclins reach in advanced protective applications.Were excited to join the Arclin family, said Aramids...","Sun, 31 May 2026 22:12:44 GMT"
John Steckel on Scaling AMERICAN SYSTEMS through the Epsilon Acquisition,https://washingtonexec.com/2026/05/john-steckel-on-scaling-american-systems-through-the-epsilon-acquisition/,"...for FedEx and in several smaller B2B and B2C companies, and then moved into the defense industry in business development roles at BAE Systems, Raytheon, Vencore, Perspecta, and now AMERICAN SYSTEMS. The common thread through all of that is simple...","Sun, 31 May 2026 10:09:47 GMT"
From the Memo to the Merger Ophelia Singing,https://opheliasinging.wordpress.com/2026/05/31/from-the-memo-to-the-merger/,"...National Defense Authorization Act, released in May 2026. The provision directs the Secretary of Defense to appoint an...","Sat, 30 May 2026 22:31:07 GMT"
"Congress, Act Now to Stop the Israeli-US Military-Industrial Merger in Its Tracks",https://www.commondreams.org/opinion/stop-israel-us-military-merger,"...the US military with the Israeli military than the more than $200 billion (inflation adjusted) in military assistance ... US-Israeli military-industrial complex cooperation. The US and Israel already work together heavily on missile defense, but...","Sun, 31 May 2026 12:03:01 GMT"
Cloud Computing: The Sovereign MindsetThe 5 Brutal Laws of Elite Wealth Acquisition,https://cloudbelievers.blogspot.com/2026/05/the-sovereign-mindsetthe-5-brutal-laws.html,"...High-Net-Worth Display Affluence Establish Trust & Extract CapitalThe Defense Layer (In Front of the Poor): When interacting with less fortunate relatives or peers, actively complain about being broke. Claim you are suffocating under a...","Sun, 31 May 2026 07:39:35 GMT"
