title,link,summary,published
Indian Air Forces Tu-160M Acquisition Plans Hit Roadblock,https://idrw.org/indian-air-forces-tu-160m-acquisition-plans-hit-roadblock/,"...strategic bombers, as reported by veteran defense journalist Sandeep Unnithan. The offer, tied to Russias reactivation of ... strategic bombers, as reported by veteran defense journalist Sandeep Unnithan. The offer, tied to Russias reactivation of...","Wed, 25 Jun 2025 02:44:30 GMT"
"GLAZER CAPITAL, LLC's Strategic Acquisition of Triumph Group Inc Shares",https://www.gurufocus.com/news/2944078/glazer-capital-llcs-strategic-acquisition-of-triumph-group-inc-shares,"...Inc's potential within the aerospace and defense sector. The transaction was executed at a price of $25.8 per share ... base, including commercial, business, and military markets. Despite its significant market presence, the company is...","Wed, 25 Jun 2025 00:45:18 GMT"
KWG Announces Proposed Investment Acquisition,https://matribhumisamachar.com/en/2025/06/25/kwg-announces-proposed-investment-acquisition/,Newcon Optik is a night optical equipment manufacturer and a world leader in laser-based rangefinders which are sold to military and police organizations in many countries. With annual net income ranging between $2.9 million and $6.1 million over...,"Tue, 24 Jun 2025 23:59:13 GMT"
Strategic Procapbtc Bitcoin Acquisition: Unlo...,https://coinstats.app/news/77ad6d65032f8e7182f2c429cf6a717f0577bd1253050fdc57ff7c4df47d59a1_Strategic-ProCapBTC-Bitcoin-Acquisition-Unlocking-a-New-Era-of-Institutional-Bitcoin-Adoption/,"Research and Education: Follow thought leaders like Anthony Pompliano, read whitepapers, and stay informed about market trends. Knowledge is your best defense against market FUD (Fear, Uncertainty, Doubt). Diversification (within reason): While...","Tue, 24 Jun 2025 23:55:42 GMT"
...Partners advises RIM Enterprises on merger with Alliance Air Parts PR Newswire Today at 11:11pm...,https://smb.harlandaily.com/article/XLCS-Partners-advises-RIM-Enterprises-on-merger-with-Alliance-Air-Parts?storyId=685b3121ac88ed3eebd749e7,...globally and is recognized for its vast experience advising owners of Aerospace & Defense businesses. More information can be found at www.xlcspartners.com.SOURCE XLCS Partners...,"Tue, 24 Jun 2025 23:53:24 GMT"
XLCS Partners advises RIM Enterprises on merger with Alliance Air Parts,http://newsincredible.com/xlcs-partners-advises-rim-enterprises-on-merger-with-alliance-air-parts/,...globally and is recognized for its vast experience advising owners of Aerospace & Defense businesses. More information can be found at www.xlcspartners.com.Media Contact:Kendra Spankspan@xlcspartners.com615-379-77 83View original content to...,"Tue, 24 Jun 2025 23:49:43 GMT"
Strategic ProCapBTC Bitcoin Acquisition: Unlocking A New Era Of Institutional Bitcoin Adoption,https://bitcoinworld.co.in/procapbtc-bitcoin-acquisition/,"Research and Education: Follow thought leaders like Anthony Pompliano, read whitepapers, and stay informed about market trends. Knowledge is your best defense against market FUD (Fear, Uncertainty, Doubt). Diversification (within reason): While...","Tue, 24 Jun 2025 23:30:32 GMT"
The Merger of MAGA + Neocon Hawks From Both Parties Under The Banner Of War,https://www.truth11.com/the-merger-of-maga-neocon-hawks-from-both-parties-under-the-banner-of-war/,"...Ukraine including; munitions, weapons, military training, and intelligence sharing. The Big Beautiful Betrayer is President ... fact that Trump ordered all nonessential military out of the bases in the Middle East means he has known all along that his...","Tue, 24 Jun 2025 21:53:55 GMT"
"...Intelligence Platform for Defense Acquisition, Contracting and...",https://www.vcaonline.com/news/2025062406/obviant-raises-7-1m-in-funding-to-scale-its-data-intelligence-platform-for-defense-acquisition-contracting-and-budgeting/,"...Edge for the Defense MarketToday, more than ever, with defense budgets at record highs and the defense technology sector ... defense procurement ecosystem. By ingesting and unifying data from thousands of sourcessuch as program documents, defense...","Tue, 24 Jun 2025 06:34:58 GMT"
Snyk Acquires Invariant Labs to Accelerate Agentic AI Security Innovation,https://www.globenewswire.com/news-release/2025/06/24/3104309/0/en/Snyk-Acquires-Invariant-Labs-to-Accelerate-Agentic-AI-Security-Innovation.html,"Acquisition Deepens Snyk Labs Research Bench, Advances Real-Time Defense for Emerging Threats, Extends Security Capabilities in a Single AI-Trust Platform Acquisition Deepens Snyk Labs Research Bench, Advances Real-Time Defense for Emerging Threats, Extends Security Capabilities in a Single AI-Trust Platform","Tue, 24 Jun 2025 13:00 GMT"
