title,link,summary,published
Cellebrite Expands Digital Intelligence Reach with Acquisition of SCG Canada,https://www.citybiz.co/article/812903/cellebrite-expands-digital-intelligence-reach-with-acquisition-of-scg-canada/,"...of the fastest-growing data sources in defense and public safetyCellebrite (NASDAQ: CLBT), a global leader in AI-powered... Use of drones has continued to expand globally across the defense, intelligence, law enforcement, and commercial sectors...","Tue, 03 Mar 2026 00:58:44 GMT"
"Cellebrite Completes Acquisition of Drone Forensics Leader SCG Canada, Inc. ContentEngine",https://contentenginellc.com/2026/03/02/cellebrite-completes-acquisition-of-drone-forensics-leader-scg-canada-inc/,"...of the fastest-growing data sources in defense and public safetyTYSONS CORNER, Va. and PETAH TIKVA, Israel, March 2, 2026... Use of drones has continued to expand globally across the defense, intelligence, law enforcement and commercial sectors...","Mon, 02 Mar 2026 22:32:07 GMT"
OpenAI Lands $200M Pentagon AI Deal and ClearanceJobs Expands With Strategic Acquisition,https://news.clearancejobs.com/2026/03/02/openai-lands-200m-pentagon-ai-deal-and-clearancejobs-expands-with-strategic-acquisition/,"...professional services firm serving the Defense and Intelligence Community. The move gives ClearanceJobs the ability to ... clearance and proven past performance across Defense and IC work, ClearanceJobs is no longer just supporting the cleared...","Mon, 02 Mar 2026 22:39:38 GMT"
National Defence Assets: Legal Framework for Acquisition and Land Use and Zoning Issues in Nigeria,https://www.jdsupra.com/legalnews/national-defence-assets-legal-framework-1774180/,"...purposes, including for developing military and defence assets.Military and defence matters are the responsibility of the ... military maintains that these areas form part of reserves deliberately set aside around the Jaji cantonment for military...","Mon, 02 Mar 2026 22:19:28 GMT"
Prized Washington Wizards acquisition Trae Young to make debut Thursday,https://www.usatoday.com/story/sports/nba/wizards/2026/03/02/trae-young-make-washington-wizards-debut-utah-jazz/88951059007/,Though he remains one of the top distributors in the NBA Young led the NBA in assists last season with 11.6 per game his defense has been a significant issue.Washington is navigating a delicate balance for its first-round draft pick. The...,"Mon, 02 Mar 2026 22:04:00 GMT"
"Cellebrite Completes Acquisition of Drone Forensics Leader SCG Canada, Inc.",https://www.thailandbusinessdirectory.net/press-release/cellebrite-completes-acquisition-of-drone-forensics-leader-scg-canada-inc/,"...of the fastest-growing data sources in defense and public safetyTYSONS CORNER, Va. and PETAH TIKVA, Israel, March 2, 2026... Use of drones has continued to expand globally across the defense, intelligence, law enforcement and commercial sectors...","Mon, 02 Mar 2026 21:26:13 GMT"
Rheinmetall ompletes Acquisition of Shipbuilding Company NVL,https://militarnyi.com/en/news/rheinmetall-acquisition-of-shipbuilding-nvl/,"The company is thus expanding its portfolio in the maritime domain and strengthening its position as a comprehensive supplier of defense technologies in Germany and Europe, the company said.Keel laying of the lead ship of the Type 424 project...","Mon, 02 Mar 2026 20:31:59 GMT"
RG-XX To Highlight New Space Force Acquisition Approach,https://www.defensedaily.com/rg-xx-to-highlight-new-space-force-acquisition-approach/space/,...conduct rendezvous and proximity operations to monitor and inspect other satellites (Defense...,"Mon, 02 Mar 2026 20:30:45 GMT"
"DHI Group, Inc. Acquires Point Solutions Group to Advance ClearanceJobs Mission of Providing a Total Recruitment Solution for Government Contracting Talent",http://www.businesswire.com/news/home/20260302256371/en/DHI-Group-Inc.-Acquires-Point-Solutions-Group-to-Advance-ClearanceJobs%E2%80%99-Mission-of-Providing-a-Total-Recruitment-Solution-for-Government-Contracting-Talent/?feedref=JjAwJuNHiystnCoBq_hl-Rc4vIAVcHHkbDcwJimU8QtrtlakeQ9hNboBqTAWIjTge3KWq9s9jif-UkBjBsFRyYAbRTSLTc1mgvhPlnaBA55M-oupQnbXnhKsYk8RmHF_kAy2gZikaX3QWV6xOvgFlA==,"CENTENNIAL, Colo.--(BUSINESS WIRE)--DHI Group, Inc. (NYSE: DHX) today announced it has acquired Point Solutions Group, an engineering and technology professional services firm focusing on defense contracting and government staffing. The acquisition marks another significant milestone in advancing DHIs ClearanceJobs brand strategy offering a total solution in the government contracting space. We were very attracted to Point Solutions Group given the strength of the business and the companys","Mon, 2 Mar 2026 14:00:00 UT"
