title,link,summary,published
"DOD instruction on acquisition, management and use of NTVs",https://insidedefense.com/document/dod-instruction-acquisition-management-and-use-ntvs,"...on acquisition, management and use of NTVsSeptember 2, 2025 The Sept. 2, 2025 Defense Department instruction ""establishes policy, assigns responsibilities, and provides procedures for DOD acquisition, management and use of U.S. Government-owned...","Tue, 02 Sep 2025 20:58:07 GMT"
...Defense talks about keeping the Deputy Commander of the Commune Military Command after the merger,https://news.laodong.vn/thoi-su/bo-quoc-phong-noi-ve-viec-giu-nguyen-pho-chi-huy-truong-quan-su-xa-sau-sap-nhap-1568064.ldo,"...of the Military Command (CHQS) in communes that had been trained at the Military University before the merger to continue working at the Commune Military Command after the merger.Regarding this content, the Ministry of National Defense said that...","Wed, 03 Sep 2025 01:28:58 GMT"
FY2026 Budget Plans to Increase New Technology Acquisition for Defense Department,https://www.ntd.com/fy2026-budget-plans-to-increase-new-technology-acquisition-for-defense-department_1088448.html,...Increase New Technology Acquisition for Defense DepartmentThe Navy will build five more Columbia class submarines and the ... first order of business is the National Defense Authorization Act for fiscal year 2026. The Navy plans to build five more...,"Wed, 03 Sep 2025 00:25:38 GMT"
Nuburu Modifies Acquisition Strategy for Tekne S.p.A.,https://blog.tipranks.com/nuburu-modifies-acquisition-strategy-for-tekne-s-p-a/,"Additionally, Nuburu and Tekne will form a U.S.-based joint venture to develop and sell defense products in the Americas, potentially generating $7.5 million in revenue during the ongoing review. The completion of the acquisition is subject to...","Tue, 02 Sep 2025 21:32:26 GMT"
Nuburu modifies Tekne acquisition terms after Italian review,https://www.streetinsider.com/Corporate+News/Nuburu+modifies+Tekne+acquisition+terms+after+Italian+review/25286162.html,"NYSE: BURU) has modified the terms of its proposed acquisition of Italian defense company Tekne S.p.A. following feedback ... through its newly formed subsidiary Nuburu Defense, LLC, followed by the remaining 67% interest by the end of 2025.The...","Tue, 02 Sep 2025 21:04:44 GMT"
...competition regulator says Spirit-Boeing merger was cleared due to sale of operations to Airbus and...,https://pune.media/uk-competition-regulator-says-spirit-boeing-merger-was-cleared-due-to-sale-of-operations-to-airbus-and-no-impact-on-defence-market/,These covered: the potential restriction of the supply of aerostructures to Airbus; to military aircraft makers selling to the UK; and disruption to the business jet market through deprioritisation of that work.As part of the merger agreement...,"Tue, 02 Sep 2025 17:03:42 GMT"
...On Tiltan Defense Tech Deal Today 11:29 EDT NUKK shares surge on $14M acquisition of Tiltan...,https://markets.financialcontent.com/concordmonitor/quote?Symbol=321%3A13980349,...Defense ETF is publicly traded.What exchange does SPDR S&P Aerospace & Defense ETF trade on?SPDR S&P Aerospace & Defense ... & Defense ETF?The current price of SPDR S&P Aerospace & Defense ETF is 215.47When was SPDR S&P Aerospace & Defense ETF...,"Tue, 02 Sep 2025 15:55:00 GMT"
Arizona Ad Agency Expands to San Francisco with Acquisition,https://inbusinessphx.com/marketing/arizona-ad-agency-expands-to-san-francisco-with-acquisition,"...Communities Foundation, Hotel Polaris, Goodwill of the San Francisco Bay, TASER Self-Defense and Peter Piper...","Tue, 02 Sep 2025 15:10:17 GMT"
"DMA Enhances Property Tax Consulting Services with Acquisition of Tax Advisors, PLLC",https://waow.marketminute.com/article/bizwire-2025-9-2-dma-enhances-property-tax-consulting-services-with-acquisition-of-tax-advisors-pllc,"...extension of our clients tax departments, providing compliance, tax recovery, audit defense, advisory services, planning, and technology integration.ABOUT TAX ADVISORSTax Advisors, founded in 2000, is a Vancouver, Washington-based firm...","Tue, 02 Sep 2025 13:00:00 GMT"
Nukkleus Inc Makes Strategic Move with Tiltan Software Acquisition,https://investorshangout.com/nukkleus-inc-makes-strategic-move-with-tiltan-software-acquisition-379716-/,...field of defense technology.Understanding the Value of Tiltan SoftwareInnovative Technologies for Modern DefenseTiltan ... aerospace and defense sectors. Industry exchange-traded funds (ETFs) like the iShares U.S. Aerospace & Defense ETF (NASDAQ...,"Tue, 02 Sep 2025 10:02:00 GMT"
Enters $28 Billion Defense AI Market With Proposed Acquisition Of Tiltan Software Engineering...,https://menafn.com/1110006002/Nukkleus-Inc-Enters-28-Billion-Defense-AI-Market-With-Proposed-Acquisition-Of-Tiltan-Software-Engineering-Ltd,"...Advanced Defense Systems, and has received multiple innovation and excellence awards from the Israeli Defense ... Rafael Advanced Defense Systems. The company has received multiple awards from the Israeli Defense Ministry for its...","Tue, 02 Sep 2025 09:01:36 GMT"
Yankees big trade deadline acquisition is crashing back down to Earth,https://empiresportsmedia.com/new-york-yankees/yankees-big-trade-deadline-acquisition-is-crashing-back-down-to-earth/,"...saving the Yankees runs in tight contests.Defense might not always grab headlines, but its been the clearest reason the... Thats a significant commitment for a player whose value leans heavily on defense, not consistent offensive...","Tue, 02 Sep 2025 13:06:16 GMT"
"BRKL Form 4: Director Disposes 46,266 Shares in Merger Conversion | BRKL SEC Filing - Form 4",https://www.stocktitan.net/sec-filings/BRKL/form-4-brookline-bancorp-inc-insider-trading-activity-bfa6d4258590.html,...sale of equity securities of the issuer that is intended to satisfy the affirmative defense conditions of Rule 10b5-1(c). See Instruction 10. 1. Name and Address of Reporting Person*Pereira John M. (Last) (First) (Middle) 131 CLARENDON STREET...,"Tue, 02 Sep 2025 12:57:14 GMT"
"BRKL Form 4: 36,911 Brookline Shares Converted in Merger | BRKL SEC Filing - Form 4",https://www.stocktitan.net/sec-filings/BRKL/form-4-brookline-bancorp-inc-insider-trading-activity-e0911e3b5a78.html,...sale of equity securities of the issuer that is intended to satisfy the affirmative defense conditions of Rule 10b5-1(c). See Instruction 10. 1. Name and Address of Reporting Person*Brooks Janytra M (Last) (First) (Middle) 131 CLARENDON STREET...,"Tue, 02 Sep 2025 12:47:50 GMT"
"Nukkleus to Acquire Tiltan Software for $14M, Enters $28B Defense AI Market | NUKK Stock News",https://www.stocktitan.net/news/NUKK/nukkleus-inc-enters-28-billion-defense-ai-market-with-proposed-f3c0411z1oyw.html,"...Israeli defense technology company, for $14 million. The acquisition positions Nukkleus in the rapidly growing defense AI ... high-value aerospace and defense technologies Multiple innovation awards from Israeli Defense Ministry validate...","Tue, 02 Sep 2025 12:46:00 GMT"
"BRKL Form 4: Director Disposes 523,622 Shares After Berkshire Merger | BRKL SEC Filing - Form 4",https://www.stocktitan.net/sec-filings/BRKL/form-4-brookline-bancorp-inc-insider-trading-activity-0cfba713db07.html,...sale of equity securities of the issuer that is intended to satisfy the affirmative defense conditions of Rule 10b5-1(c). See Instruction 10. 1. Name and Address of Reporting Person*NOWAK BOGDAN (Last) (First) (Middle) 131 CLARENDON STREET...,"Tue, 02 Sep 2025 12:37:48 GMT"
"Parsons back ailing, players react to Parsons acquisition",https://wtaq.com/2025/09/02/982720/,mp3Gary said that he is excited to see what the Packers defense becomes with Micah... mp3Gary was asked if the Packers now have the best defense in the...,"Tue, 02 Sep 2025 10:37:57 GMT"
Nukkleus Inc. Enters $28 Billion Defense AI Market With Proposed Acquisition of Tiltan Software Engineering Ltd.,https://www.globenewswire.com/news-release/2025/09/02/3142712/0/en/Nukkleus-Inc-Enters-28-Billion-Defense-AI-Market-With-Proposed-Acquisition-of-Tiltan-Software-Engineering-Ltd.html,"The $14 million acquisition adds cutting-edge defense AI, advanced simulation software, 3D engines, and operational systems to Nukkleus A&D portfolio The $14 million acquisition adds cutting-edge defense AI, advanced simulation software, 3D engines, and operational systems to Nukkleus A&D portfolio","Tue, 02 Sep 2025 12:46 GMT"
