title,link,summary,published
Scale AI Moves to Strengthen National Security AI Stack with ICG Acquisition #AI,https://nationalcybersecurity.com/scale-ai-moves-to-strengthen-national-security-ai-stack-with-icg-acquisition-ai/,...building end-to-end AI infrastructure for defense and intelligence customers.At a time when agencies are under increasing... That kind of capability has already found a foothold across defense and intelligence environments where speed and accuracy...,"Wed, 22 Apr 2026 03:54:07 GMT"
"Trump Wants Buyer for Spirit, Pans United-American Merger",https://uk.finance.yahoo.com/news/trump-wants-buyer-for-spirit-pans-united-american-merger-000604632.html,"...Its just like all of these aerospace defense companies and aerospace companies, we used to have hundreds of them, and...","Wed, 22 Apr 2026 02:42:01 GMT"
"...AI-Era Chips and Defense Batteries, to List on NASDAQ through Merger with Archimedes Tech SPAC...",https://americanbusinesstimes.com/article/907145415-forge-nano-u-s-advanced-manufacturing-leader-for-ai-era-chips-and-defense-batteries-to-list-on-nasdaq-through-merger-with-archimedes-tech-spac,"...prohibits U.S. defense procurement of foreign-made battery cells, further catalyzing defense market opportunities ... intelligence (AI)-era chip manufacturing and defense battery applications, and Archimedes Tech SPAC Partners II Co...","Wed, 22 Apr 2026 01:15:52 GMT"
...a prophecy & Could Paramount acquisition of CNN shift coverage of Israel? & This underground...,http://yehudalave.blogspot.com/2026/04/yom-haatzmaut-today-treasure-trove.html,"...prayersThose we have lost | The Times of IsraelCategories CiviliansIDF Israel Defense Forces soldiers and reservistsPolice officers Israel Police and Border Police officersFirst responders Local security team members, firefighters and...","Wed, 22 Apr 2026 00:15:28 GMT"
"...Perry Sook Rips Directv In Tegna Merger Battle, Says two Or Three Companies Will Soon Control All...",https://worldnl.com/nexstar-ceo-perry-sook-rips-directv-in-tegna-merger-battle-says-two-or-three-companies-will-soon-con-353208.html,We have confidence that we will prevail on the facts and on the law and well be vigorous in our defense.,"Tue, 21 Apr 2026 23:34:16 GMT"
Trump taps Raytheon executive for top military space acquisition post,https://bankb.it/trump-taps-raytheon-executive-for-top-military-space-acquisition-post-164413,"Erich Hernandez-Baquero is currently vice president for space intelligence, surveillance and reconnaissance at RaytheonThe post Trump taps Raytheon executive for top military space acquisition post appeared first on SpaceNews.","Tue, 21 Apr 2026 22:42:16 GMT"
"Hall Chadwick Acquisition II: HCAXU IPO, SPAC - Blank check company targeting...",https://www.renaissancecapital.com/Profile/HCAXU/Hall-Chadwick-Acq.-II/IPO,"Hall Chadwick Acquisition II Filed Terms, Nasdaq: HCAXUBlank check company targeting critical materials, infrastructure, and defense.","Tue, 21 Apr 2026 21:54:57 GMT"
"...IPO News - SPAC Hall Chadwick Acquisition II files for a $265 million US IPO, targeting critical...",https://www.renaissancecapital.com/IPO-Center/News/118478/SPAC-Hall-Chadwick-Acquisition-II-files-for-a-$265-million-US-IPO-targeting,"...critical materials, infrastructure, and defense, filed on Tuesday with the SEC to raise up to $265 million in an initial ... critical materials, infrastructure, and defense-aligned technology.Managements previous SPAC, Hall Chadwick Acquisition...","Tue, 21 Apr 2026 17:56:57 GMT"
Federal Acquisition Regulation: Prohibition on Certain Semiconductor Products and Services,https://www.fdd.org/analysis/2026/04/20/federal-acquisition-regulation-prohibition-on-certain-semiconductor-products-and-services/,"...involved in military modernization and industrial espionage, including the National University of Defense Technology (NUDT) ... elements of Chinas military-industrial base. CXMT publicly advertises its products as military-grade within China, and...","Mon, 20 Apr 2026 13:53:31 GMT"
Mike Katz from Law Firm Manatt Shares Perspective on Payward's Acquisition of Bitnomial,https://www.crowdfundinsider.com/2026/04/274286-mike-katz-from-law-firm-manatt-shares-perspective-on-paywards-acquisition-of-bitnomial/,"Across these transactions, buyers consistently prioritized established licenses over proprietary tech stacks.The same logic extends beyond crypto: in defense contracting, firms pay premiums for workforces holding active security clearances that...","Tue, 21 Apr 2026 20:59:52 GMT"
The Thaiger Thai Navy's Frigate Acquisition Paves Way for Shipbuilding Independence,https://thailandtv.news/the-thaiger-thai-navys-frigate-acquisition-paves-way-for-shipbuilding-independence/,"...frigate. The Navy aims to enhance Thailands defense industry competitiveness, impacting both security and economic ... which are designed to bolster the nations military capabilities.The Royal Thai Navy held a meeting with the Thai...","Tue, 21 Apr 2026 20:10:21 GMT"
Trump raises prospect of federal support or merger as Spirit Airlines struggles with costs and debt,https://www.bastillepost.com/global/article/5795727-trump-raises-prospect-of-federal-support-or-merger-as-spirit-airlines-struggles-with-costs-and-debt,"...Consumers Alliance.Kit Kennedy, managing director for power at the Natural Resources Defense Council, said the Trump administration keeps trying new ways to block the clean energy projects needed to power the grid, and the courts keep striking...","Tue, 21 Apr 2026 19:58:41 GMT"
"Trump wants buyer for Spirit, pans United-American merger | Business News",https://www.arcamax.com/business/businessnews/s-4076813,"Earlier: United CEO Pitched Trump on Possible Tie-Up With Rival AmericanIts just like all of these aerospace defense companies and aerospace companies, we used to have hundreds of them, and now we have, like, a very small number, and you...","Tue, 21 Apr 2026 19:38:59 GMT"
Peru Strengthens National Defense with $2 Billion Acquisition of F-16 Block 70 Fighter Jets,https://aviationnews.eu/news/2026/04/peru-strengthens-national-defense-with-2-billion-acquisition-of-f-16-block-70-fighter-jets/,"...and defense analysts can expect the first deliveries to trigger a comprehensive overhaul of national air defense ... commitment to maintaining a credible and modern defense posture. As pilot training commences, the FAP moves closer to...","Tue, 21 Apr 2026 18:35:06 GMT"
Avem Partners Completes Acquisition of PAMCO,http://www.businesswire.com/news/home/20260421458522/en/Avem-Partners-Completes-Acquisition-of-PAMCO/?feedref=JjAwJuNHiystnCoBq_hl-Rc4vIAVcHHkbDcwJimU8QtrtlakeQ9hNboBqTAWIjTge3KWq9s9jif-UkBjBsFRyYAbRTSLTc1mgvhPlnaBA55M-oupQnbXnhKsYk8RmHF_kAy2gZikaX3QWV6xOvgFlA==,"LOS ANGELES--(BUSINESS WIRE)--Avem Partners (Avem), a private equity firm focused on lower middle market aerospace and defense businesses, today announced the completion of its acquisition of Precision Aircraft Machining Company, Inc. (PAMCO). True West Capital Partners, alongside several prominent family offices, and other high net-worth individuals provided capital in support of this acquisition, which included significant investment from Avem principals and several aerospace industry exe","Tue, 21 Apr 2026 14:07:00 UT"
"Forge Nano, U.S. Advanced Manufacturing Leader for AI-Era Chips and Defense Batteries, to List on NASDAQ through Merger with Archimedes Tech SPAC Partners II Co.",https://www.globenewswire.com/news-release/2026/04/21/3278115/0/en/Forge-Nano-U-S-Advanced-Manufacturing-Leader-for-AI-Era-Chips-and-Defense-Batteries-to-List-on-NASDAQ-through-Merger-with-Archimedes-Tech-SPAC-Partners-II-Co.html,"DENVER and NEW YORK, April 21, 2026 (GLOBE NEWSWIRE) -- Forge Nano, Inc. (Forge Nano or the Company), a leading U.S. based semiconductor equipment and advanced materials company pioneering Atomic Layer Deposition (ALD) technology for artificial intelligence (AI)-era chip manufacturing and defense battery applications, and Archimedes Tech SPAC Partners II Co. (Archimedes II) (NASDAQ: ATII), a publicly traded special purpose acquisition company, announced today that they have entered into a definitive business combination agreement (Transaction) that would result in Forge Nano becoming a publicly listed company. Upon closing of the Transaction, the combined company will operate as Forge Nano, Inc. and its common stock and warrants are expected to trade on NASDAQ under the new ticker symbol NANO and NANOW respectively. The Company will continue to be led by Forge Nanos existing management team, which brings deep technological and manufacturing experience.","Tue, 21 Apr 2026 14:00 GMT"
