title,link,summary,published
Greenland or Bust: The Compelling Case for Acquisition,https://wwwp-lives.blogspot.com/2026/01/greenland-or-bust-compelling-case-for.html,"Menacingly, they wish to exploit the area for military advantage.With Americas destruction of Irans nuclear ... China are on high alert regarding our military superiority. Both nations would dread our newly invigorated global reach in...","Sun, 11 Jan 2026 02:00:00 GMT"
"Trump Threatens Greenland Acquisition, Minneapolis Mayor Questions ICE Agent Injury",https://ca.headtopics.com/news/trump-threatens-greenland-acquisition-minneapolis-mayor-78222216,"...Chinese occupation, hinting at potential military action. Separately, the Minneapolis mayor expresses doubt about the ... added, appearing to allude to potential military action.The U.S. needs to own Greenland to prevent Russia or China from...","Sun, 11 Jan 2026 00:28:00 GMT"
Simple tips to Check out the new Jurassic Park Videos inside Chronological Acquisition,https://chestervillerecord.com/2026/01/10/simple-tips-to-check-out-the-new-jurassic-park-videos-inside-chronological-acquisition/,"MoviesVery early regions of the fresh patch provided dinosaurs escaping to the mainland, and you may a military out of genetically changed dinosaur-human mercenaries. Inside 2002, William Monahan are hired to write the new software, to your...","Sat, 10 Jan 2026 03:38:35 GMT"
Trump Signals Potential Forceful Approach to Greenland Acquisition,https://seatickers.com/hot-news/trump-signals-potential-forceful-approach-to-greenland-acquisition/,"...actions. Trump, who has acknowledged that military options are being considered, also did not dismiss the idea of ... larger than Mexico and already hosts a US military presence. However, Trump has aimed for direct control, highlighting the...","Sat, 10 Jan 2026 00:35:50 GMT"
"...\""Fighting the Ice.\"" About the acquisition of...",https://nato.news-pravda.com/russia/2026/01/10/86789.html,"...fish processors. Copenhagen could not control the autonomous lands, let alone the defense of Greenland. Get busy.psFor the first time, the Baltic extinctions felt a slight anxiety, which broke through centuries of using potato spirits and pea...","Sat, 10 Jan 2026 19:29:21 GMT"
"Trump Administration Pursues Greenland Acquisition Plans, Faces European Opposition",https://us.headtopics.com/news/trump-administration-pursues-greenland-acquisition-plans-78216526,"...increasing its military presence and activities in the Arctic, including modernizing its military infrastructure in ... hydrocarbon deposits, and the growing military capabilities of Russia and China in the region have further fueled...","Sat, 10 Jan 2026 19:26:00 GMT"
Greenland Residents Reject Trump's Push for Acquisition,https://au.headtopics.com/news/greenland-residents-reject-trump-s-push-for-acquisition-78215041,They view his actions as disrespectful and prioritize their self-governance and peaceful existence.Military is always an option: White House escalates Greenland clash with NATO allies We are going to do something on Greenland whether they like...,"Sat, 10 Jan 2026 18:30:00 GMT"
...Urgent Rejection of Trumps Acquisition Bid: Sovereignty Stand Amid Late-Breaking Diplomatic...,https://bostontimes.org/2026/01/10/greenlands-urgent-rejection-of-trumps-acquisition-bid-sovereignty-stand-amid-late-breaking-diplomatic-tensions/,"foreign policy toward a more confrontational posture, one that sought to rally support from NATO allies to justify potential military or diplomatic action.However, this approach was met with swift and unified resistance from European leaders, who...","Sat, 10 Jan 2026 17:11:42 GMT"
What are Trump's Greenland Acquisition Plans?,https://www.newsdirectory3.com/what-are-trumps-greenland-acquisition-plans/,"...the White House has said that using military force to acquire Greenland is among the options.Denmark, a NATO ally, has also said that any such attack would end the military alliance.We need greenland from the standpoint of national security...","Sat, 10 Jan 2026 17:16:52 GMT"
Chargers' trade acquisition has most on the line in playoffs vs. Pats,https://www.macon.com/sports/article314272223.html,...following his trade from Baltimore:35 pressures7.5 sacks20 stops73.2 PFF Defense Grade77.7 PFF pass rush gradeFor the season: 10th amongst all EDGE players in Pass Rush Win Rate (17%)(: Jay Biggerstaff) pic.twitter.com/GOomQ7yUHl...,"Sat, 10 Jan 2026 12:30:01 GMT"
Magnet Defense Scores Major Win With Strategic ATG Acquisition,https://startupworld.tech/magnet-defense-scores-major-win-with-strategic-atg-acquisition/,"...standards for maritime defense innovation. Magnet Defense Acquisition Boosts AI-Enabled Defense Solutions With the agreement ... various military services and commands. Future Plans for Magnet Defense and ATG Collaboration Looking ahead, Magnet Defense...","Sat, 10 Jan 2026 12:28:58 GMT"
EU Troops Considered to Halt President Trump's Greenland Acquisition Plans,https://agwotu.blogspot.com/2026/01/eu-troops-considered-to-halt-president.html,"...officials, diplomatic channels, potential military deployment**SUPPORTING DETAILS:** The possibility of EU troops being ... shipping routes, resource extraction, and military presence. The strategic importance of Greenland, with its vast natural...","Sat, 10 Jan 2026 11:59:00 GMT"
Trump Warns Denmark: US Will Acquire Greenland 'One Way or Another',https://ng.headtopics.com/news/trump-warns-denmark-us-will-acquire-greenland-one-way-or-78203840,"...asserting that ownership is crucial for defense and preempting potential acquisition by rival powers. He explicitly stated ... Secretary Karoline Leavitt, who indicated that military action remained an option for the US to seize control. Greenland, a...","Sat, 10 Jan 2026 11:20:00 GMT"
Trump's Greenland obsession: What's driving the acquisition push?,https://www.blogarama.com/arts-and-entertainment-blogs/263354-ghana-crowsourcing-news-blog/72258846-trumps-greenland-obsession-whats-driving-acquisition-push,"...rule, with the Americans in charge of the military installation they had established; however, due to local discontent, they ... reasons for the USs decision.The U.S. military and economy depend on 50 minerals, including copper, lead, zinc, silver...","Sat, 10 Jan 2026 09:12:33 GMT"
Meta's $2B Acquisition of Singapore AI Startup Draws Beijing Scrutiny,https://www.webpronews.com/metas-2b-acquisition-of-singapore-ai-startup-draws-beijing-scrutiny/,"China rivalry in AI, with both nations viewing the technology as pivotal to future economic and military power. Chinas government has poured billions into AI research, fostering startups like Manus while imposing strict controls to prevent...","Sat, 10 Jan 2026 06:10:05 GMT"
D-wave's $550m Quantum Circuits Acquisition: A Strategic Gate-model Pivot,https://www.indexbox.io/blog/d-wave-acquires-quantum-circuits-for-550m-in-gate-model-quantum-shift/,"...make quantum computers look good,"" Hayes said. ""Helios will just expand that.""Defense contractor Honeywell fabricates the ion-trap chips for Quantinuum in Minnesota. ""Honeywell can probably claim to have made the best ion-trap chips in the world,""...","Sat, 10 Jan 2026 07:49:30 GMT"
