title,link,summary,published
Quantum Systems FERNRIDE acquisition DRONELIFE,https://gameupnews.com/quantum-systems-fernride-acquisition-dronelife/,"...container terminals, yard operations, defense logistics, and other industrial settings. Its technology is already deployed ... Armed Forces and expanded its work in defense logistics. Quantum Systems plans to integrate FERNRIDEs technology into...","Mon, 22 Dec 2025 02:08:25 GMT"
Denmark plans to acquire a new warship for high-seas monitoring,https://carroemotos.com.br/denmark-plans-to-acquire-a-new-warship-for-high-seas-monitoring/,The acquisition is financed both through the current defense agreement and with funds from Denmarks Acceleration Fund.Photo: Ministry of Defense of Denmark. This content was created with the help of AI and reviewed by the editorial...,"Mon, 22 Dec 2025 02:04:06 GMT"
HawkEye 360 expands defense footprint with acquisition of Innovative Signal Analysis,https://africaflying.com/hawkeye-360-expands-defense-footprint-with-acquisition-of-innovative-signal-analysis/,"18 it has acquired defense contractor Innovative Signal Analysis, deepening its push into military and intelligence ... geolocation data primarily to the U.S. military, intelligence agencies and allied governments. Its data are used for...","Mon, 22 Dec 2025 01:18:16 GMT"
Denmark Data Acquisition System Market by Segment and End-Use | Forecasts for 2026 and 2033,http://prsync.com/consegic-business-intelligence/denmark-data-acquisition-system-market-by-segment-and-end-use--forecasts-for--and--5039038/,"...Upto 100 KS/S)By End Use (Aerospace and Defense, Automotive and Transportation, Energy and Power, Healthcare ... R&D across aerospace, automotive, and defense sectors. The region benefits from a robust industrial base and stringent...","Sun, 21 Dec 2025 23:05:04 GMT"
Defence Acquisition Management (part I),https://archive.dailytimes.com.pk/1421953/defence-acquisition-management-part-i/,"...people and remains the prerogative of military professionals or, at best, the bureaucracy.To raise greater awareness among ... emphasising that it is vital to ensure military effectiveness, deliver value for money, support national defence and...","Sun, 21 Dec 2025 19:37:25 GMT"
Trump MediaTAE Merger: Fusions Public Market Leap,https://www.powermag.com/trump-media-tae-merger-fusions-public-market-leap/,"Fusion developers will likely prioritize commercial projects for high-demand sites like AI data centers, industrial hubs, and defense facilities over residential grids. This will require regulators to facilitate and utilities to model new siting...","Sun, 21 Dec 2025 16:46:40 GMT"
Greg Gard's prized offseason portal acquisition is now further in the doghouse,https://www.chatsports.com/wisconsin-badgers/a/source/greg-gards-prized-offseason-portal-acquisition-is-now-further-in-the-doghouse-18427955,"...Villanova support it.Gard said there are currently only six players he can trust on defense, and they were the key to getting Wisconsin back into the Villanova game and sending it to...","Sun, 21 Dec 2025 15:35:36 GMT"
"Boeing (BA) Gets Buy Rating from Citi, Completes Spirit AeroSystems Acquisition",https://www.insidermonkey.com/blog/boeing-ba-gets-buy-rating-from-citi-completes-spirit-aerosystems-acquisition-1663105/,"Citi started coverage on 24 stocks in the aerospace and defense sector. The research firm pointed out that the sector is ... megatrends across commercial aerospace, defense, space, and shipbuilding. According to Citi, these trends could lead to at...","Sun, 21 Dec 2025 14:44:15 GMT"
Detroit Left Fuming After Justyn-Henry Malloy Forced to Make Way for $19M Acquisition,https://www.essentiallysports.com/mlb-baseball-news-detroit-left-fuming-after-justyn-henry-malloy-forced-to-make-way-for-one-nine-m-acquisition/,"215 with 4 HRs this season.That said, Meadows value goes well beyond his bat. His defense is a big reason hes still in Detroit. He consistently grades as an above-average center fielder, posting strong numbers in Outs Above Average and...","Sun, 21 Dec 2025 12:30:51 GMT"
HawkEye 360 Closes Strategic Acquisition and Secures Series E Preferred and Debt,https://lifestyle.middletownlifemagazine.com/story/182369/hawkeye-360-closes-strategic-acquisition-and-secures-series-e-preferred-and-debt/,"...signals intelligence capabilities that defense, government, and international partners rely on to support critical... About HawkEye 360HawkEye 360 is equipping defense, intelligence, and national security leaders with mission-critical...","Sun, 21 Dec 2025 11:18:22 GMT"
...48.8% After Earnings Surge And Acquisition-Focused Rebrand And What's...,https://sg.finance.yahoo.com/news/why-innovative-aerosystems-issc-48-070710708.html,...acquisitions of cash-generative aerospace and defense component businesses with proprietary content and strong aftermarket ... managing the complexity of acquisitions and military-heavy exposure. The latest results confirm a sharp profitability...,"Sun, 21 Dec 2025 07:07:10 GMT"
PossibleNOW Strengthens Compliance Capabilities with Acquisition of FDCPA Case Listing Service,https://lifestyle.middletownlifemagazine.com/story/182215/possiblenow-strengthens-compliance-capabilities-with-acquisition-of-fdcpa-case-listing-service/,"His leadership will further enhance the delivery of litigation intelligence services, supporting broader litigation defense and risk mitigation efforts for our clients, said Rob Tate, COO, PossibleNOW.Litigation tied to TCPA, FDCPA, and related...","Sun, 21 Dec 2025 09:31:07 GMT"
AI Defense Stock VisionWave Holdings (Nasdaq: VWAV) Reports Completion of its Acquisition of...,https://lifestyle.middletownlifemagazine.com/story/182158/ai-defense-stock-visionwave-holdings-nasdaq-vwav-reports-completion-of-its-acquisition-of-solar-drone-ltd/,"incVisionWave is a Featured Defense stock on Investorideaas.omResearch more defense stocks at Investorideas stock ... Holdings, Inc. is a paid for featured defense company on Investorideas.com. Investorideas is a digital publisher of third...","Sun, 21 Dec 2025 08:46:47 GMT"
