title,link,summary,published
Micah Parsons Acquisition: Packers' Game-changer Like Reggie White,https://bvmsports.com/2025/08/28/micah-parsons-acquisition-packers-game-changer-like-reggie-white/,"...potentially transforming the Packers defense much like Reggie White did in the 90s. With Parsons joining a talented... Green Bay made adjustments to enhance their defense after a playoff loss, including firing their defensive line coach. The...","Thu, 28 Aug 2025 00:54:01 GMT"
"Micah Parsons, Packers' greatest acquisition since",https://www.onenewspage.com/n/Sports/1zs6yjisqh/Micah-Parsons-Packers-greatest-acquisition-since-Reggie-White.htm,"Micah Parsons, Packers' greatest acquisition since Reggie White, should similarly transform Green Bay defense29 Aug 2025","Fri, 29 Aug 2025 00:47:12 GMT"
Ramon Laureano may be best trade deadline acquisition of AJ Preller era,https://www.gaslampball.com/san-diego-padres-analysis-commentary/49466/ramon-laureano-may-be-best-trade-deadline-acquisition-of-aj-preller-era,"...25 games for Padres and has quickly become a fan favorite thanks to his play on defense and his production at the plate. He has 29 hits with four doubles, two triples and five home runs, which includes a first-inning grand slam against the Seattle...","Fri, 29 Aug 2025 00:19:59 GMT"
"...greatest acquisition since Reggie White, should similarly transform Green Bay defense",https://www.thepress.net/sports/national/micah-parsons-packers-greatest-acquisition-since-reggie-white-should-similarly-transform-green-bay-defense/article_5ae8a6b6-ccf1-592b-a2f3-6b74a489d952.html,Parsons' youth and All-Pro talent made it tough for the Cowboys to part with the superstar,"Thu, 28 Aug 2025 23:48:16 GMT"
"Kay Adams revels in Packers acquisition of Micah Parsons, teasing Cowboys fans with her...",https://motorcyclesports.net/nfl/kay-adams-revels-in-packers-acquisition-of-micah-parsons-teasing-cowboys-fans-with-her-self-proclaimed-fan-gm-status/,"Micah Parsons, a standout defensive talent, has been a cornerstone of the teams defense since he was drafted. His move to the Packers marks a significant shift in the landscape of the NFC, with implications that will be felt during the upcoming...","Thu, 28 Aug 2025 23:20:52 GMT"
Union Berlin to Acquire Sporting Lisbon's Jeremiah St. Juste,https://www.archynewsy.com/union-berlin-to-acquire-sporting-lisbons-jeremiah-st-juste/,"Juste from Sporting CP, bolstering their defense ahead of the latter stages of the Bundesliga season. Negotiations are at ... the Bundesliga,and strengthening their defense has been a priority. the acquisition of St. Juste would provide a much-needed...","Thu, 28 Aug 2025 22:02:47 GMT"
Trump Fires Top Transportation Official Overseeing Key Merger,http://monitoruldestiri.ro/stiinta_si_tehnologie/trump-fires-top-transportation-official-overseeing-key-merger-4594051,"...Federal Reserve Board of Governors member Lisa Cook , CDC Director Susan Monarez , and Defense Intelligence Agency Director Jeffrey Kruse . Primus plans to protest his firing. This is deeply...","Thu, 28 Aug 2025 21:32:53 GMT"
"Pinnacle, Synovus seek to sell pending merger to investors",https://www.americanbanker.com/news/pinnacle-synovus-seek-to-sell-pending-merger-to-investors,"""I think they're trying to show positive aspects of this, whereas right after the deal they were on the defense, trying to deal with the narrative,"" Shaw...","Thu, 28 Aug 2025 19:58:13 GMT"
"WBA Form 4: CFO Disposed of 414,273 Shares in Merger for $11.45/Share | WBA SEC Filing - Form 4",https://www.stocktitan.net/sec-filings/WBA/form-4-walgreens-boots-alliance-inc-insider-trading-activity-4227b9d5d28d.html,...sale of equity securities of the issuer that is intended to satisfy the affirmative defense conditions of Rule 10b5-1(c). See Instruction 10. 1. Name and Address of Reporting Person*Mahajan Manmohan (Last) (First) (Middle) C/O WALGREENS BOOTS...,"Thu, 28 Aug 2025 19:26:55 GMT"
WBA Insider: Timothy Wentworth Disposes 1.33M Shares in Merger | WBA SEC Filing - Form 4,https://www.stocktitan.net/sec-filings/WBA/form-4-walgreens-boots-alliance-inc-insider-trading-activity-27cf4f68cc35.html,...sale of equity securities of the issuer that is intended to satisfy the affirmative defense conditions of Rule 10b5-1(c). See Instruction 10. 1. Name and Address of Reporting Person*WENTWORTH TIMOTHY C (Last) (First) (Middle) C/O WALGREENS...,"Thu, 28 Aug 2025 19:22:06 GMT"
WBA Form 4: Insider Disposes Shares as Merger Pays $11.45 Per Share | WBA SEC Filing - Form 4,https://www.stocktitan.net/sec-filings/WBA/form-4-walgreens-boots-alliance-inc-insider-trading-activity-969d3be10b95.html,...sale of equity securities of the issuer that is intended to satisfy the affirmative defense conditions of Rule 10b5-1(c). See Instruction 10. 1. Name and Address of Reporting Person*Barra Ornella (Last) (First) (Middle) 24 BOULEVARD DU TENAO...,"Thu, 28 Aug 2025 18:42:50 GMT"
WBA Form 4: Pessina Converts 145.6M Shares at $11.45 in Merger | WBA SEC Filing - Form 4,https://www.stocktitan.net/sec-filings/WBA/form-4-walgreens-boots-alliance-inc-insider-trading-activity-81df5ad0bc35.html,...sale of equity securities of the issuer that is intended to satisfy the affirmative defense conditions of Rule 10b5-1(c). See Instruction 10. 1. Name and Address of Reporting Person*Pessina Stefano (Last) (First) (Middle) 24 BOULEVARD DU TENAO...,"Thu, 28 Aug 2025 18:42:06 GMT"
Stefanini Group Initiates the Merger Process of Stefanini Romania with Cyber Smart Defence in...,https://stefanini.com/en/insights/news/stefanini-group-initiates-the-merger-process-of-stefanini-romania-with-cyber-smart-defence-in-romania,"...strategy to bolster its cybersecurity business unit for clients worldwide.The Smart Defense acquisition was a game-changer for our clients in Romania and across Europe and this merger is a strategic step forward, said Farlei Kothe, CEO of...","Thu, 28 Aug 2025 18:11:19 GMT"
A forward-looking defence acquisition policy can unlock foreign tech transfer and investments,https://economictimes.indiatimes.com/opinion/et-commentary/a-forward-looking-defence-acquisition-policy-can-unlock-foreign-tech-transfer-and-investments/articleshow/123569714.cms,"...reshape India's military-industrial landscape for the next five years or more.India's military-industrial ecosystem has ... which set out processes for purchasing military equipment from foreign OEMs, or locally from Indian firms.In 2003, its...","Thu, 28 Aug 2025 17:50:05 GMT"
Rheinmetall (XTRA:RHM) Explores Acquisition Of German Shipbuilder NVL From Luerssen Family,https://sg.finance.yahoo.com/news/rheinmetall-xtra-rhm-explores-acquisition-173950960.html,"...broader trends of portfolio expansion in the defense sector, Rheinmetall's stock movement last week is consistent with the ... capabilities, aligning well with the increasing defense budgets across Europe. This strategic move could bolster the...","Thu, 28 Aug 2025 17:39:50 GMT"
Ideagen expands safety solutions with Reactec acquisition,https://ukbaa.org.uk/blog/2025/08/28/ideagen-expands-safety-solutions-with-reactec-acquisition/,"...construction, 250 global aviation organisations, nine of the top global aerospace and defense corporations, 15 of the top 20 global pharmaceutical companies, over 900 hospitals and healthcare centres and nine of the top ten accounting firms.This...","Thu, 28 Aug 2025 15:51:58 GMT"
Exosens Continues Growth with Phasics Acquisition,https://www.photonics.com/Articles/Exosens_Continues_Growth_with_Phasics_Acquisition/p5/a71395,"...technology company Phasics. The deal expands Exosens' portfolio of offerings targeting defense, industrial control, and the life sciences. Financial terms of the purchase were not disclosed.Jerome Cerisier, CEO of Exosens, said that the deal...","Thu, 28 Aug 2025 15:25:33 GMT"
VA Continues Rollout of New Acquisition Management System Powered by CGIs Momentum,https://www.executivebiz.com/articles/cgi-federal-va-ifams-deployment-momentum,"The event will feature keynote remarks and panel discussions with top officials from the Defense Health Agency, Department of Veterans Affairs, HHS, CDC and more, highlighting innovation in warfighter health, veteran care and federal healthcare...","Thu, 28 Aug 2025 15:20:25 GMT"
Titans Add Samuel Womack Iii: Cornerback Acquisition After Colts Release,https://www.memesita.com/titans-add-samuel-womack-iii-cornerback-acquisition-after-colts-release/,"But beyond the headlines and the looming investigation, this acquisition has serious implications for the Titans defense, the AFC Souths competitive landscape, and frankly, whether the Colts made a colossal mistake.The original article laid out...","Thu, 28 Aug 2025 13:42:44 GMT"
tendernews acquisition of geolocation and communication equipment and...,https://global.tendernews.com/tender-info.aspx?r=1395516250828&s=0,Acquisition of geolocation and communication equipment and accessories aims to meet the operational needs of Military Organizations subordinate to the Northern Military Command (CMN)28 Aug 202505 Sep 2025,"Thu, 28 Aug 2025 12:44:37 GMT"
