title,link,summary,published
Clorder Platform All British casino Acquisition Food On line Dining Delivery Bistro Takeout,https://www.lifecellskin.us/blog/clorder-platform-all-british-casino-acquisition-food-on-line-dining-delivery-bistro-takeout/,"...area, Kyiv announces an agenda to set up a military management within the Kursk Oblast added by the Major general Eduard... To raised do the fresh held territory, Kyiv declares an idea to set up a military government inside the Kursk Oblast...","Sun, 10 Aug 2025 01:31:09 GMT"
"Rocket Lab Enters Defense Sector with $275M Geost Acquisition, Eyes Major U.S. Military Contracts",https://limitedliabilitysolutions.wordpress.com/2025/08/09/rocket-lab-enters-defense-sector-with-275m-geost-acquisition-eyes-major-u-s-military-contracts/,"Rocket Lab Eyes Big Defense Opportunities with New Acquisition Rocket Lab, a leading force in commercial ... taking a transformative leap into the defense...","Sat, 09 Aug 2025 19:58:49 GMT"
Europe Digital Talent Acquisition Market by Segment and End-Use: Forecasts for 2025 and 2032,http://prsync.com/market-research-update/europe-digital-talent-acquisition-market-by-segment-and-end-use-forecasts-for--and--4875362/,...BankingRetailIT & TelecomGovernment & DefenseManufacturingOtherCloud Computing & Security: Significant growth ... in digital manufacturing.Government & Defense: Increased investment in modernizing talent acquisition processes to attract...,"Sat, 09 Aug 2025 18:39:21 GMT"
PartnerOne Boosts Core Offerings with Strategic Acquisition of Monster Government Solutions,https://www.thecodew.com/2025/08/partnerone-boosts-core-offerings-with.html,"...10 largest in the United States, the 5 largest European banks, and the 5 largest defense technology companies.This latest transaction is part of a series of strategic acquisitions by PartnerOne, which has also recently acquired cybersecurity...","Sat, 09 Aug 2025 14:50:00 GMT"
"...Global Reach with 3.8 Billion Acquisition of Italy's Iveco, Forming Majestic Commercial Vehicle...",https://www.archyde.com/tata-motors-to-strengthen-global-reach-with-e3-8-billion-acquisition-of-italys-iveco-forming-majestic-commercial-vehicle-powerhouse/,"Crucially, the deal includes the planned divestment of Ivecos defense division to Leonardo S.p.A. for 1.7 billion... Their existing commercial vehicle range includes trucks, buses, and defense vehicles. key strengths include cost-effective...","Sat, 09 Aug 2025 09:51:21 GMT"
Watchdog Group Asks for Probe of Defense Dept.s Acquisition of Qatari Plane on Trumps Behalf,https://dyspepsiageneration.com/?p=388491,"...News, the group asked the Department of Defenses inspector general and the Government Accountability Office to probe... Its memo said the agencies should investigate whether the Defense Department had improperly invoked its authorities to...","Sat, 09 Aug 2025 09:25:53 GMT"
Voyager expands AI radar capabilities with EMSI acquisition,https://www.spacedaily.com/reports/Voyager_expands_AI_radar_capabilities_with_EMSI_acquisition_999.html,"...AI-native, mission-resilient systems for U.S. defense and intelligence. By enhancing human decision-making, the company aims to provide real-time, multi-domain monitoring for defense and commercial markets across ground, air, and space.""With their...","Fri, 08 Aug 2025 08:28:40 GMT"
"...strategic intent behind the acquisition of youth talent by Arsenal, highlighting the broader...",https://www.archyde.com/arsenal-secures-future-commitment-from-nwaneri-as-part-of-youth-recruitment-strategythis-title-reflects-the-strategic-intent-behind-the-acquisition-of-youth-talent-by-arsenal-highlighting-the-broad/,"His performances also earned him a place in Englands Under-21s squad, where he contributed to their successful UEFA U21s Euro title defense this summer, featuring in six matches throughout the tournament.Signing this contract means everything...","Sat, 09 Aug 2025 06:28:17 GMT"
