title,link,summary,published
Iveco Defence Acquisition: Media Coverage of Leonardo Deal,https://www.archynewsy.com/iveco-defence-acquisition-media-coverage-of-leonardo-deal/,Strengthening Integrated Defense Capabilities: Leonardo and Iveco Defence UniteTeh defence landscape is ... integrated defence systems globally.Iveco Defense Acquisition: Unpacking the Leonardo Deal and Media SpotlightIveco...,"Fri, 01 Aug 2025 04:41:10 GMT"
India Halts F35 Acquisition as Trade Strains Rise,https://ipanewspack.com/india-halts-f%e2%80%9135-acquisition-as-trade-strains-rise/,"...engagement with Washington earlier in the year. From Indias standpoint, any future military collaboration is expected to offer real substance in terms of shared manufacturing and technology developmentnot mere status signalling.Against a...","Fri, 01 Aug 2025 04:07:25 GMT"
Under armour men's acquisition tactical boots deals,https://biznewspost.com/?b=537396114,"5 deals, Under Armour Men s Acquisition Military and Tactical Boot Coyote deals, Under Armour Acquisition 1299241 deals, New... 5 deals, Under Armour Men s Acquisition Military and Tactical Boot 001 deals, Under Armour Acquisition Mens Size 12 Triple...","Thu, 31 Jul 2025 23:53:09 GMT"
Cowboys' Doubted Trade Acquisition Is Lighting it Up at Camp,https://sportdfw.com/cowboys-doubted-trade-acquisition-is-lighting-it-up-at-camp-01k1h3ybm2sp,"...dividends as the newcomer to the Cowboys' defense has been fantastic thus far in camp.Given what Dallas had to give up to ... the fold with the rest of the Cowboys defense until September, with the former Alabama Crimson Tide standout saying as much...","Thu, 31 Jul 2025 22:06:07 GMT"
...Combination Agreement With Plum Acquisition Corp...,https://www.sandiegonews.net/news/278480989/tactical-resources-announces-execution-of-amendment-to-business-combination-agreement-with-plum-acquisition-corp-iii,"made rare earth elements (REEs) used in semiconductors, electric vehicles, advanced robotics, and most importantly, national defense. The Company is also actively involved in the development of innovative metallurgical processing techniques to...","Thu, 31 Jul 2025 21:53:31 GMT"
MicroStrategy Bitcoin: Unveiling the Astounding $10 Billion Q2 Profit and Bold Acquisition Plan,https://coinstats.app/news/4dd0814426df7d4936513d0e11db09a7a0de40955e9f4731747bf3359f9ea9e2_MicroStrategy-Bitcoin-Unveiling-the-Astounding-10-Billion-Q2-Profit-and-Bold-Acquisition-Plan/,...interested in Bitcoin exposure through a traditional stock. Inflation Hedging: A strong defense against the erosion of purchasing power for corporate treasury assets. Potential Challenges:Bitcoin Price Volatility: While beneficial during bull...,"Thu, 31 Jul 2025 21:30:55 GMT"
"Mirion Acquires Certrec, a Leader in Regulatory Compliance and Advanced Digital Applications for the Nuclear Industry",http://www.businesswire.com/news/home/20250731171377/en/Mirion-Acquires-Certrec-a-Leader-in-Regulatory-Compliance-and-Advanced-Digital-Applications-for-the-Nuclear-Industry/?feedref=JjAwJuNHiystnCoBq_hl-Rc4vIAVcHHkbDcwJimU8QtrtlakeQ9hNboBqTAWIjTge3KWq9s9jif-UkBjBsFRyYAbRTSLTc1mgvhPlnaBA55M-oupQnbXnhKsYk8RmHF_kAy2gZikaX3QWV6xOvgFlA==,"ATLANTA--(BUSINESS WIRE)--Mirion (NYSE: MIR), a global provider of radiation detection, measurement, analysis, and monitoring solutions to the nuclear, medical, defense, and research end markets, today announced the acquisition of Certrec, a leading supplier of regulatory compliance and digital integration solutions for the energy industry. Operating out of Fort Worth, TX, Certrec solutions help ensure a stable and reliable bulk electric supply. Since 1988, Certrecs innovation and industry exp","Thu, 31 Jul 2025 20:15:00 UT"
"EOTECH Acquires VK Integrated Systems, Expands into Tactical Networking and Battlefield Sensor Integration",https://www.globenewswire.com/news-release/2025/07/31/3125131/0/en/EOTECH-Acquires-VK-Integrated-Systems-Expands-into-Tactical-Networking-and-Battlefield-Sensor-Integration.html,"In a strategic move to expand its role in the defense technology ecosystem, EOTECH announced today the acquisition of VK Integrated Systems (VKIS).","Thu, 31 Jul 2025 14:00 GMT"
