title,link,summary,published
"CACI Q1 Deep Dive: ARKA Acquisition, Mission-Critical Tech, and Margin Dynamics Shape Outlook",https://markets.financialcontent.com/stocks/article/stockstory-2026-4-23-caci-q1-deep-dive-arka-acquisition-mission-critical-tech-and-margin-dynamics-shape-outlook,"Defense, intelligence, and IT solutions provider CACI International ( NYSE: CACI) met ... reflected steady execution in its core defense and intelligence markets, with organic revenue growth and strong program...","Thu, 23 Apr 2026 14:50:58 GMT"
"...Ecopetrol enters into an Agreement to acquire an equity stake in Brava Energia, a company domiciled...",https://www.energy-pedia.com/news/brazil/ecopetrol-enters-into-an-agreement-to-acquire-an-equity-stake-in-brava-energia-s-a--a-company-domiciled-in-brazil-203681,"...Brazils Administrative Council for Economic Defense (CADE), the grant of certain waivers and consents considering Bravas...","Thu, 23 Apr 2026 23:27:30 GMT"
eHack Academy Courses: From Skill Acquisition to Cybersecurity Career Execution,https://sharecontact64173.free-blogz.com/88527505/ehack-academy-courses-from-skill-acquisition-to-cybersecurity-career-execution,...Programs India develop a comprehensive understanding of both attack mechanisms and defense strategies.Digital Forensics and Incident InvestigationDigital forensics is another key specialization within eHack Academys course offerings. These...,"Thu, 23 Apr 2026 22:51:57 GMT"
Images The Need for Speed Senior DOW Acquisition Leaders to Keynote NPS Symposium [Image 1 of 2],https://www.dvidshub.net/image/9636808/need-speed-senior-dow-acquisition-leaders-keynote-nps-symposium,"...record-setting symposium emphasized the need for a more agile, innovative, and responsive defense acquisition process to meet the fast-paced demands of modern warfare. (U.S. Navy photo by Mass Communication Specialist 2nd Class Janiel...","Thu, 23 Apr 2026 22:14:31 GMT"
News The Need for Speed Senior DOW Acquisition Leaders to Keynote NPS Symposium,https://www.dvidshub.net/news/563460/need-speed-senior-dow-acquisition-leaders-keynote-nps-symposium,...for national defense.As leaders responsible for driving acquisition reform and overseeing defense research and development ... emerging technologies and strengthening the defense industrial base. Sessions will span key areas including logistics...,"Thu, 23 Apr 2026 22:07:15 GMT"
HLX Q1 Deep Dive: Merger with Hornbeck Sets Stage for Offshore Expansion and Synergies,https://santamariatimes.marketminute.com/article/stockstory-2026-4-23-hlx-q1-deep-dive-merger-with-hornbeck-sets-stage-for-offshore-expansion-and-synergies,"...its scale to capture growth in energy, defense, and renewables markets.Management pointed to several operational and ... expected to drive growth in deepwater energy, defense, and renewables, with notable opportunities in the Americas, North...","Thu, 23 Apr 2026 15:30:54 GMT"
ServiceNow: $7.75 Billion Armis Acquisition Completed To Expand AI-Driven Cybersecurity Platform...,https://nationalcybersecurity.com/servicenow-7-75-billion-armis-acquisition-completed-to-expand-ai-driven-cybersecurity-platform-hacking-cybersecurity-infosec-comptia-pentest-ransomware/,"ServiceNow is also launching a new AI Center for Cyber Defense, a global hub focused on advancing autonomous ... security models to proactive, AI-driven defense systems.The acquisition is expected to more than triple ServiceNows total...","Thu, 23 Apr 2026 20:28:07 GMT"
Ecopetrol enters into an Agreement to acquire an equity stake in Brava Energia S.A. a company...,https://smb.southwestdailynews.com/article/Ecopetrol-enters-into-an-Agreement-to-acquire-an-equity-stake-in-Brava-Energia-SA-a-company-domiciled-in-Brazil?storyId=69ea6f6125e04a842cd69435,"...including, among others, approval by Brazil's Administrative Council for Economic Defense (CADE), the grant of certain waivers and consents considering Brava's financing instruments and relevant commercial agreements, as well as the purchase by...","Thu, 23 Apr 2026 19:37:04 GMT"
Ecopetrol Secures Acquisition of Stake in Brava Energia S.A. to Expand Brazilian Operations,https://third-news.com/article/1e224554-3f49-11f1-8966-9ca3ba0a67df,"Following the finalization of regulatory processes, which include gaining approval from Brazils Administrative Council for Economic Defense (CADE), the Colombian company aims to enhance its overall asset base while driving production...","Thu, 23 Apr 2026 19:17:49 GMT"
"Luis Severino Trade Value, Fantasy Impact, and Potential Astros Acquisition Breakdown",https://www.sacbee.com/sports/article315511184.html,"2 innings across five starts. A move to Houston would likely stabilize his value-better defense, coaching, and run support could bring his ERA down into the mid-4s range.For fantasy, he shifts from a risky streamer to a matchup-based starter with...","Thu, 23 Apr 2026 18:40:00 GMT"
DigitalBridge Stockholders Approve Acquisition by SoftBank Group Corp.,https://www.01net.it/digitalbridge-stockholders-approve-acquisition-by-softbank-group-corp/,"SoftBank) and/or others relating to the Mergers may result in significant costs of defense, indemnification and liability; (ix) certain restrictions during the pendency of the Mergers that may impact the Companys ability to pursue certain...","Thu, 23 Apr 2026 18:30:00 GMT"
United Building Solutions Expands National HVAC Platform With McCarls Services Acquisition,https://www.citybiz.co/article/836499/united-building-solutions-expands-national-hvac-platform-with-mccarls-services-acquisition/,"2 billion in assets under management as of December 31, 2025. The firm focuses on investments in aerospace, defense, industrial services and national security-related sectors and has completed more than 155 investments since...","Thu, 23 Apr 2026 16:39:21 GMT"
"...Accelerates AI-Powered Defense Strategy with xClibre Acquisition, Foresight Investment, and Initial...",https://investor-ideas.blogspot.com/2026/04/visionwave-nasdaq-vwav-accelerates-ai.html,"...today.AI Defense stock VisionWave Holdings, Inc. (Nasdaq: VWAV), a rapidly evolving AI-driven defense and multi-domain ... detection-to-decision capabilities across defense and public safety...","Thu, 23 Apr 2026 16:15:00 GMT"
Genenta to buy majority stake in aerospace parts maker for 6M,https://seekingalpha.com/news/4578548-genenta-to-buy-majority-stake-in-aerospace-parts-maker-for-6m?source=generic_rss,,"Thu, 23 Apr 2026 08:00:23 -0400"
