title,link,summary,published
Behind a $63B Pharma Merger: How Kalyan Kilaru Transformed the Strategy,https://internewscast.com/local-news/behind-a-63b-pharma-merger-how-kalyan-kilaru-transformed-the-strategy/,"...Government Pricing (GP). With pricing submissions to CMS, the VA, and the Department of Defense on the line, failure wasnt an option. But no vendor on the market could support the hybrid submission model AbbVie needed.Kalyan responded by...","Thu, 10 Jul 2025 00:51:32 GMT"
ILA enters defence against bioweapons and virus terrorism with new acquisition.,https://nextinvestors.com/articles/ila-enters-defence-against-bioweapons-and-virus-terrorism-with-new-acquisition/,"...bulking up their military and defence capabilities - drones, shipbuilding and critical military metals are all well ... vaccines - like we are seeing with critical military metals.ILAs new acquisition puts the company into our global...","Thu, 10 Jul 2025 00:26:27 GMT"
Puneet Gupta Steps Down as CEO After Clensta's Acquisition,https://the24news.in/2025/07/10/puneet-gupta-steps-down-as-ceo-after-clenstas-acquisition/,"...that saw Gupta move from aerospace and defense innovation to building one of Indias most recognized tech-backed personal ... out for its honesty. Reflecting on his military-honed mindset, he admitted:I used to believe jab nadi aayegi tab pul...","Thu, 10 Jul 2025 00:21:21 GMT"
"...Seats Market Share, Growth, Size, Merger, Demand, Sales, Trends, Competitive Landscape And Regional...",http://prsync.com/consegic-business-intelligence/germany-crashworthy-aircraft-seats-market-share-growth-size-merger-demand-sales-trends-competitive-landscape-and-regional-outloo-4792681/,"...[Commercial Airplanes, Business Jets, Military Aircraft, Helicopters, Regional Jets]By Material [Composite Materials ... Channel [OEM, Aftermarket]By EndUser [Military & Defence, Commercial]The Germany Crashworthy Aircraft Seats Report...","Wed, 09 Jul 2025 23:55:54 GMT"
"...Payload Market Share, Growth, Size, Merger, Demand, Sales, Trends, Competitive Landscape And...",http://prsync.com/consegic-business-intelligence/germany-submarine-payload-market-share-growth-size-merger-demand-sales-trends-competitive-landscape-and-regional-outlook----4792663/,"...Submarine Type [Nuclear Powered Attack, AIP, Diesel Electric, Ballistic Missile][Military, Civilian]The Germany Submarine Payload Report offers a comprehensive breakdown of market segmentation by types, highlighting the distinct categories that...","Wed, 09 Jul 2025 23:48:48 GMT"
"...C5ISR Market Share, Growth, Size, Merger, Demand, Sales, Trends, Competitive Landscape And Regional...",http://prsync.com/consegic-business-intelligence/germany-cisr-market-share-growth-size-merger-demand-sales-trends-competitive-landscape-and-regional-outlook----4792672/,"...Communication, Surveillance and Reconnaissance, Electronic Warfare, Intelligence][Military & Defence, Aerospace, Government, Others]The Germany C5ISR Report offers a comprehensive breakdown of market segmentation by types, highlighting the...","Wed, 09 Jul 2025 23:33:05 GMT"
'Enough Is Enough': Trump Admin Takes Action Against China's Aggressive Acquisition of US Farmland,https://cybernistas.com/news/enough-is-enough-trump-admin-takes-action-against-chinas-aggressive-acquisition-of-us-farmland/,...purchases of farmland have been near domestic military bases.Too much American farmland is owned by Chinese nationals ... of land near strategic bases and U.S. military installations poses a serious threat to our national security. The Farm...,"Wed, 09 Jul 2025 23:06:52 GMT"
"...Processor Market Share, Growth, Size, Merger, Demand, Sales, Trends, Competitive Landscape And...",http://prsync.com/consegic-business-intelligence/germany-digital-signal-processor-market-share-growth-size-merger-demand-sales-trends-competitive-landscape-and-regional-outlook--4792756/,"...End User [Consumer Electronics, Automotive, Industrial, Healthcare, Aerospace and Defense, Others]The Germany Digital Signal Processor Report offers a comprehensive breakdown of market segmentation by types, highlighting the distinct categories...","Wed, 09 Jul 2025 21:14:57 GMT"
Mammoths most realistic trade acquisition in 2025 NHL offseason,https://www.yardbarker.com/nhl/articles/mammoths_most_realistic_trade_acquisition_in_2025_nhl_offseason/s1_17117_42434665,"They would then send Matias Maccelli to the Toronto Maple Leafs, who had requested a trade from Utah. They would then improve their defense, adding Nate Schmidt to the blue line and a solid two-way forward with Brandon Tanev. Utah would also add...","Wed, 09 Jul 2025 21:08:40 GMT"
Stars most realistic trade acquisition in 2025 NHL offseason,https://www.yardbarker.com/nhl/articles/stars_most_realistic_trade_acquisition_in_2025_nhl_offseason/s1_17117_42434664,"Further, he plays on the right side of the defense, while the top two defenders for the Sabres both play on the left side... Not only does it solve their salary cap issue, it improves the defense, keeps the offense from the forwards similar with...","Wed, 09 Jul 2025 21:08:38 GMT"
Syria and Kurds Struggle Over Military Merger Plan,https://tezzbuzz.com/syria-and-kurds-struggle-over-military-merger-plan/,"Syria and Kurds Struggle Over Military Merger Plan \ TezzBuzz \ Washington DC \ Mary Sidiqi \ Evening Edition \ The ... centers on SDFs structure within new military Detention centers, oil fields, and airports key assets in talks Trump lifted...","Wed, 09 Jul 2025 21:25:28 GMT"
ANP warns against merger rollback,https://ipp-news.com/?p=13117,"...merged districts. Speaking to the media, he questioned the rationale behind any new military operation in the region when the people of the merged areas, through platforms like Aman Paswoon, are collectively opposing such moves. If the people are...","Wed, 09 Jul 2025 21:04:01 GMT"
Materion Completes Acquisition to Expand Semiconductor Footprint and Capabilities in Asia,https://www.semiconductor-digest.com/materion-completes-acquisition-to-expand-semiconductor-footprint-and-capabilities-in-asia/,"Materion Corporation is a global leader in advanced materials solutions for high-performance industries including semiconductor, industrial, aerospace & defense, energy and automotive. With nearly 100 years of expertise in specialty engineered...","Wed, 09 Jul 2025 21:02:13 GMT"
"LDR Partners LP Announces Acquisition of Active Radiator, and Combination with Cincinnati...","https://www.streetinsider.com/PRNewswire/LDR+Partners+LP+Announces+Acquisition+of+Active+Radiator,+and+Combination+with+Cincinnati+Radiator+and+Ohio+Heat+Transfer,+Forming+the+Largest+U.S.+Heavy+Manufacturing+Platform+for+Aluminum+Industrial/25034146.html","...shared our core values of people and customers first. With high integrity and its military veteran roots, LDR was the clear choice, and we're proud to keep building this legacy together.""Richard Sexton , Partner at LDR, added, ""We've long been...","Wed, 09 Jul 2025 20:42:31 GMT"
"KCHVU SEC Filings - Kochav Defense Acquisition Corp. 10-K, 10-Q, 8-K Forms",https://www.stocktitan.net/sec-filings/KCHVU/,"Welcome to our dedicated page for Kochav Defense Acquisition SEC filings (Ticker: KCHVU), a comprehensive resource for ... potential impact of each filing on Kochav Defense Acquisition's stock performance. Each filing includes a concise...","Wed, 09 Jul 2025 20:15:38 GMT"
Milwaukee Brewers Trade: Rodriguez Designated for Berroa Acquisition,https://www.memesita.com/milwaukee-brewers-trade-rodriguez-designated-for-berroa-acquisition/,"...desperate attempt to inject some speed and defense into a lineup thats looking a little sluggish as they chase a playoff... Adding a speedy outfielder who can also play defense is a strategic move, especially given the rising value of stolen bases...","Wed, 09 Jul 2025 20:08:47 GMT"
Milwaukee Bucks bolster playoff arsenal with savvy Gary Harris acquisition in roster overhaul,https://motorcyclesports.net/milwaukee-bucks-bolster-playoff-arsenal-with-savvy-gary-harris-acquisition-in-roster-overhaul/,Harris isnt a mere name tag on the roster. Picture him as a maestro thriving under pressure. His intense defense and ability to stretch the floorparticularly when executing a Spain pick-and-roll or capitalizing on mismatches against drop...,"Wed, 09 Jul 2025 19:01:53 GMT"
Griffon Corporation Announces the Acquisition of Quatro by AMES,https://www.businesswire.com/news/home/20210105005300/en/Griffon-Corporation-Announces-the-Acquisition-of-Quatro-by-AMES,"...are sold under the CornellCookson brand. Defense Electronics conducts its operations through Telephonics Corporation ... surveillance and communications solutions for defense, aerospace and commercial customers. For more information on Griffon...","Wed, 09 Jul 2025 18:16:51 GMT"
Understanding Financial Statements Before Business Acquisition,https://www.latesttechupdates.com/understanding-financial-statements-before-business-acquisition.html,What youll uncover:Why Financial Statement Analysis Is Your Best Defense The 3 Critical Financial Documents You Must ... Financial Statement Analysis Is Your Best DefenseThink of financial statements like a business health checkup.They tell...,"Wed, 09 Jul 2025 15:28:44 GMT"
Philippine Defense Secretary Weighs Acquisition of Japanese Warships,https://philippinesnewsdigest.com/philippine-defense-secretary-weighs-acquisition-of-japanese-warships/,"...current fleet, Department of National Defense (DND) Secretary Gilberto Teodoro Jr. stated.According to Philippines News ... Admiral Jose Ma. Ambrosio Ezpeleta. The Defense Secretary mentioned that an invitation to inspect the ships has been...","Tue, 08 Jul 2025 22:08:03 GMT"
Defense Department Seeks Public Input On Trumps Acquisition Reform Order,https://www.defensedaily.com/defense-department-seeks-public-input-on-trumps-acquisition-reform-order/pentagon/,"The Defense Department on Wednesday asked for public comment on a presidential directive to reform how the department acquires stuff, including mandating a preference for...","Wed, 09 Jul 2025 17:37:29 GMT"
Will Thursdays Meeting Seal the Merger of Khadki and Punes Cantonment Areas with PMC?,https://www.punekarnews.in/will-thursdays-meeting-seal-the-merger-of-khadki-and-punes-cantonment-areas-with-pmc/,"Years of Deliberation Nearing Conclusion? For the past four to five years, the merger of urban, non-military areas under cantonment boards with local municipal bodies has been under discussion across Maharashtra. Last year, the state government...","Wed, 09 Jul 2025 17:01:22 GMT"
South Korea puts brakes on follow-on Apache acquisition: Reports,http://breakingdefense.com/2025/07/south-korea-puts-brakes-on-follow-on-apache-acquisition-reports/,"...to Yoo.South Koreas defense ministry did not respond to Breaking Defenses request for comment Wednesday, and a US State ... tag of $3.5 billion under the Foreign Military Sales program. The 10 billion won originally budgeted for the program was to...","Wed, 09 Jul 2025 15:51:50 GMT"
Is there an amicable resolution to Devanahalli land acquisition row?,https://www.thehindu.com/videos/is-there-an-amicable-resolution-to-devanahalli-land-acquisition-row/article69792825.ece,"...spread across 13 villages in Devanahalli taluk, where it has proposed to build a defense and aerospace park.Is there a way out of this deadlock for the govt and farmers? We speak to Prakash Kammardi, an agricultural economist and former chairman...","Wed, 09 Jul 2025 15:20:27 GMT"
India Fast-Tracks Indigenous Drone Acquisition Amidst Operation Sindoor | Headlines,https://www.devdiscourse.com/article/headlines/3498527-india-fast-tracks-indigenous-drone-acquisition-amidst-operation-sindoor,"...deliberated by the defense ministry in an upcoming high-level meeting, according to defense sources. The project mandates ... indigenous content, drawing interest from major defense companies, sources disclosed.Potential contenders for the program...","Wed, 09 Jul 2025 14:08:12 GMT"
Moog: $63 Million Acquisition Of COTSWORKS,https://pulse2.com/moog-63-million-acquisition-of-cotsworks/,"...transceiver components for aerospace and defense, and the deal was financed through cash and Moogs Class A common stock.This acquisition allows Moog to enhance its Space and Defense component portfolio by integrating COTSWORKS advanced...","Wed, 09 Jul 2025 13:58:12 GMT"
