title,link,summary,published
The Defense Acquisition Program Administration (DAPA) announced on the 14th...,https://www.mk.co.kr/en/politics/11367002,"...an official at the Defense Acquisition Program Administration.Currently, the military authorities are developing landing... Ko Hyung-seok, head of the helicopter business division of the Defense Acquisition Program Administration (Army Brigadier...","Mon, 14 Jul 2025 01:04:12 GMT"
Trump blocks acquisition of equipment supplier Jupiter Systems by HK firm,https://www.dealstreetasia.com/stories/trump-jupiter-systems-449079,"...ownership of Jupiter relating to the potential compromise of Jupiters products used in military and critical infrastructure environments, the Treasury Department said in a statement.The department termed Suirui a company organized under the...","Mon, 14 Jul 2025 00:14:47 GMT"
Ja Morant Shares Thoughts On NBA Champion Acquisition,https://www.si.com/nba/grizzlies/news/ja-morant-shares-thoughts-on-nba-champion-acquisition-01k02pa88mk6,"""Bane is a much better score and shot creator, but Caldwell-Pope brings the perimeter defense that the Grizzlies could use, and he has historically been a great three-point shooter. Orlando didn't have a lot of playmaking, so he wasn't getting the...","Sun, 13 Jul 2025 21:01:51 GMT"
HEAD Completes AQUALUNG Group Acquisition in 50 Million Rescue Deal,https://www.sualtigazetesi.com/head-completes-aqualung-group-acquisition-in-e50-million-rescue-deal/,"Its equipment is used by divers in over 90 countries and trusted by recreational, military, and professional users alike.HEADs acquisition strategy builds on previous successes. MARES, acquired in 1971, has become a leading scuba brand. SSI...","Sun, 13 Jul 2025 17:55:10 GMT"
"BREAKING Iran Plans to Acquire 50 Sukhoi Su-57 Jets from Russia According to Reuters, after...",https://newsrt.us/breaking-iran-plans-to-acquire-50-sukhoi-su-57-jets-from-russiaaccording-to-reuters-after-the-successful/,"...capabilities. It reflects deepening Iran-Russia defense ties amid growing geopolitical tensions.If finalized, the deal would mark one of the largest military aircraft purchases in Irans modern history.,IranRussia ,Su57 ,IranMilitary...","Sun, 13 Jul 2025 18:06:16 GMT"
Czech National Bank now has stakes in crypto with Coinbase shares acquisition,https://www.cryptopolitan.com/czech-national-bank-stakes-in-coinbase/,"...Palantir, a software and artificial intelligence company with ties to the U.S. military, bringing its total holdings to 519,950 shares.The CNBs move appears to be rooted in passive index-tracking strategies rather than speculative intent...","Sun, 13 Jul 2025 12:22:00 GMT"
Hegseth Demands Major Pentagon Reform: Calls for Overhaul in Drone Acquisition Practices,https://tarbell.org/hegseth-demands-major-pentagon-reform-calls-for-overhaul-in-drone-acquisition-practices/,"...by the Defense Innovation Unit (DIU) under the Blue UAS initiative to certify commercial drones for military use. According... Jamal PetersonJamal Peterson reports on defense, aerospace, and tech policy. With a military background and a...","Sun, 13 Jul 2025 09:28:10 GMT"
...fafafa mega jackpot colored Acquisition to own Nintendo...,https://considera.es/marvel-greatest-alliance-step-three-the-new-black-fafafa-mega-jackpot-colored-acquisition-to-own-nintendo-switch/,...multiple objectives. Sooner or later the new X-Guys discover Magnetos intend to defense the world within the dark away from their ft on the Asteroid Yards. Every one of these membership observes you head proper and you will pummelled folks in your...,"Sun, 13 Jul 2025 07:37:39 GMT"
"South Korea Cancels Apache Helicopter Acquisition, Focuses On Drones And AI",https://voi.id/en/news/494660,"...Apache attack helicopters, shifting its defense priorities to unmanned systems and advanced artificial intelligence (AI) ... offensive operational strategies. However, defense officials noted that the price of helicopters in the US had jumped by 66...","Sun, 13 Jul 2025 04:50:37 GMT"
