title,link,summary,published
Could Ryan O'Reilly Be the Bruins' Next Big Trade Acquisition? (2025),https://traversesmag.org/article/could-ryan-o-reilly-be-the-bruins-next-big-trade-acquisition,"...debate about prioritizing offense over defense? Stick around, because we're diving deep into the rumors, the stats, and the ... plays in the offensive zone and anchoring defense. O'Reilly's known for his faceoff prowess basically, winning those...","Sat, 06 Dec 2025 03:42:55 GMT"
"Hapag-Lloyd eyes ZIM acquisition, workers push back",https://indiashippingnews.com/hapag-lloyd-eyes-zim-acquisition-workers-push-back/,"ZIM is the only shipping company that operated during the Swords of Iron war, delivering food, medicine, ammunition, and critical military equipment, the committee said. If the company passes into the hands of potentially hostile foreign...","Sat, 06 Dec 2025 03:11:31 GMT"
"Coordinator, Talent Acquisition - Immunitybio",https://builtin.com/job/coordinator-talent-acquisition/7568656,"Patrick Soon-Shiong has investigated mechanisms to activate the immune system to attack tumors that can otherwise evade and escape the bodys defense mechanisms. After inventing the worlds first protein nanoparticle drug, Abraxane, Dr. Soon-Shiong...","Sat, 06 Dec 2025 01:08:15 GMT"
Talent Acquisition Specialist (Contract),https://www.builtincolorado.com/job/talent-acquisition-specialist-contract/7902681,The future of aerospace and defense starts here.Ursa Major was founded to revolutionize how America and its ... launch. We design and deliver propulsion and defense systems that solve the most urgent and critical national security...,"Thu, 04 Dec 2025 01:54:51 GMT"
Safeguard Acquisition Corp. Announces Closing of $230 Million Initial Public...,https://nevadabusinessherald.com/article/872979094-safeguard-acquisition-corp-announces-closing-of-230-million-initial-public-offering-including-full-exercise-of-underwriters-over-allotment-option,"...geographic region, it expects to target opportunities and companies in the aerospace & defense, government services & national security, and space sectors.Jefferies acted as the sole book-running manager of the offering.A registration statement...","Sat, 06 Dec 2025 00:24:47 GMT"
Talent Acquisition Specialist (contract) - Ursa Major,https://builtin.com/job/talent-acquisition-specialist-contract/7902681,The future of aerospace and defense starts here.Ursa Major was founded to revolutionize how America and its ... launch. We design and deliver propulsion and defense systems that solve the most urgent and critical national security...,"Sat, 06 Dec 2025 00:24:46 GMT"
Trump DOJ Slams Netflix as 'Woke Garbage' Amid Warner Bros. Acquisition Probe,https://www.ibtimes.com/trump-doj-slams-netflix-woke-garbage-amid-warner-bros-acquisition-probe-3792066,"...after the US military's media officeunder the direction of Pete Hegseth as Secretary of Defenceslammed Netflix's gaymilitary drama Boots.In a statement, Pentagon press secretary Kingsley Wilson said the US military 'will not compromise our...","Fri, 05 Dec 2025 23:37:39 GMT"
Quick Target Acquisition with Red Dots,https://martinarawk959839.pointblog.net/quick-target-acquisition-with-red-dots-87634912,"...variety of firearms, making them a versatile choice for both competition and self-defense purposes. Sights and Optics: Red Dot vs. IronWhen it comes to selecting your sights for your firearm, the age-old debate between red dot and mechanical...","Fri, 05 Dec 2025 21:47:00 GMT"
NioCorp's Acquisition of FEA Materials Paves the Way for a US Scandium Supply Chain,https://investingnews.com/niocorp-acquires-fea-scadium-tech/,The is move is expected to position NioCorp as a domestic producer of aluminum-scandium (Al-Sc) master alloy amid growing demand in defense and commercial markets.The US$8.4 million all-cash purchase complements the companys Elk Creek critical...,"Fri, 05 Dec 2025 21:15:00 GMT"
News Navy Talent Acquisition Group Ohio River Valley Welcomes New Commanding Officer,https://www.dvidshub.net/news/553183/navy-talent-acquisition-group-ohio-river-valley-welcomes-new-commanding-officer,"...its change of command ceremony on board Defense Supply Center Columbus, Ohio, Dec. 5.Commander Stephen Richter assumed... Copeland said during the ceremony. In military tradition the change of command ceremony signifies trust, as we move...","Fri, 05 Dec 2025 21:18:25 GMT"
Boeing signs replace Spirit logos as merger nears completion,https://www.kwch.com/2025/12/05/boeing-signs-replace-spirit-logos-merger-nears-completion/,"...ContentDefense work to continueSpirit Aerosystems manufactures parts for commercial planes, defense platforms and ... retain that work for the other companies, defense companies who are using Spirit. Boeing is required to continue that work,...","Fri, 05 Dec 2025 20:57:53 GMT"
NetflixWB Merger & a Name America Cant Stop Googling,https://www.iheart.com/podcast/85-gary-and-shannon-27401728/episode/netflixwb-merger-a-name-america-311207139/,"Speaker 2 (24:34): It's a pretty good defense, isn't it.Speaker 1 (24:35): I agreed Nati, and I don't remember the end ... that because right,like then that's my defense.Speaker 2 (26:43): How why would it be me? Like why would Iframe...","Fri, 05 Dec 2025 20:52:21 GMT"
Avon pledges no job losses in SA amid merger,https://za.headtopics.com/news/avon-pledges-no-job-losses-in-sa-amid-merger-76799378,"...Moscow. The discussions, hosted by Prime Minister Narendra Modi, focused on energy, defense, and trade, with Putin emphasizing Russia's role as a reliable supplier. This comes as India navigates a diplomatic challenge, balancing its reliance on...","Fri, 05 Dec 2025 20:38:00 GMT"
Safeguard Acquisition Corp. Announces Closing of $230 Million Initial Public Offering Including ...,https://www.gurufocus.com/news/3236195/safeguard-acquisition-corp-announces-closing-of-230-million-initial-public-offering-including-full-exercise-of-underwriters-overallotment-option,"...geographic region, it expects to target opportunities and companies in the aerospace & defense, government services & national security, and space sectors.Jefferies acted as the sole book-running manager of the offering.A registration statement...","Fri, 05 Dec 2025 20:15:19 GMT"
Safeguard Acquisition raises $230 million in IPO with full overallotment,https://www.streetinsider.com/Equity+Offerings/Safeguard+Acquisition+raises+$230+million+in+IPO+with+full+overallotment/25705728.html,"...one or more businesses. The company plans to target opportunities in aerospace and defense, government services and national security, and space sectors.Jefferies served as sole book-running manager for the...","Fri, 05 Dec 2025 19:41:09 GMT"
The Automation Edge: Why Manual Processes Are a Losing Bet in iGaming Acquisition,https://www.solutiontipster.com/2025/12/losing-bet-in-igaming-acquisition/,"...or underperforming campaigns. Automation provides the necessary agility.Active Defense: The platform delivers real-time statistics and optimization, giving managers an immediate, actionable view of performance. This speed allows for instant...","Fri, 05 Dec 2025 17:39:45 GMT"
Davie Defense Finalizes Gulf Copper & Manufacturing Acquisition,https://www.waterwaysjournal.net/2025/12/05/davie-defense-finalizes-gulf-copper-manufacturing-acquisition/,"Davie Defensea U.S. defense shipbuilder and part of Inocea, a privately held British-based ... complex, high-precision defense projects in Texas. Kai Skvarla, CEO of Davie Defense, will assume the role of CEO of Gulf...","Fri, 05 Dec 2025 17:01:22 GMT"
How Netflix and Warner Bros' Merger Will Affect You,https://us.headtopics.com/news/how-netflix-and-warner-bros-merger-will-affect-you-76790341,...citing specific examples and court precedents.New York Times sues Pentagon over Defense Secretary Hegseths new media restrictionsThe Times says in the suit filed Thursday that the rules violate the Constitutions freedom of speech and due process...,"Fri, 05 Dec 2025 16:27:00 GMT"
