title,link,summary,published
"Data Acquisition System Market worth $3.73 Billion by 2030, at a CAGR of 5.9%",https://news.delawarenewsreporter.com/story/554891/data-acquisition-system-market-worth-373-billion-by-2030-at-a-cagr-of-59.html,"...includes various industries: aerospace & defense, energy & power, automotive & transportation, healthcare, food & beverages ... applications. Industries such as aerospace & defense, automotive, telecom, and electronics require real-time inspection of...","Thu, 21 Aug 2025 04:39:08 GMT"
RRP Defense shares rise 2% after signing term sheet to acquire majority stake in drone and...,https://www.businessupturn.com/finance/stock-market/rrp-defense-shares-rise-2-after-signing-term-sheet-to-acquire-majority-stake-in-drone-and-innovation-firms/,"...RRP Defense will hold a controlling stake in the two companies, thereby strengthening its footprint in advanced defense and ... Asia Exports Limited, RRP Defense has been actively diversifying into defense technology, innovation, and strategic tie-ups...","Thu, 21 Aug 2025 04:10:15 GMT"
Philippine Navy inspects Japanese destroyer escort for possible acquisition,https://www.byteseu.com/1305816/,...this month to inspect a Maritime Self-Defense Force destroyer escort.The Philippine Navy is considering acquiring... They are equipped with anti-ship missiles.Japans Defense Ministry plans to retire all six of the MSDFs vessels of this...,"Thu, 21 Aug 2025 03:59:06 GMT"
Five things I learned at an HR and Talent Acquisition Conference as a Veteran in transition,https://globalhrreporter.com/article/841688311-five-things-i-learned-at-an-hr-and-talent-acquisition-conference-as-a-veteran-in-transition,"...complex and personal the journey from military to civilian life can be. I recently attended the Direct Employers Association ... that aims to ease the transition from military to the civilian workforce, put it, Veterans are not a quota. Theyre people...","Thu, 21 Aug 2025 03:02:21 GMT"
L Squared Capital Partners Marks Milestone 10th Acquisition at BTX Precision with Addition of High Tech Solutions,http://www.businesswire.com/news/home/20250820835953/en/L-Squared-Capital-Partners-Marks-Milestone-10th-Acquisition-at-BTX-Precision-with-Addition-of-High-Tech-Solutions/?feedref=JjAwJuNHiystnCoBq_hl-Rc4vIAVcHHkbDcwJimU8QtrtlakeQ9hNboBqTAWIjTge3KWq9s9jif-UkBjBsFRyYAbRTSLTc1mgvhPlnaBA55M-oupQnbXnhKsYk8RmHF_kAy2gZikaX3QWV6xOvgFlA==,"NEWPORT BEACH, Calif.--(BUSINESS WIRE)--L Squared Capital Partners is pleased to announce that its portfolio company, BTX Precision (BTX or the Company), has acquired High Tech Solutions LLC (HTS), a Kansas City based precision manufacturer of aerospace components serving the commercial, business jet, and space end markets. The acquisition marks BTXs 10th transaction since the platforms inception, further cementing its position as the nations most trusted provider of advanced build-to-","Wed, 20 Aug 2025 13:00:00 UT"
